Page ID,Page Name,Disclaimer,Amount Spent (USD)﻿
1718598435126853,EcoReal Academy,"Ecological Services and Markets, Inc.",≤100
174233076600386,Commissioner Stan Sallee - Tulsa County District 1,District 1 County Commissioner - Stan Sallee,≤100
207033659336173,Clean Elections,Citizens Clean Elections Commission,≤100
1799282383731277,TwoSeventy,Alexander Jared Deutsch,≤100
167790979928453,Women of the World,Samira Ridha Harnish,≤100
2239612502972248,Friends of Car-Free Key West,These ads ran without a disclaimer,≤100
73528878871,Center for Reproductive Rights,Center for Reproductive Rights,≤100
100711091475290,Bill Brough State Assembly 2020,"Bill Brough for Assembly 2020, FPPC# 1415006",≤100
674716296319159,Cody Petterson,Jonathan Cody Petterson,≤100
360434647914542,Andrea Cardenas for Chula Vista City Council,Andrea Cardenas for City Council District 4 2020,≤100
102783903427796,Kate Brown,Kate Brown Committee,≤100
1434747820157997,Mark O'Loughlin for Pembroke Pines Commission,Mark O'Loughlin Campaign,≤100
1449073545419430,The Lone Liberal Republican,Arthur Winter,≤100
167686259995685,Shen Yun,These ads ran without a disclaimer,≤100
533987556776948,Campaign for Sustainable Rx Pricing,Campaign for Sustainable Rx Pricing,≤100
2352551028300986,Honua Ola,Honua Ola Bioenergy,≤100
1207622149401746,Hindi's Libraries,Leslie R Gang,≤100
838522986526962,US Law Shield of Alabama,Michael L Hilton,≤100
2284466715130264,Our Mississippi Our Future,Nature Conservancy,≤100
117483769628442,Edwin Mendez for Cobb,Edwin  Mendez,≤100
110084810548569,Elect Ward A. Nelson Estes Park Trustee,Ward Anton Nelson,≤100
360424321432255,Doha Debates,Doha Debates,≤100
2307498762819752,Collection,Collection,≤100
103260781250999,steveremusgop,Steven Robert Remus,≤100
113666459994300,Big Dan Rodimer for Congress,RODIMER FOR CONGRESS,≤100
101188911404045,"Michelle Antoine - JoCo Advocate for Students, Teachers & Schools",Friends of Michelle Antoine,≤100
926692184144219,Real is a Diamond,DIAMOND PRODUCERS ASSOCIATION,≤100
107928540736629,Eboni Johnson-Rose for Judge,Committee to Elect Eboni Johnson-Rose,≤100
636093333133893,UCR School of Public Policy,UCR School of Public Policy,≤100
436792636865579,Charmaine McGuffey For Sheriff,People for McGuffey for Sheriff,≤100
17203056985,Partners In Health,Partners In Health,≤100
127553923934162,State Representative Ryan Williams,Citizens For The Right Way,≤100
113834070042711,"Re-Elect Dr. Zickeyous Byrd, Superintendent of Conecuh County Schools",Zickeyous Montreds Byrd,≤100
113269308707177,La Voz Bilingual Newspaper,La Voz Bilingual Newspaper,≤100
107944290764791,"Protecting Sacramento, Vote No on Measure G","Protecting Sacramento, Vote No on Measure G, Sponsored by Sacramento Area Firefighters Local 522",≤100
2363271500609808,Armitage For Congress,ARMITAGE FOR CONGRESS,≤100
216311481960,Bill Gates,Bill Gates,≤100
530604487365010,Old Glory Flagpole Kits,Service First Flag Poles,≤100
516062158520807,David Stringer,Conservatives for Stringer,≤100
312502872211924,Culture Flock,Culture Flock,≤100
49651787874,Jane Kim,Jane Kim for SF Central Committee,≤100
141107065924669,PPAF Pacific Southwest,Planned Parenthood Action Fund of the Pacific Southwest,≤100
100651321326897,CareFirst Urgent Care - Florence,These ads ran without a disclaimer,≤100
274975862998213,Profs and Pints,Profs and Pints,≤100
104384991057735,Betsy Dirks for Supervisor,Betsy Dirks for Supervisor 2020,≤100
163965296965203,32BJ SEIU,LOCAL 32 BJ SEIU,≤100
109562883906974,Brett Keasler for Superintendent of Education,Brett Dwayne Keasler,≤100
2054657794849071,"Re-Elect Dan O'Leary, Republican, for Washington Township Supervisor",Daniel Francis Oleary,≤100
216188121814450,San Diego & Imperial Counties Labor Council,San Diego and Imperial Counties Labor Council,≤100
572946842722169,Jake LaTurner,KANSANS FOR LATURNER,≤100
39910576365,National Alliance for Public Charter Schools,NATIONAL ALLIANCE FOR PUBLIC CHARTER SCHOOLS,≤100
158002573510,Americans for Prosperity-Nebraska,AMERICANS FOR PROSPERITY,≤100
1880507922255279,Question PAC,QUESTION PAC,≤100
113575490062092,Ramon Iglesias for Hendry County Commission,Ramon Iglesias for Hendry County Commission,≤100
102005441293700,dank.vids8,These ads ran without a disclaimer,≤100
23875187730,Feeding America,Feeding America,≤100
106808627333095,Nithya for the City,Nithya for the City,≤100
110095318521,Miami-Dade Animal Services,Miami-Dade County Animal Services Department,≤100
254805757891768,Naples Zoo at Caribbean Gardens,Naples Zoo,≤100
454921674555473,Families Against Government Abuse,These ads ran without a disclaimer,≤100
131795723561302,Bay Area Chamber of Commerce,These ads ran without a disclaimer,≤100
487254698110989,Amy Shuklian for Tulare County Supervisor,Amy Shuklian for Tulare County Supervisor,≤100
119891055362589,"Lira Bravo & Martinez Arroyo, PLLC",LIRA BRAVO & MARTINEZ ARROYO PLLC,≤100
129159563777523,Conservancy of Southwest Florida,ST OF FL CONSERVANCY OF S,≤100
203805062990264,Ben Shapiro,The Daily Wire,≤100
110996737015470,Rick McClure For Rep 26,Ricky Carl Mcclure,≤100
106620192726777,Choices for Victims of Domestic Violence,CHOICES for Victims of Domestic Violence,≤100
1529468987331408,BulbHead,Jahan Khubani,≤100
213792049451918,Stand For America Now,Stand For America Inc,≤100
1772032513072979,AgreenA,These ads ran without a disclaimer,≤100
38235851310,USA for UNHCR,UNITED STATES ASSOCIATION FOR UNHCR,≤100
191561687596446,Wisconsin Institute for Law & Liberty,Wisconsin Institute for Law & Liberty,≤100
109938369029726,Sock City,These ads ran without a disclaimer,≤100
365063367741397,Amanda Matchett for Minnesota,Amanda Matchett for Minnesota,≤100
185026128216027,Americans for Prosperity-Kansas,AMERICANS FOR PROSPERITY,≤100
300341323465160,The Daily Signal,HERITAGE FOUNDATION (THE),≤100
179508258738036,American Council of Life Insurers,"AMERICAN COUNCIL OF LIFE INSURERS, INC.",≤100
167418116629106,Austin Street Center,SHELTER MINISTRIES OF DALLAS,≤100
486743808728522,Kiani Gardner for Congress,COMMITTEE TO ELECT KIANI GARDNER,≤100
2816738878351202,Jonathan Q. Warren for Circuit Judge,Jonathan Q. Warren for Circuit Judge,≤100
356880718518730,Joseph Chaplik for Arizona House - LD 23,Joseph Chaplik LD 23,≤100
840998846269229,Richard Rowe for Congress,Richard Allen Rowe,≤100
1920882228233015,Dr Means for House,Friends of Aaron Means 2020,≤100
112608510286449,Tim2020,Tim2020,≤100
254463751303529,Mayor Tim Keller,City of Albuquerque,≤100
101618501258318,Shandon Phan,SHANDON PHAN FOR CONGRESS,≤100
135500133147357,ProEnglish,US INC,≤100
203330919857759,All On The Line,National Redistricting Action Fund,≤100
19240725027,SEIU Local 521,SEIU Local 521,≤100
888123531223968,EdChoice Kentucky,EdChoice Kentucky,≤100
85919396802,Natural Delights Medjool Dates,These ads ran without a disclaimer,≤100
100884308117626,thewaynediamond,These ads ran without a disclaimer,≤100
162942890728,Delta Township,Delta Township,≤100
100637151406626,USA 1776,Francisco Javier Vigil Fuentes,≤100
1836138529938551,Greater Half,Billy Benson,≤100
746938465317981,Nuclear Matters,Nuclear Matters,≤100
309993142375589,Joe Kennedy III,KENNEDY FOR MASSACHUSETTS,≤100
170143182874,Run for Clean Air,DELAWARE VALLEY CITIZENS COUNCIL FOR CLEAN AIR,≤100
491362440908122,The Beer Institute,BEER INSTITUTE,≤100
116691869736261,Randy For State Senate,Randy for State Senate,≤100
117684604922023,Regional Recycling and Waste Reduction District,Regional Recycling and Waste Reduction District,≤100
1087474374640616,Vocal,"Vocal Ventures, LLC",≤100
109485893717036,Craig Brown For Mayor,Craig Brown for Mayor,≤100
100783241291133,Valerie Starkey for Supervisor-District 2,Valerie Ann Starkey,≤100
281618778426,River Network,RIVER NETWORK,≤100
8086612973,Museum of Jewish Heritage - A Living Memorial to the Holocaust,Museum of Jewish Heritage,≤100
853164485062034,Matt Fridy for Court of Civil Appeals,Friends of Matt Fridy,≤100
1075724012570584,Mo Iqbal for State Representative,Citizens for Iqbal,≤100
103077564594158,KY for Mike,Mike Bloomberg 2020 Inc,≤100
223635794750555,Rep. Mike Gallagher,the Office of Rep. Mike Gallagher,≤100
271953073708695,National Senior Benefits,National Senior Benefits,≤100
554060668410227,Keep David Cooke District Attorney,Committee to Elect David Cooke,≤100
403972530070764,Robbie Rozelle,These ads ran without a disclaimer,≤100
107026567542760,John Hidahl for Supervisor,Campaign to Elect John Hidahl Supervisor 2020,≤100
105698674239617,Embed News,Embed News,≤100
88048989460,California Teachers Association,California Teachers Association,≤100
252814820267,HIAS,HIAS,≤100
136873393060481,Denver Arts & Venues,These ads ran without a disclaimer,≤100
482593295833044,Virginia is for Restaurant Lovers,"Virginia Restaurant, Lodging & Travel Association",≤100
510709349101737,Speak Up,SPEAK UP,≤100
100119674905643,Downey Proud,Gary Wayne Lawson,≤100
976930399063858,Covina Proud,Proud Digital Media,≤100
602373946590030,"Raising Grades, Lifting Futures",Education Reform Now,≤100
103348724514356,Abbasi for Supervisor 2020,Abbasi For Supervisor 2020,≤100
214536049346,VPIRG,VERMONT PUBLIC INTEREST RESEARCH GROUP,≤100
350914689303,AARP Iowa,AARP,≤100
108664213979637,"Elect Don Hill, Republican - Texas District 5 U.S. House of Representatives","DON HILL FOR CONGRESS, INC.",≤100
6485101073,Tides,Tides Foundation,≤100
210368456477,Vermont Natural Resources Council (VNRC),Vermont Natural Resources Council,≤100
110244107183287,Hare for Sheriff,Hare for Sheriff,≤100
1151226001683046,Luz Collective,Luz Collective,≤100
184000548869174,Gastonia Freedom School,Gastonia Freedom School,≤100
101245404605194,Terrika Shaw for District Court Judge,Terrika Vanescia Shaw,≤100
5720973755,Defenders of Wildlife,DEFENDERS OF WILDLIFE,≤100
105405850844814,Mark Whitney for President,Ellerton Pratt Whitney,≤100
1507689979455306,American Bail Coalition,American Bail Coalition,≤100
2095616183795043,Audia Jones For Change,Committee To Elect Audia Jones,≤100
418087238731140,Robert Peters for Senate,Peters for Illinois,≤100
1556323534653761,Richard Attias & Associates,Richard Attias & Associates,≤100
2230952250272412,U're Funny Tees,Mark Jason Herrera,≤100
180193808783144,iTRI 365,iTri365,≤100
110497717105451,Cargile for Congress,CARGILE FOR CONGRESS,≤100
1676291615740480,Rental Affordability Act,Homeowners and Tenants United,≤100
30279992077,Downtown Lee's Summit,"DOWNTOWN LEE'S SUMMIT MAIN STREET, INC.",≤100
8524198486,Physicians Committee for Responsible Medicine,"PHYSICIANS COMMITTEE FOR RESPONSIBLE MEDICINE, INC.",≤100
103787021133687,Elect Marlene Gonzalez 388 DC,Marlene Gonzalez Hernandez,≤100
746211745534477,Nida Allam,Committee to Elect Nida Allam,≤100
100137754724934,Trump 2020 Supporters,Proud Right Winger,≤100
1078422915600849,Draw the Lines PA,COMMITTEE OF SEVENTY,≤100
101591687895620,50 States Action Fund,50 States Action Fund,≤100
25121889784,Texas Public Policy Foundation,Texas Public Policy Foundation,≤100
2338804136409050,Macek For Sheriff,Macek For Sheriff,≤100
104924592906497,Rep. Mike Ramone,"Delaware House of Representatives, Republican Caucus",≤100
21375324480,The Heritage Foundation,HERITAGE FOUNDATION (THE),≤100
108973947134532,Samuel Hickman for Congress,HICKMAN FOR CONGRESS,≤100
101157091318477,RNC Tax Services,Ramon Luis Rentas Leon,≤100
280017515345903,Andy Manar,Friends of Andy Manar,≤100
126929400651134,Pennsylvania Health Access Network,PA HEALTH ACCESS NETWORK,≤100
1632866270065962,Jewish Democratic Council of America,Jewish Democratic Council of America,≤100
18067635868,Putney Student Travel,PUTNEY STUDENT TRAVEL INC,≤100
497433567299699,Overstreet 2020,Overstreet 2020,≤100
421870738175616,Danny Riehm for Jefferson Republican PEC - District 4,Danny Riehm for Jefferson Republican PEC - District 4,≤100
330617944306531,Jerica Richardson,Jerica Marie Richardson,≤100
181377922519585,Jgiddinsthefather,These ads ran without a disclaimer,≤100
51274163696,ACLU of Washington,American Civil Liberties Union of Washington,≤100
147918345434,ATPE - Association of Texas Professional Educators,ASSOCIATION OF TEXAS PROFESSIONAL EDUCATORS,≤100
991572110884333,Bruce Porter,Porter for Supervisor 2020,≤100
103446009808,CASA of Yellowstone County,"YELLOWSTONE CASA, INC.",≤100
1113423372074840,Willmar Area Women's Fund,Willmar Area Women's Fund,≤100
889287538094365,Santa Cruz United,Santa Cruz United,≤100
20446254070,Business Insider,These ads ran without a disclaimer,≤100
684267848682256,Leigh Altman for County Commission,Leigh Altman for County Commission,≤100
467854917299031,Committee to Elect Kelly Marie McCarthy for Judge,Committee to Elect Kelly Marie McCarthy for Judge,≤100
1032024236842744,Marsy's Law for Kentucky,"Marsy's Law for Kentucky, LLC",≤100
423765287805463,Rafa Castellanos for County Supervisor,"Rafael Castellanos for Supervisor 2020, FPPC# 1414443",≤100
409179052515324,Forrest Dunbar,Forrest for Mayor,≤100
158517184208081,Boulder County Democratic Party,Boulder County Democratic Party,≤100
111521280410527,"Kiwanis Club of Lorain, Ohio",Kiwanis International,≤100
101032921401465,Roger Salinas For McLennan County Commissioner Precinct 1,Roger Salines for McLennan County Commissioner Precinct 1,≤100
112414940196296,manana,These ads ran without a disclaimer,≤100
116959709691346,Shelby Review,Metric Media LLC,≤100
309660569121570,"Mitch O'Connell, The World's Best Artist! By Mitch O'Connell",Mitchell R O Connell,≤100
1977901852451222,Laura Friedman,Laura Friedman for Assembly 2020,≤100
317382260876,Wheaton Cosmetic Dentistry,These ads ran without a disclaimer,≤100
113975140049132,Wayne Reid,Wayne A Reid,≤100
271816797008998,Mike Brownrigg for State Senate 2020,Brownrigg for State Senate 2020,≤100
353682792005802,Heather Mulligan Begley for Judge,Committee to Elect Heather Begley for Judge,≤100
126499578750103,Beth Henderson,Beth for Indiana,≤100
109005187317369,A Better Anchorage,"Yes for a Safe, Healthy Anchorage",≤100
169294473121454,Policetees.com,PoliceTees.com,≤100
102902521232467,Michael King For Tyler County Sheriff,Alicia Kaye King,≤100
111658007041358,North Carolina for Tom 2020,TOM STEYER 2020,≤100
106559767516191,My Online Cert,My Online Cert,≤100
316341622318073,Congressman Jim Hagedorn,Congressman Jim Hagedorn,≤100
1679402428737441,Brad Buckley for Texas,Brad Buckley For Texas,≤100
48638948196,"City of Winston-Salem, NC - Government",These ads ran without a disclaimer,≤100
1255599717912012,Senator Sean McCann,Senator Sean McCann,≤100
112492646811151,California Census,CA Census 2020,≤100
111663158887300,Tacoma Rescue Mission,"RESCUE MISSION, THE",≤100
932644993472611,Kathryn Whittington Ashtabula County Commissioner,Citizens for Whittington,≤100
2215936995384536,Justice Cynthia Cobbs for Supreme Court of IL,Committee to Elect Justice Cynthia Y. Cobbs,≤100
86217603869,"The Goulding Agency, LLC",Paul George Goulding,≤100
280621698709756,Greg Gutfeld,Aric T Webb,≤100
855138414631305,St. Johns Volunteers,St. Johns Volunteers,≤100
157424581125374,Jacey Jetton for State Rep,Jacey Jetton Campaign,≤100
111393882812494,Amy McGrath,"AMY MCGRATH FOR SENATE, INC.",≤100
1521330774781420,Chicago Immigration Advocates Law Offices,James C Ten Broeck,≤100
102148941180149,Duval Street Media,These ads ran without a disclaimer,≤100
103156981159122,Beyond Patriots,Beyond Patriots LLC,≤100
178563478969599,Valerie Cartright For Senate,Committee To Elect Valerie M. Cartright To Senate,≤100
17901934974,Anthony G. Brown,ANTHONY BROWN FOR CONGRESS,≤100
44951363957,American Enterprise Institute,American Enterprise Institute,≤100
90231635720,Illinois Holocaust Museum & Education Center,Illinois Holocaust Museum & Education Center,≤100
521010658436453,Mike Ghassali For Congress,GHASSALI FOR CONGRESS,≤100
265915710125206,The Nature Conservancy in California,Nature Conservancy,≤100
444418959099711,Darrell Park for Supervisor,Darrell Park for Supervisor 2020,≤100
714420095625020,Heymaybu,Ruben Alvarez,≤100
573084822773932,Joe Perkins for Circuit Judge Campaign Committee,Joe Perkins for Circuit Judge Campaign Committee,≤100
103844480955531,Dr. Chris Magiera for Congress,"FRIENDS OF CHRIS MAGIERA, INC.",≤100
108971449133,Fisher House Foundation,"FISHER HOUSE FOUNDATION, INC.",≤100
1402630976626068,Adelante con Patricia NM House District 13,Campaign to Elect Patricia Roybal Caballero,≤100
1913021555647128,Vintage Green Review,"Vintage Green Review, LLC",≤100
39197138659,ACLU of New Mexico,ACLU of New Mexico,≤100
100380224841094,Murray Simpkins for Harnett County Commissioner District 5,Murray Simpkins 2020,≤100
108641917392578,Holly Cobb for Board of Education,Holly Cobb for Board of Education,≤100
2839948369563928,Scott Costello for US Congress NW Indiana,Scott Leonard Costello,≤100
1526736227567131,TrueCoverage,True Coverage,≤100
49560242814,Consumer Energy Alliance,CONSUMER ENERGY ALLIANCE,≤100
592707041080920,Stand Together,Stand Together Chamber of Commerce Inc.,≤100
120637961296541,The Lawfare Project,The Lawfare Project,≤100
461466040587767,Rescue Missions Ministries Thrift Stores,Durham Rescue Mission,≤100
98201257358,"City of Arlington, TX - City Hall","City of Arlington, TX",≤100
667566363351724,Washington State School Retirees' Association,Peter Michael Diedrick,≤100
460098290714907,Project Sentinel,"PROJECT SENTINEL, INC.",≤100
101878191305861,Rodney Casteel for North Rock Creek,Rodney Dale Casteel,≤100
123676835699406,Adam Niemerg for State Representative for 109th District,Committee To Elect Adam Niemerg,≤100
157622235096160,Jim Davis,JIM DAVIS FOR CONGRESS,≤100
2239612502972248,Friends of Car-Free Key West,Christopher Robert Hamilton,≤100
507935139377269,Chino Hills Proud,Proud Digital Media,≤100
108975720632337,Kari Kraft,These ads ran without a disclaimer,≤100
115845073137324,Emmanuel Zamora for Constable Pct. 6 Uvalde County,Emmanuel Zamora,≤100
153171891404218,Common Sense Policy Roundtable Forum,Common Sense Policy Roundtable Forum,≤100
1335225583265331,Independent Oil and Gas Association of West Virginia,"Independent Oil and Gas Association of West Virginia, Inc.",≤100
103364547804904,Affordable Home,State Home Relief Program,≤100
602714436529710,End Citizens United,END CITIZENS UNITED,≤100
201933523679709,Judge Beau Liegeois,The Committee to Retain Judge Beau Liegeois,≤100
146918864568,Illinois Farm Bureau,ILLINOIS AGRICULTURAL ASSOCIATION,≤100
1268410219898273,Tango Tango,These ads ran without a disclaimer,≤100
931707463555911,Peter Amundson,Amundson for City Council 2020,≤100
386161758665696,Rich Finneran,Finneran for Missouri,≤100
115681639874406,Jan Sangh Party.Uttrakhand,These ads ran without a disclaimer,≤100
1837356789847797,Fulcrum News,David George Seaman,≤100
527517893943355,Worldstrong Athletics,Worldstrong Athletics,≤100
1083949645080409,Bob Statchen for State Senate,Robert R Statchen,≤100
114187203459824,Brandon Hood,Brandon Wesley Hood,≤100
2202177140098501,Tamerlin Godley for City Council,TAMERLIN GODLEY FOR CITY COUNCIL,≤100
110801930291321,Eisenberg and Baum,"Eisenberg & Baum, LLP",≤100
6985452607,Brita USA,The Clorox Company,≤100
2036389409806378,Backpage's Role in Prostitution and Trafficking,X Social Media LLC,≤100
106172714114950,Champer for Commissioner,Darrell Eugene Champer,≤100
130128870345442,The Lilith Fund for Reproductive Equity,Lilith Fund,≤100
1033888756660734,Steel City Solar,These ads ran without a disclaimer,≤100
119301938161886,Assure Women's Center,Assure Women's Center,≤100
1519505885040322,Robert "Robby" Martin for Hardin County Commissioner PCT 3,Robert Phillip Martin,≤100
101808641357930,Option 1st Inc,These ads ran without a disclaimer,≤100
399672514235336,Floyd McLendon for TX-32,Floyd McLendon for Congress,≤100
383821768741044,Woodsmall for Congress,Woodsmall for Congress,≤100
276484545808884,Friends of Dry Comal Creek,Preserve Our Hill Country Environment,≤100
112054310165227,Rancho Murieta Thrive,These ads ran without a disclaimer,≤100
7992407870,United Way of the Midlands,UNITED WAY OF THE MIDLANDS,≤100
328065780936817,Forest Fire Facts,Forest Fire Facts,≤100
204052376639004,Suits For Seniors,These ads ran without a disclaimer,≤100
102661834419031,Antonio 'Tony' Munoz for State Senate,Citizens for Antonio Tony Munoz,≤100
379338692227120,Assemblyman Tom Lackey,Assemblyman Tom Lackey,≤100
206629526173676,State Representative David Leland,Friends of David Leland,≤100
110627815623797,Minnesota Pork,Katelyn Ann Gradert,≤100
296901963845301,Physician Housecalls,Physician Housecalls,≤100
128569780566,San Diego LGBT Community Center,These ads ran without a disclaimer,≤100
296764627005582,Greg Hill For Congress,GREG HILL FOR CONGRESS,≤100
170582513587720,Liberty Through Wealth,The Oxford Club,≤100
106517014246373,jamesmichael89,These ads ran without a disclaimer,≤100
854748721570632,A Second Opinion,Motus Creative Group,≤100
357289388245551,Lisa Liang,These ads ran without a disclaimer,≤100
488460945012999,President Trump 2020,Trump Collections,≤100
50540749125,International Orthodox Christian Charities,"INTERNATIONAL ORTHODOX CHRISTIAN CHARITIES, INC.",≤100
103987621214938,Sieliforcommissioner,Sieli for Commissioner,≤100
103095887825967,Jason Stoffel For Judge,Jason Stoffel,≤100
38471053686,Elizabeth Warren,"WARREN FOR PRESIDENT, INC.",≤100
600233073348954,Nebraska Family Alliance,Nebraska Family Alliance,≤100
1264775870284364,Catrayel N Wood,Catrayel Wood for Supervisor 2020,≤100
301328283573554,TechEquity Collaborative,TechEquity Collaborative,≤100
149497411782692,Galiher DeRobertis & Waxman LLP,Galiher DeRobertis Waxman,≤100
104411601140745,Pitkin County Elections,Pitkin County Elections,≤100
289446947817747,Global Citizen,"GLOBAL POVERTY PROJECT, INC.",≤100
264674204408717,Atlantic Key Energy,Atlantic Key Energy,≤100
108331600555090,Christine Hortick for County Commissioner Precinct 3,Christine Hortick Campaign,≤100
105953917589790,TN for Mike,Mike Bloomberg 2020 Inc,≤100
207193359868401,College Radio,These ads ran without a disclaimer,≤100
115835983124020,Vote for Bobby Martinez Olson for Illinois House - 2nd District,Bobby Martinez Olson,≤100
582293558518300,Abby Broyles,Abby Broyles,≤100
102957957964408,Don't Tax Our Tech,Don't Tax Our Tech,≤100
316498251698370,Adam Gray for Assembly,Gray for Assembly 2020,≤100
151578225365662,Bushra Amiwala,Bushra  Amiwala,≤100
1787149304864079,Representative Mike McKell,Mike McKell for Utah House,≤100
103159474491336,Stephens for Supervisor 2020,Committee to Elect Daures Stephens for Supervisor 2020 FPPC#1423010,≤100
112842856909939,No Novato Tax,Tina Gale Mcmillan,≤100
115310769890538,Sadie's Joy Education,Leif Neil Olson,≤100
469572736766472,La Pointe Foundation,These ads ran without a disclaimer,≤100
2246364628908665,Uniting Missouri,Uniting Missouri,≤100
1729198467311786,G.A. Matiasz,George Anthony Matiasz,≤100
107930657282517,Heather Boyle for MWRD Commissioner,Daniel S Donnelly,≤100
100461044897952,Deana Igelsrud,Deana Marie Igelsrud,≤100
101455931403422,Support WE Schools,Willoughby Eastlake Levy Committee,≤100
75353945070,Boxed Water Is Better,Boxed Water Is Better,≤100
475456956305422,All Voting Is Local,The Leadership Conference on Civil and Human Rights,≤100
425166955006098,Kimberly Hardy - New Voice for Cumberland,Kimberly Hardy for NC,≤100
29092950651,TED,TED Conferences,≤100
15771560300,Earthjustice,EARTHJUSTICE,≤100
175403889150682,FindLaw.com,FindLaw Consumer,≤100
642095866249364,Mikey,Michael George Saoma,≤100
100213904808927,"Ray Toups III for Plaquemine City Council, District 4",Ray A Toups,≤100
100481081424285,"Kashi Adhikari for Ohio State Representative, District 22",Mahindra Adhikari,≤100
141150193145274,Judge Patty O'Caña-Olivarez,Patty O'Caña-Olivarez Campaign,≤100
1581844432057338,Embassy Theatre,These ads ran without a disclaimer,≤100
114311866624505,St. Clair Today,Metric Media LLC,≤100
219198242350576,Team Burningham,Burningham for Governor,≤100
1465339046863552,Cherokee Christian Schools,CHEROKEE CHRISTIAN SCHOOL INC,≤100
242475319989441,ReRoute The Route,ReRoute the Route,≤100
361392204618279,Belén Bernal,Maria Belen Bernal,≤100
437926846704348,Scott Prescher Campaign - Watauga City Council Place 1,Scott Lance Prescher,≤100
323093251713475,Brett Kokinadis for Congress,IMAGINE BRETT FOR CONGRESS,≤100
113101946718691,Clovis Watson Jr. for Sheriff,Clovis Watson Jr. for Alachua County Sheriff,≤100
192677667500345,Charleston Habitat for Humanity,Charleston Habitat For Humanity,≤100
174866249236469,Tulsi Gabbard,TULSI NOW,≤100
104345980946787,lubnasaif,These ads ran without a disclaimer,≤100
101820691249624,okayyjoe,These ads ran without a disclaimer,≤100
103815114456222,Vanessa Tyson,Vanessa Catherine Tyson,≤100
110365633697522,Mike Buehler for Mchenry County Board Chairman,Michael J Buehler,≤100
8544956266,Broke-Ass Stuart,Stuart Elias Schuffman,≤100
1578506062471035,John N. Castellano III for Sheriff,John N Castellano,≤100
107578644013555,Parker Sloan for County Commission,Elect Parker Sloan,≤100
112050583638806,Lisacupid,These ads ran without a disclaimer,≤100
2072089876250719,Backpage Investigation,These ads ran without a disclaimer,≤100
113144363390459,Andrew Knaggs,Knaggs for Congress,≤100
335347887171557,Crooked Columbia,Crooked Columbia,≤100
53167307346,Communist Party USA,Communist Party USA,≤100
