Page ID,Page Name,Disclaimer,Amount Spent (USD)﻿
401583820566367,Asian American Advocacy Fund,Asian American Advocacy Fund,≤100
411431975550358,Marc Veasey,MARC VEASEY CONGRESSIONAL CAMPAIGN COMMITTEE,≤100
229083393820990,Richard Hudson,HUDSON FOR CONGRESS,≤100
1650750011823701,NYS Senate Republican Campaign Committee,New York State Senate Republican Campaign Committee,≤100
115481076527572,Elect André R. Rajoo For Haverhill Council Seat 1,Andre R. Rajoo For America Inc.,≤100
571868449952022,DEGRADATIONS,These ads ran without a disclaimer,≤100
41769369717,United Way of Tucson and Southern Arizona,"UNITED WAY OF TUCSON AND SOUTHERN ARIZONA, INC.",≤100
19036504767,Center for Victims of Torture,"CENTER FOR VICTIMS OF TORTURE, THE",≤100
108997650657922,Fueled By Hate and Caffeine,These ads ran without a disclaimer,≤100
2203907813182007,Joseph Trahan,Committee to Elect Joseph Trahan for Chairman of the Jefferson County Democratic Party,≤100
372502446527928,Child Impact International,Child Impact International,≤100
111069660420051,Rodney Holmes For Wise County Precinct 3 Commissioner,Rodney Edward Holmes,≤100
11388175860,Smithsonian Associates,Smithsonian Associates,≤100
202626512363,U.S. Census Bureau,U.S. Census Bureau,≤100
102789161114613,Dollar Informer,Brooklyn Kathleen Foster,≤100
2588955454492682,Roy Van Atta for Treasurer,Citizens for Roy Van Atta,≤100
7191206138,ASPCA,ASPCA,≤100
186666348590362,Collin County Votes,Collin County Business Alliance,≤100
233237121990,Shelby County Sheriff's Office,These ads ran without a disclaimer,≤100
189425334422697,Make Oakland Better Now,Carele Crespodixon,≤100
225239830855383,American Heart Association - Lowcountry,"American Heart Association, Inc.",≤100
41396282622,CAP UCLA,Center for the Art of Performance at UCLA,≤100
10803722213,Common Cause,COMMON CAUSE,≤100
175834129130715,Steve Terrell for Collin County Commissioner Precinct 3,Steve Terrell,≤100
150681061641282,Tri-State G&T,Tri-State Generation Transmission Association Inc,≤100
142113656501,Renee Unterman,Unterman for Congress,≤100
197679767726077,The Really Online Lefty League,THE REALLY ONLINE LEFTY LEAGUE,≤100
111470060340066,Troy Slaten for Judge,Troy Slaten for Judge,≤100
416216049128866,Ellen Beraud for Supervisor,Ellen Beraud for Supervisor 2020,≤100
115368866575567,DrKim4TX,Antron Derrell Johnson,≤100
1320005784826065,Dora Villarreal for State's Attorney,Friends of Dora Villarreal,≤100
207036559311860,"MMFL - Mills, Mills, Fiely & Lucas",These ads ran without a disclaimer,≤100
791543660926838,"I'll go ahead and keep my guns, Thanks",2A4LIFE LLC,≤100
2281210568612715,Sue Hilderbrand for Supervisor,Committee to Elect Sue Hilderbrand,≤100
5644748986,National Wildlife Federation,NATIONAL WILDLIFE FEDERATION,≤100
109113597307292,Kern Democrats Slate,Kern Democrats Slate,≤100
130936757062757,T-Mobile Workers United (TU),"COMMUNICATIONS WORKERS OF AMERICA, AFL-CIO, CLC",≤100
349565108394619,Tim Fox,Fox for Governor,≤100
101689271317819,Gabriel Jones for State Representative,The Committee To Keep Up With Jones,≤100
10150124349775072,"Riddle & Brantley, LLP","RIDDLE & BRANTLEY, LLP",≤100
176940959017718,Mayor Frank C. Ortis,Mayor Frank Ortis,≤100
87146057955,"Rotary Club of St. Petersburg, FL",These ads ran without a disclaimer,≤100
289529481685808,Mark Piskolich for Justice of the Peace,Mark Piskolich for Justice of the Peace,≤100
189285628396655,Vote Common Good,Vote Common Good,≤100
262846634262819,Soul Anarchist,These ads ran without a disclaimer,≤100
110769220430005,Tide shoes sale,These ads ran without a disclaimer,≤100
1497851363851721,QLMS,Quicken Loans Mortgage Services,≤100
105810757653437,William Pilkington for NC House 82,Pilkington 4 NC,≤100
105694180998190,People Over Profits for AD 57 Central Committee,Henry P. Huerta,≤100
1629925673968109,Refuse Fascism,Refuse Fascism,≤100
86134975779,Coast Guard Foundation,Coast Guard Foundation INC.,≤100
103055744624282,Provide Auto Rates,Alexis Travieso,≤100
153229698074751,Simply Southern,These ads ran without a disclaimer,≤100
636744303193946,Carlos Diaz for Commissioner Seat 4,"Carlos Diaz, Nonpartisan, For Safety Harbor City Commission, Seat #4",≤100
149111148441167,Law Center For Social Security Rights,LAW CENTER FOR SOCIAL SECURITY RIGHTS,≤100
8047221596,Save the Children US,"SAVE THE CHILDREN FEDERATION, INC.",≤100
618480098621142,Social Security Event,Robert Jared Wilkins,≤100
723136714746586,The Common Ground Project,"The Common Ground Project, Inc.",≤100
497433567299699,Overstreet 2020,David Overstreet 2020,≤100
108926330594488,Colorado's Health Care Future,"Partnership for America’s Health Care Future Action, Inc.",≤100
111222097052022,KW Miller Congressional Exploratory Committee,KW Miller Congressional Exploratory Committee,≤100
168453326925652,Lower Makefield/Yardley Democratic Committee,Lower Makefield/Yardley Democratic Committee,≤100
598924810530984,Keeping America Great,FamTeeWorld,≤100
756821897783699,Oregon Water at Work,Oregon Water at Work,≤100
544628295627375,Anna Tovar,Tovar for Arizona. Authorized by Anna Tovar,≤100
1037157259782946,Colorado Way,The Story of Us,≤100
105431797607789,Doug Gruenke for State's Attorney,Committee to Elect Doug Gruenke SA,≤100
105840817488909,Skull Screen Printing Co.,James Keith Boyle,≤100
106512767573097,Louie Bonaguidi For Mayor,Rhonda L Chewning,≤100
2371735926375435,Anthony Lo for Texas HD 67,Anthony Lo for the People's Needs,≤100
43287633515,Alliance for Climate Education,Alliance for Climate Education,≤100
65364914445,Oklahoma Council of Public Affairs,"OKLAHOMA COUNCIL OF PUBLIC AFFAIRS, INC.",≤100
19972147679,SEIU,SEIU,≤100
156995058171029,Newman for Senate,Newman for State Senate 2020,≤100
385473284886474,Hillsdale College,HILLSDALE COLLEGE,≤100
106762244183809,Sam for 4,Campaign to Elect Sam for 4,≤100
12301006942,Democratic Party,DNC SERVICES CORP./DEM. NAT'L COMMITTEE,≤100
105430807719885,Thepoliticaldish,These ads ran without a disclaimer,≤100
414000956119586,Daniel O. Tiernan for Judge,Committee to Elect Daniel O. Tiernan,≤100
1387062348242626,ProgressNow Arizona,ProgressNow AZ,≤100
7835151610,Carolyn B. Maloney,MALONEY FOR CONGRESS,≤100
1675446436118908,Laura Perez-Reyes for Cameron County District Clerk,Pink Ape Media Consulting LLC,≤100
203759119657455,Rubem Robierb Studio,The Stalker Group Corp.,≤100
111544626920856,Joe Reed 4 GA State House District 129,Joseph Patrick Reed,≤100
100808624763972,"Yes on Q 2020 - Improve Our Parks, Care for Our People",Oakland Neighbors for our Parks and People 2020,≤100
89757739264,Farm Credit,Farm Credit Council,≤100
57004315683,Trees That Feed Foundation,These ads ran without a disclaimer,≤100
345129559353259,"Ellie Householder, AUSD Board Member",Trustee Ellie Householder,≤100
510680265702016,Crowned Free,Crowned Free,≤100
116793209714396,Elsa Granados for State Assembly,Elsa Granados for State Assembly,≤100
118292892896266,Shadle 4 President,SHADLE 4 PRESIDENT,≤100
134388193343920,Elijah Haahr,"Friends Of Elijah Haahr, Trevor Crist Treasurer",≤100
163037940379958,"Nisar Law Group, P.C.",These ads ran without a disclaimer,≤100
170223276399744,Ray Law International,Anthony Louis Ray,≤100
139063525262,Kalamazoo County Democratic Party,Kalamazoo County Democratic Party,≤100
102863194617553,Mike Gardner For Ector County Commissioner Precinct One,Michael Ray Gardner,≤100
107606170786094,Elect John Thomas Schuesler,John Thomas Schuesler,≤100
126905638699927,Tina Torres 2020,Tina Torres Campaign,≤100
289216861751561,Path to 100,"Solar Energy Industries Association, Inc",≤100
852670764872586,Oceanside for a Safer Community,Oceanside for a Safer Community,≤100
524526161074907,860 AM The Answer,Salem Media,≤100
81391603670,Carson City  Republican Party,Carson City Republican Central Committee,≤100
107769029247935,Magee-Womens Research Institute & Foundation,Magee-Womens Research Institute & Foundation,≤100
603953923383629,Maine Families for Vaccines,Maine Families for Vaccines,≤100
217137015152702,National Sikh Campaign,National Sikh Campaign,≤100
104599691003943,Cenk Uygur for Congress,Cenk for Congress,≤100
1268410219898273,Tango Tango,Tango Tango Inc,≤100
2196052307388058,St. Landry Economic Development,St. Landry Economic Development,≤100
213371479587012,HAPPENING.fun,Happening Out,≤100
482894551914822,Long Beach Proud,Proud Digital Media,≤100
121624801200841,"Professional Firefighters/Paramedics of Palm Beach County, Local 2928 IAFF","Professional Firefighters / Paramedics of Palm Beach Beach County, Local 2928",≤100
1877393945654633,C-Farar,Carroll Delaney Mchenry,≤100
1113066565547358,Recall Dunleavy,Recall Dunleavy,≤100
1135371009958405,Melissa Morris for Texas Senate,Morris For Texas Senate District 13,≤100
107820545926380,ARZA,Taryn Jessica Rosenberg,≤100
2452905398272083,Froy Jimenez for Illinois Senate - 1st District,Froy Jimenez for Senate,≤100
662962894077729,The Well News,The Well News,≤100
108250814041519,Idaho Patient Act,"MELALEUCA, INC.",≤100
126105480781184,Texas Home School Coalition (THSC),TEXAS HOME SCHOOL COALITION,≤100
1350935845060937,Elizabeth Betancourt for Assembly,Betancourt for Assembly,≤100
324119001078997,"Sanford Heisler Sharp, LLP","Sanford Heisler Sharp, LLP",≤100
1472549903019349,CCAN Action Fund,Chesapeake Climate Action Network Action Fund,≤100
235182504046827,Rep. Joe Cunningham,The Office of Representative Joe Cunningham,≤100
117076713026422,Chris Glasser for County Commissioner,Chris Glasser for County Commissioner,≤100
113302310024546,Medicare for All Education Initiative - MA,Kelley Caldwell Johnson,≤100
130965453649891,Morris County Republican Committee,Morris County Republican Committee,≤100
143621479597438,Kelly Shoaf for WPB City Commission,Kelly Shoaf for City Commission,≤100
97506656133,Jewish Community Center of San Francisco,JCCSF,≤100
1215699268583357,Apex Ohio,Apex Clean Energy,≤100
19575923823,Farm Sanctuary,"Farm Sanctuary, Inc.",≤100
230479744080754,Banuba,These ads ran without a disclaimer,≤100
96020317460,Nellis Air Force Base Desert Lightning News,"Aerotech News and Review, Inc.",≤100
157828612919,Grassroots America: We The People,Grassroots America - We the People,≤100
46508415624,Scott Taylor,Scott Taylor for Congress 2020,≤100
106123517504365,Jeff Sessions,FRIENDS OF SESSIONS SENATE COMMITTEE INC,≤100
209062845803286,Immigration Institute of the Bay Area - IIBA,"INTERNATIONAL INSTITUTE OF THE BAY AREA, THE",≤100
110673143781152,StoryCut,These ads ran without a disclaimer,≤100
8501031021,VoteVets.org,"VoteVets Action Fund, Inc.",≤100
2225580284361712,Tommy Tuberville,"TUBERVILLE FOR SENATE, INC.",≤100
113183023511762,Justin Aldred for Boone County Commissioner,Justin Aldred for Boone,≤100
2035665923312438,Greater Royal Oak Democratic Club,Greater Royal Oak Democratic Club,≤100
100897534631778,Lenzi for Congress,LENZI FOR CONGRESS,≤100
109345177266815,Jenny Fields Campaign for Martin County Property Appraiser,Jennifer Kay Fields,≤100
103957371076407,Ben Valdez Jr for County Supervisor- 5th District,Ben Valdez for Supervisor 2020,≤100
375547379655900,Wendy Wheatcroft for San Diego City Council,Wendy Wheatcroft for SD City Council 2020 FFPC #1414776,≤100
106306090781170,Dawn Rowe for County Supervisor,Dawn Rowe for Supervisor 2020,≤100
1194865807192273,Conservative Gear,Outergoods LLC,≤100
111554350344496,richncho,These ads ran without a disclaimer,≤100
794813270565049,Prival,Prival Concepts LLC,≤100
191554494750955,For The Stress Podcast,These ads ran without a disclaimer,≤100
225952785502,League of Women Voters of Indianapolis,League of Women Voters of Indianapolis,≤100
360646344685869,John Lee for City Council,John Lee for LA City Council 2020,≤100
130576050396299,Rhodesia Ransom for Supervisor,Rhodesia Ransom for Supervisor,≤100
120137368013775,Puget Sound Energy,"PUGET SOUND ENERGY, INC.",≤100
148060455834119,Yes on C For a Better SD,Yes! for a Better San Diego,≤100
86574174383,House Speaker Nancy Pelosi,Office of the Speaker,≤100
89430334806,Greater Boston Chamber of Commerce,These ads ran without a disclaimer,≤100
101255921350728,Yukong Zhao for Congress,YUKONG ZHAO FOR CONGRESS,≤100
557881624317829,Deke for Constable,Deke for Constable,≤100
110866592291015,Eduardo Soto Abogado Inmigracion,Eduardo Soto & Associates,≤100
206274006632908,My Vote. My Health.,Robert Irby Blackmon,≤100
523696314443039,Texans for Zimmerman,Texans For Zimmerman,≤100
9284565026,Bike & Build,BIKE & BUILD INC,≤100
338530640123780,Irresistible,Focus Features,≤100
148494598849,Milken Educator Awards,MILKEN FAMILY FOUNDATION,≤100
392100314619441,Bruno Osif,These ads ran without a disclaimer,≤100
22219555276,Children's Defense Fund,CHILDRENS DEFENSE FUND (INC),≤100
1227468047416089,Duet,Give Duet Inc,≤100
395537933838201,לקט ישראל Leket Israel,These ads ran without a disclaimer,≤100
256570454452074,Michael O'Donnell for Sedgwick County,Michael O'Donnell for Sedgwick County,≤100
355185097868461,Kathryn Starkey for Pasco County Commissioner,"Kathyrn Starkey, Republican, for Pasco County Commission, District 3",≤100
194079794553700,Invested Interests,Invested Interests,≤100
1389623804511401,Janet Dudding for Texas,Janet Tycelia Dudding,≤100
104154737694195,Travis Boldt for State Representative - HD29,Travis Boldt for State Representative - HD29,≤100
111970730196550,World War Zero,AMERICAN SECURITY PROJECT,≤100
112513470189608,American Hot Gear,Ad Hive,≤100
538302106549091,CareFirst Urgent Care - Western Hills,These ads ran without a disclaimer,≤100
106549220701674,Pat Soulliere,Patrick Soulliere For Idaho,≤100
674968309213488,VOTE STACY HALL,Stacy William Hall,≤100
194135257415460,Kevin de León,Kevin de León for City Council 2020,≤100
101985014730549,"Ian and Bridget for UIUC; All for I, and I for All",Ian Katsnelson,≤100
170363546367577,"Dan Gjerde, 4th District Supervisor",Daniel William Gjerde,≤100
195647600913215,No Safe Spaces Movie,No Safe Spaces PA LLC,≤100
164695234872,BKSteppers Marching Arts,BKSteppers Marching Arts,≤100
429087633897093,Western Values Project,Western Values Project,≤100
288122574899479,Jesse Armendarez,Armendarez for Supervisor 2020,≤100
40561217922,Planned Parenthood Advocates of Montana,Planned Parenthood Advocates of Montana,≤100
750053788435485,Texas Oil and Gas Association,Texas Oil & Gas Association,≤100
1612726335627171,We the Internet TV,We the Internet TV,≤100
460236704351535,Tracy Mitrano,TRACY MITRANO FOR CONGRESS,≤100
482902621746064,New Schools for Baton Rouge,New Schools for Baton Rouge,≤100
358438838147451,Gram Of Dope: The Series,These ads ran without a disclaimer,≤100
416707608450706,Tom Steyer,TOM STEYER 2020,≤100
317715676043,Conservation Voters of Pennsylvania,Conservation Voters of Pennsylvania,≤100
100585318107139,"Mark Alan Harrison for Constable, Harris County Precinct 5",The Mark Alan Harrison Campaign,≤100
106110787511618,Elect Teia Harris for Chairman of the Walker Co. Board of Education,Teia Leshea Harris,≤100
454790878016631,Pick Justice,Pick Justice Action,≤100
207697880579,Marianne Williamson,MARIANNE WILLIAMSON FOR PRESIDENT,≤100
111802857059224,Palestinian Child Soldiers Week,Clarion Project,≤100
80865461794,Public Service Company of Oklahoma (PSO),Whitney Shawn Emerick,≤100
336953649823284,Senator Ling Ling Chang,Ling Ling Chang,≤100
110639646952107,Zulma Lopez,Friends of Zulma Lopez Inc,≤100
103233167732898,Judge Drew Erwin,Citizens To Elect Judge Drew Erwin,≤100
228229007697380,Down Home North Carolina,Down Home North Carolina IE PAC,≤100
167968013767335,Julie Oliver,JULIE OLIVER FOR CONGRESS,≤100
322771814739545,Everyone In LA,"UNITED WAY, INC.",≤100
1772758192951858,Senator Llew Jones,Llew Jones,≤100
108819359744879,Dalbin Osorio,DalbinOsorioForSchoolBoard,≤100
112770550197837,American Patriots,Trung Vu,≤100
217148021811490,Tom Lackey,Tom Lackey for Assembly 2020 FPPC #1414673,≤100
101455554716740,Keep Angela Overman as District Attorney: Hockley and Cochran Counties,Adrian Lea Mellberg,≤100
100846648114537,Greg Robinson for Ohio State Senate,Greg Robinson for Ohio,≤100
17801244148,Jill Schupp,SCHUPP FOR CONGRESS,≤100
163148530407080,Captain Mark Kelly,MARK KELLY FOR SENATE,≤100
21250831830,S.J. Quinney College of Law - University of Utah,University of Utah S.J. Quinney College of Law,≤100
112325855474892,Speak Up For Education and Kids,National Education Association,≤100
112723732080474,Capo Kids First!,Craig Powell Alexander,≤100
113231603545224,Durden for District Judge,Todd Alan Durden,≤100
154728531220691,Steve McShane for Monterey County Supervisor District 4,McShane for Supervisor 2020,≤100
45954849475,Food Bank of Delaware,"FOOD BANK OF DELAWARE, INC.",≤100
226345187916007,Mayor Bobby Dyer,The Dyer Difference,≤100
204958092875585,Bank of Texas,BOK Financial,≤100
724263814668980,美国移民律师 Gary J. Kim,Law Offices of Gary J. Kim,≤100
654702428226892,Stop the Corridor,Stop the Corridor,≤100
259130650776119,Mitch McConnell,MCCONNELL SENATE COMMITTEE,≤100
148205145252473,Backcountry Hunters & Anglers,Backcountry Hunters & Anglers,≤100
172917999989498,Rod of Iron Ministries,Andrew Lawrence Hallinan,≤100
1546952572205770,UAEUSAUnited,These ads ran without a disclaimer,≤100
370292163393615,Mayor Dan Gelber,Miami Beach Mayor Dan Gelber,≤100
100633328208699,Cass County Solar Project,Cass County Solar Project,≤100
185181805313193,Ryan P. Hanan For Mayor Of Fernley,Ryan Patrick Hanan,≤100
2099566776755945,Rep. Dusty Johnson,Congressman Dusty Johnson,≤100
1193703730754403,Tom Ervin for Texas State Representative HD108,Tom Ervin Political Campaign,≤100
187809941803009,IVYPAC,IVYPAC,≤100
1133609230164578,Bob Daiber,Daiber for Chairman,≤100
109616377239456,Elect Jason Dominguez,Dominguez for State Assembly 2020,≤100
638054366665974,Lott Rolfe for Circuit Judge,Committee to Elect Lott Rolfe,≤100
337680120026413,Tim Nader for Judge,Tim Nader for Judge 2020,≤100
103666681209850,Mike Heckmann for State Representative,Friends of Mike Heckmann,≤100
184653982265969,Jones Creek Flood of 2017,Jones Creek Flood of 2017,≤100
112294399590247,Indivisible Little Rock & Central Arkansas,Indivisible Little Rock and Central Arkansas,≤100
144178842284599,Austin Firefighters Association,Austin Firefighters Public Safety Fund,≤100
560512177770759,Patrick McDaniel for Polk/Montgomery County Circuit Judge,Patrick C Mcdaniel,≤100
64064370581,North Texas Food Bank,North Texas Food Bank,≤100
128167727289093,Lancaster City Alliance,Lancaster City Alliance,≤100
100128661390208,Mark Yancey for U.S. Senate - Republican,Yancey for U.S. Senate,≤100
1565756840418503,San Dimas Proud,Proud Digital Media,≤100
348484632254120,CareFirst Urgent Care - Delhi,These ads ran without a disclaimer,≤100
114273963301012,Political,Info-Political.com,≤100
100390738078671,Elect Ray Sappington for Cooke County Sheriff,Ray Sappington for Cooke County Sheriff,≤100
110837910261045,HABERSHAM For US For Congress,RICHARD PARNELL HABERSHAM FOR CONGRESS,≤100
165350426309,Goodwill Industries of Tulsa,"GOODWILL INDUSTRIES TULSA, INC.",≤100
25749319177,ACLUOhio,"AMERICAN CIVIL LIBERTIES UNION OF OHIO FOUNDATION, INC., THE",≤100
102764011165938,Interesting Home Programs,Local Home Programs,≤100
355913551109735,The Andrew Goodman Foundation,The Andrew Goodman Foundation,≤100
126908653994269,Wellesley Republican Town Committee,Wellesley Republican Town Committee,≤100
108826673978558,Our Neighborhoods Florida,Our Neighborhoods Florida,≤100
120024915254592,"Beau Harbin, Cortland Legislator & Assembly Candidate",Beau Ashley Harbin,≤100
100167988255125,Elon Musk For MTA President,Lauren Jenna Gould,≤100
101165901320175,The Unstoppable Growth Conference,These ads ran without a disclaimer,≤100
89585789925,Pasadena Humane Society & SPCA,Pasadena Humane Society & SPCA,≤100
261922745636,Children's Education Alliance of Missouri - CEAM,Children's Education Alliance of Missouri,≤100
1600722316666912,BESE,BESE,≤100
2208522842811290,Matt Maillaro for DA,Paid for by Matthew Maillaro for District Attorney,≤100
114752699886655,Amemiya For Mayor,Amemiya For Mayor,≤100
107165913986872,Stavros Anthony for District C,Stavros Anthony for District C,≤100
144672688932357,Butte County Republican Party,BUTTE COUNTY REPUBLICAN PARTY (FED),≤100
310984342256637,Premier Health,Premier Health,≤100
595852920547745,"Law Office of Yuriy Moshes, P.C.",These ads ran without a disclaimer,≤100
117321146322386,UP Gazette,Metric Media LLC,≤100
1945237355733646,Giving Brush,Giving Brush LLC,≤100
466279197281062,Slay The Dragon,These ads ran without a disclaimer,≤100
113026096919563,Bern Baby Bern,Peter John Hargarten,≤100
197177090308580,"Greening Law, PC",These ads ran without a disclaimer,≤100
223424284727002,Newsworthy Stories,Jacqueline Larue Jimenez,≤100
87981774690,Tablet Magazine,Tablet Magazine,≤100
919078151815854,Marsy's Law for Mississippi,"Marsy’s Law for Mississippi, LLC",≤100
483560265149399,Joan Hartmann for Third District Supervisor,Joan Hartmann for Supervisor 2020,≤100
109664420557196,Scott Conklin for PA,Friends of Scott Conklin,≤100
386931601429709,Paul Thompson,These ads ran without a disclaimer,≤100
114066205306277,Franciscan Friars of the Atonement,Franciscan Friars of the Atonement,≤100
101465647911239,dabel65,David K Belsky,≤100
102239794700150,Re-Elect Mike Painter Commisioner District 2,Sonja Denise Bennett,≤100
112420993589373,Young and Old for America,Andrew Joseph Young,≤100
101703344714208,Vote J. Lee Pierce Butler County Commissioner District 1,Jessica Lowery Jones,≤100
626657917504969,Nazeera LLC,Nazeera LLC,≤100
163055010716637,G95,Peter Carlton Solle,≤100
110177119192569,Knightscope,William Li,≤100
119804599415879,Troy Lozar for Champaign Circuit Judge,Citizens to Elect Troy Lozar,≤100
13885075114,Action Against Hunger USA,ACTION AGAINST HUNGER - USA,≤100
122207534456852,Ayo and Iken,Ayo and Iken,≤100
105624394242131,Bill Madden for Wake County Register of Deeds,Madden For Wake,≤100
104519061054928,US Services and New Programs,Jennifer Chi Lam,≤100
205103520353561,"Chris Cockrell, 2020 Supervisor District 2",Marion Everett Cockrell,≤100
106691907452893,Judge Judy Cates for Illinois Supreme Court,Judge Judy Cates for Supreme Court,≤100
218529248766969,601 Waiver Lawyers,"Apsan Law Offices, LLC",≤100
100786701371234,Jaime Valencia for Commerce City Council 2020,Jaime None Valencia,≤100
1061240530648502,Joe Collins,JOE COLLINS FOR CONGRESS,≤100
1474431632798570,Kustom Shirt'z W/Attitude,KustomShirtzwAttitude.com,≤100
110749446963570,Courier,Courier Newsroom,≤100
108993923772150,MeckCounts2020,CASSANDRA LEIGH D'ALESSIO,≤100
109541387122506,Los Angeles Teacher's Choice,"Students, Parents and Educators in Support of Castellanos, Goldberg, McKenna, and Schmerelson for School Board 2020",≤100
648118055203804,Reset Public Affairs,RESET PUBLIC AFFAIRS LLC,≤100
1655317144553574,Major Williams For Mayor Of Pasadena,Major Williams for Mayor of Pasadena 2020,≤100
197040706979540,Karen Goh,Karen Ka Lian Goh,≤100
1257809527710340,Liz for Sheriff,Elizabeth Marie Donegan,≤100
105059500884218,Ann Arbor Times,Metric Media LLC,≤100
1012844478903955,Permeating Light Project,Lady Donna Dutchess,≤100
117641114435,First Aid Beauty,These ads ran without a disclaimer,≤100
102866341248548,Ralf Walters for Congress US House District 10,Ralf Eugene Walters,≤100
2059019737447210,ChangeRoots,ChangeRoots,≤100
17382403969,"The Lesbian, Gay, Bisexual & Transgender Community Center","LESBIAN & GAY COMMUNITY SERVICES CENTER, INC.",≤100
433364950062784,Power Over Energy,Power Over Energy,≤100
49209604726,Vermont Teddy Bear,"VERMONT TEDDY BEAR CO., INC., THE",≤100
302854649740,"Ace It Test Prep, LLC",Joshua Peter Platt,≤100
984259855054439,DeWitt County Wind Power,Tradewind Energy,≤100
111550783569826,Pontiac Times,Metric Media LLC,≤100
106136417435051,Iwantmyoceanback,Iwantmyoceanback,≤100
342294162453301,Planned Parenthood,Planned Parenthood Federation of America,≤100
106890194194670,Nurses and Educators for Lisa Calderon for Assembly 2020,"Nurses and Educators for Lisa Calderon for Assembly 2020, sponsored by labor organizations. Committee major funding from: SEIU California State Council, California Teachers Association, and California School Employees Association. Not authorized by a candidate or a committee controlled by a candidate.",≤100
163298877388620,Alex Miller For Supervisor,Alexander Miller,≤100
105494050922095,Moss for Judge,Bruce A. Moss for Judge 2020,≤100
632586360234666,Retirement Elevated,Retirement Elevated,≤100
101087851352653,ABT 2020: Anyone But Trump,Stuart Craig Snyder,≤100
28446275521,Military Officers Association of America (MOAA),Military Officers Association of America,≤100
1800072483402009,African Community & Conservation Foundation,African Community & Conservation Foundation,≤100
341881063685,"Imprimis, a Publication of Hillsdale College",HILLSDALE COLLEGE,≤100
148190158559115,Wildlife Forever,Wildlife Forever,≤100
336448507217150,Chris Lewis for U.S. Congress,FRIENDS OF CHRIS LEWIS,≤100
405346683155169,Minnesota House DFL Campaign,DFL House Caucus,≤100
138456673550026,Need To Impeach,NEED TO IMPEACH,≤100
105023768642,U.S. Chamber Institute for Legal Reform,US Chamber Institute for Legal Reform,≤100
19972147679,SEIU,SEIU COPE (SERVICE EMPLOYEES INTERNATIONAL UNION COMMITTEE ON POLITICAL EDUCATION),≤100
354964548302597,Electricians Work,Electricians Work,≤100
