Page ID,Page Name,Disclaimer,Amount Spent (USD)﻿
110668760463609,Judge Sharon O. Johnson-Johnson4Justice,These ads ran without a disclaimer,≤100
102010211314386,Donald Trump 2020 Voters,I Love My Freedom,209
740266592735787,Free to Be Kids,Free To Be Kids,≤100
657708380952174,Voices of the Civil Rights Movement,These ads ran without a disclaimer,≤100
106019940923486,Change Save Evolve,Marc A Burns,≤100
108971449133,Fisher House Foundation,"FISHER HOUSE FOUNDATION, INC.",101
1567583403562909,From Adam to Noah—The Numbers Game,Leonard Timmons,≤100
399273360712211,Heather Kent for Judge,Heather Kent for Judge,560
131217580266597,National Council on Aging,"NATIONAL COUNCIL ON AGING, INC.",573
117653489620858,Asaad Alnajjar for City Council,ASAAD ALNAJJAR FOR CITY COUNCIL 2020,≤100
1350935845060937,Elizabeth Betancourt for Assembly,Betancourt for Assembly,≤100
458928061510318,Rita Hart for Iowa,RITA HART FOR IOWA,112
799023333537673,Denmark for Bernie Sanders,These ads ran without a disclaimer,≤100
227535924071462,Animal Petitions,AnimalPetitions.org,≤100﻿
487571108071357,North Carolina Coalition for Fiscal Health,North Carolina Coalition for Fiscal Health,≤100
114580691891439,Al-Shabaka - الشبكة,Middle East Policy Network Inc.,≤100
101087851352653,ABT 2020: Anyone But Trump,Stuart Craig Snyder,≤100
87132269610,Miami Dolphins,These ads ran without a disclaimer,≤100
106714686034838,LiberalViewer,Allen Asch,≤100
617791728363537,LaTonya Johnson,Office of State Senator LaTonya Johnson,≤100
675652982519884,LGBT HealthLink,These ads ran without a disclaimer,≤100
365591516828390,Georgia's WIN List,Georgia WIN List,≤100
628658994243155,Chris Olsen for City Council,Chris Olsen for City Council 2020,≤100
105253804290722,Make America Great Again,Trung Vu,124
780993358738144,Jennifer Leeper,Jennifer Leeper 2020,≤100
88362927890,Boston University School of Law,Boston University School of Law,≤100
113066278734489,Earth Guardians,NOW Company,≤100
169294473121454,Policetees.com,PoliceTees.com,9119
108332290539754,O'Toole for Illinois Senate,These ads ran without a disclaimer,≤100
1890969497671922,modeDurable,ModeDurable,≤100
198041843306,Pittcon,These ads ran without a disclaimer,≤100
102959799834968,Diane Mitsch Bush for Colorado,DIANE FOR COLORADO CD3,≤100
393932827634250,Dissent Pins,Common Practice,8792
116895628330967,Cottonwood Creek Church,These ads ran without a disclaimer,≤100
101810009871142,Pacific Forest Trust,"The Pacific Forest Trust, Inc.",≤100
1109191865855979,Larry Pretlow II,"Friends of Larry Pretlow II. DeRonte L. Smith, Treasurer.",≤100
127878470527,Rebecca Bell-Metereau,Rebecca Bell-Metereau Campaign,≤100
233027046896244,Jeff Yull for Republican State Committee,Red Massachusetts Grassroots Action,≤100
103022784417075,NOW,NOW Company,≤100
1955953381348064,State Representative Trent Ashby,Texans for Trent Ashby,≤100
1806047163027587,Citizens For Jerrett Einsporn,Jerrett Wayne Einsporn,≤100
1475056949212605,Charity Mobile,Charity Mobile,101
2011853169031699,Bali Necklaces,Bali Necklaces,≤100
153681091324995,Millionaire Mind Intensive,These ads ran without a disclaimer,≤100
159111884119104,St. John Center for Homeless Men,ST JOHN CENTER INC,≤100
105233114155616,Almovind,These ads ran without a disclaimer,≤100
172013736279963,Lake County Republican Party,Lake County Republican Central Committee,≤100
2461612207448393,Cristin McDonald Duffy 2020,Friends of Cristin McDonald Duffy,5478
115058793196716,Big Tree Pac,Big Tree PAC,≤100
112844610186533,Mail My Voice,United Effects LLC,≤100
638593382946186,Isabelle Dubroy,These ads ran without a disclaimer,≤100
83040292558,Mid-Michigan NOW,These ads ran without a disclaimer,≤100
101339694805452,Quaker City Corruption,Benjamin Robert Waxman,≤100
236369846383459,Congressional Black Caucus PAC,Congressional Black Caucus PAC,1070
185266517239,Barrington 220 School District,These ads ran without a disclaimer,≤100
257241111005761,Scott County Democrats,Scott County Democratic Party,≤100
204813313361194,Putting Women In Their Place,Putting Women In Their Place Inc,≤100
552547788123044,Kayla Itsines,These ads ran without a disclaimer,205
105266701039901,ඉෂංක සමග පෙරට Polgahawela Youth,These ads ran without a disclaimer,≤100
2854335511458493,Down With Fox,These ads ran without a disclaimer,≤100
11234736860,Tom McClintock,McClintock for Congress,≤100
287734148670,Shauna Chin,Shauna Alicia Chin,≤100
186932688457686,CHNGE,CHNGE,632
640029172673858,Miami Al Día,German Gilberto Carias Bermudez,≤100
118490389557237,Maya Biosphere Watch,These ads ran without a disclaimer,≤100
1309343439206208,Hugh Finkelstein for Circuit Judge,Hugh Finkelstein for Circuit Judge,≤100
2102809453136561,Term Limit Pledge,TermLimitPledge.Org,≤100
217822905228833,Vital Strategies,Vital Strategies,≤100
113595780100283,David Bonoma for Judge,David A. Bonoma for Judge,679
307943569254319,Florida Rights Restoration Coalition,Florida Rights Restoration Coalition,138
344708079424130,Innovation for Everyone,Innovation for Everyone,≤100
1457933161123847,Missouri Gaming Association,MISSOURI GAMING ASSOCIATION,≤100
1880547532172546,Oromo-American Citizens Council - OACC,These ads ran without a disclaimer,≤100
476893546417529,Jamie Guerra Dickler for Cook County Circuit Court Judge,Citizens for Jamie Guerra Dickler,782
146374312731434,Mi Bakal,These ads ran without a disclaimer,≤100
151721606865,Intrepid Fallen Heroes Fund,Intrepid Fallen Heroes Fund,≤100
91085392297,Country Inn & Suites by Radisson,Samantha Rose Alleven,≤100
1116760325014346,AmmoGrab,Gary Wayne Taylor,≤100
100637151406626,USA 1776,Francisco Javier Vigil Fuentes,135
110749217080609,Mark Bauer,Mark Bauer for Congress,≤100
260540537373,American Tortoise Rescue,These ads ran without a disclaimer,≤100
104687524389948,Laugh Market,These ads ran without a disclaimer,≤100
104689831035253,ModioStore,These ads ran without a disclaimer,≤100
110909073679715,Judge Rick Felice,Richard D. Felice for Judge Circuit Court Judge,458
854748721570632,A Second Opinion,These ads ran without a disclaimer,≤100
113005536951767,Planted,Andrew West Gardner,≤100
45413563867,The Free and Equal Elections Foundation,These ads ran without a disclaimer,112
104113087669604,Opportunity Arizona,Opportunity Arizona,≤100
555000974661033,Hundreds Unit,These ads ran without a disclaimer,≤100
287789785155313,State Representative Danny McCormick,Elect Danny Mccormick,≤100
139062006143526,End The GOP,Richard Neely,≤100
115257853240629,"Life, Love, and the Grind",Sean F Allen,125
132388538302,Oregon Right to Life,OREGON RIGHT TO LIFE,≤100
361623737832919,Mom's Guide to Politics,Moms Guide to Politics,≤100
1620901297968649,Aimy Steele for NC House 82,Paid by the committee to elect Aimy Steele for NC House District 82,≤100
110375540462567,Jesse Brown for State Senate,Jesse Brown Committee,≤100
614652398568998,Karen A. Yarbrough,Cook County Clerk's Office,1346
797311243718601,Super Coffee,These ads ran without a disclaimer,≤100
45053403560,North American Interfraternity Conference,North American Interfraternity Conference,≤100
122116471238528,Steve Vasilas fanpage,These ads ran without a disclaimer,≤100
781510041970720,Hippo Sak,Hippo Sak,529
10760692978,World Hope International,World Hope International,≤100
2386704041588414,The Texan,These ads ran without a disclaimer,≤100
103193554606494,MAGA DEALS,Paul Michael Pearson,≤100
362597400470914,Shamann Walton 華頌善,Shamann Walton for Democratic Central Committee 2020 • FPPC ID# 1422994• Financial disclosures available at SF Ethics,≤100
1714632911933752,John Kiehne for State Representative,Kiehne for Missouri,≤100
105028704366985,What A Sock,These ads ran without a disclaimer,≤100
384533924985897,Tony Brown's Journal,These ads ran without a disclaimer,≤100
207918945891587,United Nations Human Rights,United Nations for Human Rights,≤100
104553724276436,Miss Lit by Lit Creative Group,Melissa Ann Steele,≤100
304058913005378,Senior and Disabled Concerns,Senior & Disabled Concerns,≤100
182193211815005,Issue One,Issue One,≤100
111293193691611,Shop Trump 2020,Iminder P Singh,283
101286881339755,Richard Stanley for Rusk County Pct 1 Constable,Richard Curtis Stanley,≤100
131561523917288,The Silent Majority,James Claudze Epley,≤100
115130633369844,Medicine Update,Manisha Desiree Bocus,≤100
101304624782822,Redway Living,Redway Living,≤100
149262165146066,ADL Midwest,Anti-Defamation League,3609
108443244280,Sweet Adelines International,These ads ran without a disclaimer,≤100
897393153671209,Goalcast,These ads ran without a disclaimer,≤100
2663200843709393,Heather Bauer,Heather Bauer for District 75,≤100
113975140049132,Wayne Reid,Wayne A Reid,≤100
107571627433314,Vzanary Stories,These ads ran without a disclaimer,≤100
109775443949325,ecokidgroup,These ads ran without a disclaimer,≤100
124530924015,Hank Gilbert,Hank Gilbert for Congress,≤100
134998246548882,Specialisterne Foundation,These ads ran without a disclaimer,≤100
465483726908192,iVote,IVote Civic Education Fund,4393
62417899106,National Health Service Corps,National Health Service Corps,≤100
248505395181356,Seattle Urban Academy,These ads ran without a disclaimer,≤100
106492214156732,Jeff Esmus for Congress,JEFF ESMUS FOR CONGRESS,≤100
178093668911508,"Law Office of Michael D.J. Eisenberg, Attorney and Counselor at Law",These ads ran without a disclaimer,≤100
347797678729681,Thrive Psychotherapy & Consulting Services LLC,These ads ran without a disclaimer,≤100
28446275521,Military Officers Association of America (MOAA),Military Officers Association of America,443
103313141063508,The Welcome Party,The Welcome Party,≤100
87186661244,Johns Hopkins Bloomberg School of Public Health,These ads ran without a disclaimer,≤100
103131054573692,Crawfordology,Crawfordology,≤100
1187828951298252,Tyler Prize for Environmental Achievement,ReAgency LLC,≤100
138285641900,Best Events Catering and Rentals,These ads ran without a disclaimer,≤100
110211287060311,Fanon Rucker for Prosecutor,Committee to Elect Fanon Rucker,≤100
20566782501,Democracy for America,DEMOCRACY FOR AMERICA,262
70198873069,Shriver Center on Poverty Law,Shriver Center on Poverty Law,≤100
213998472307,Hoosier Environmental Council,"HOOSIER ENVIRONMENTAL COUNCIL, INC",≤100
318772742238,Jewish Review of Books,Jewish Review of Books,≤100
103135374467200,Amendment One Tees,Skyler C. Yaw,≤100
151235194920472,"Morton Solar & Electric, LLC",Bradley D Morton,≤100
113072443570835,Parents & Taxpayers Organization 452-477,These ads ran without a disclaimer,≤100
315995348904534,Cottie for State Assembly,Petrie-Norris for Assembly 2020 FPPC ID #1414368,≤100
217519028785017,Nature Research Custom Media,These ads ran without a disclaimer,≤100
1504483779814401,Occupy Independents,Carlos Jose Barberena,≤100
114715096575803,Gulf Coast Resource Coalition,Gulf Coast Resource Coalition,≤100
456668527710516,Political Gifs,These ads ran without a disclaimer,≤100
114782633404812,Veteran Alert Guide,Manisha Desiree Bocus,≤100
284670525460,Lisa Mirza Grotts,These ads ran without a disclaimer,≤100
102109671148056,Sherry DOTY for Circuit Clerk,Randy L Doty,≤100
323679630743,San Francisco Gay Men's Chorus,These ads ran without a disclaimer,≤100
746211745534477,Nida Allam,Committee to Elect Nida Allam,≤100
327011024831097,Ruth Wyman for Circuit Judge,Ruth Wyman for Cicuit Judge,286
105463947625851,BambooBrushes,These ads ran without a disclaimer,≤100
983997691692598,Política Ya,These ads ran without a disclaimer,≤100
111508560325108,Lhstore_,These ads ran without a disclaimer,≤100
2212911745618952,Impeach Trump Run,Impeach Trump Run,≤100
309660569121570,"Mitch O'Connell, The World's Best Artist! By Mitch O'Connell",Mitchell R O Connell,≤100
589080591607126,We're All Set,These ads ran without a disclaimer,≤100
115637806648835,Understanding Home Savings,Seen Yung Christy Wong,≤100
115018467956,Wayne County Farm Bureau,Wayne County Farm Bureau,143
155772097961865,Nelda Speaks For Arkansas State Representative District 100,Speaks for State Representative,≤100
102999994614492,Snagabunch,Dontez Tariq Akram,≤100
82607332460,Legal Momentum,These ads ran without a disclaimer,≤100
869834083131145,Conservative Writers,Conservative Writers,≤100
186221328059961,Dr. John Tantillo,John Jr Tantillo,≤100
103854514355606,Borgmester har erkendt tyveri af liebhaver Porsche,These ads ran without a disclaimer,≤100
462501617271015,Kristina for Republican State Committee,Red Massachusetts Grassroots Action,≤100
407664862957433,Ammar Campa-Najjar for Congress,AMMAR CAMPA FOR CONGRESS,739
263313883684932,Power Past Impossible,AMERICAN PETROLEUM INSTITUTE,≤100
263891677826490,Earthsider,These ads ran without a disclaimer,≤100
1711122469104679,Strong Like Bull,These ads ran without a disclaimer,≤100
101907961347822,Friends of Val Verde Schools - Yes on Measure C,"Friends of Val Verde Schools - Yes on Measure C, FPPC# 1423767",≤100
191554494750955,For The Stress Podcast,These ads ran without a disclaimer,≤100
112527873569039,Grupo Metas unidos por un cambio "Cholitín Alcalde 2020",These ads ran without a disclaimer,≤100
157277400862,The Bell Policy Center,BELL POLICY CENTER,≤100
1874405376119622,The Chronicle App,One Chronicle Inc.,≤100
106777274043961,Funny Right Wingers,Jonathan David Fensterheim,≤100
177814032238168,Revenge Is,Engage Tees,≤100
108501267220997,Angela for America,These ads ran without a disclaimer,≤100
117709002968266,Green Ocean Co.,These ads ran without a disclaimer,≤100
290548664672,First Liberty,First Liberty Institute,457
504161563089343,BlackPAC,Black PAC,105
1328521163825142,Fortune Hill Group,Scott Elliott Comer,≤100
148204505309491,Strongsville GOP,Strongsville GOP,≤100
303060840551495,Congressman Steve Watkins,Congressman Steve Watkins,≤100
119405895873,Huawei,These ads ran without a disclaimer,≤100
148389122486779,"Sex with Spirit, sex coaching with Rachel Alba",These ads ran without a disclaimer,≤100
42551620536,Equal Justice Works,EQUAL JUSTICE WORKS,≤100
170223276399744,Ray Law International,Anthony Louis Ray,≤100
1139780232780908,Frugal Family,These ads ran without a disclaimer,≤100
670056060109480,PSDigital,Piotr  Sapiezynski,≤100
101513557965804,Build Your Brand Co.,These ads ran without a disclaimer,≤100
101235137977071,Dr. Chuck Ellington for Congress,DR. CHUCK ELLINGTON FOR CONGRESS,2992
105654707654042,US Auto Relief Program,Luis Enrique Pena,≤100
102173001195418,Mary Miller for Congress,Mary Miller for Congress,3397
100284648021034,New Tolerance Campaign,New Tolerance Campaign,412
109380007182768,Arizona Biltmore Neighborhood Association,Arizona Biltmore Neighborhood Association,≤100
104203901109472,Fresh Brewed Wonders,These ads ran without a disclaimer,≤100
156059734414814,Wendell Mosby Page,Primary Source Consulting,≤100
114530700443,Food Bank of Contra Costa and Solano,Food Bank of Contra Costa & Solano,≤100
1606710959557216,Slugnuts,Kyle Douglas Reynolds,≤100
172758932738142,PhRMA,PHARMACEUTICAL RESEARCH AND MANUFACTURERS OF AMERICA,37947
511235549007985,PRJKT RUBY,PRJKT RUBY,486
154471447959196,Institute for Veterans and Military Families - IVMF,Institute for Veterans and Military Families,1324
112767101113,AARP Massachusetts,AARP,≤100
464292670410321,Claudia Tenney for Congress,TENNEY FOR CONGRESS,≤100
398786204072260,Dyslexia Parent-Teacher Alliance,Reading Horizons,≤100
573084822773932,Joe Perkins for Circuit Judge Campaign Committee,Joe Perkins for Circuit Judge Campaign Committee,≤100
123965317665623,N-Hance Wood Refinishing,N-Hance Inc.,389
440144889337112,Chicago Immigration Advocates Law Offices,Chicago Immigration Advocates Law Offices,117
402969533432277,Cisneros for Congress,CISNEROS FOR CONGRESS,≤100
1933180256921396,IE United,"Inland Communities in Support of Eddie Tejeda for District 3 Supervisor, sponsored by IE United a project of Tides Advocacy",≤100
233431773370174,Chris Paddie For Texas,Texans for Chris Paddie,≤100
38234604057,PEN America,These ads ran without a disclaimer,≤100
345970415557231,Rabbi Isaac Jeret,Leslie Isaac Jeret,≤100
104936780893497,Kody for Constable,Kody Alan Fahrenthold,≤100
729616103794295,Unica Clinic,These ads ran without a disclaimer,≤100
107277147375038,The Penrose Papers,Richard W. Gray Jr.,≤100
105840817488909,Skull Screen Printing Co.,James Keith Boyle,≤100
119240831959602,Strong Arm Press,These ads ran without a disclaimer,≤100
110538093732020,Wayward Sheep,These ads ran without a disclaimer,≤100
824081317764500,Ruff on the Road,Ruff on the Road,≤100
1438553336457672,Fair Housing Council of Greater San Antonio,SAN ANTONIO FAIR HOUSING COUNCIL INC,≤100
508433235840691,Minnesota Bio-Fuels Association,"The Minnesota Bio-Fuels Association, Inc",≤100
101253871352577,Elect Patrick Joyce,Senator Patrick Joyce Election Committee,4058
262062478079324,Mckayla Wilkes for Congress,MCKAYLA WILKES FOR CONGRESS,200
7100914121,American Experience | PBS,These ads ran without a disclaimer,≤100
953135614710525,American Security Initiative,American Security Initiative,311
1312902825543317,American Nightmare Film,Jesus Nebot International,≤100
1839067939730892,The Justice Guardians,"Eagle Peak Marketing, LLC",167
1297437463649811,by Humankind,These ads ran without a disclaimer,≤100
106984427499658,What Did Trump Tweet Today,What Did Trump Tweet Today,≤100
104027894318612,Inclusion2020,Inclusion2020,≤100
153718778006865,CDC VetoViolence,These ads ran without a disclaimer,≤100
352517808109574,Daniel Zolnikov,"Montanans for Daniel Zolnikov. PO Box 50403, Billings MT 59105. (R)",≤100
497476893723547,Black Rifle Coffee Company,These ads ran without a disclaimer,≤100
1525472414388476,Better Wyoming,Better Wyoming,≤100
18067635868,Putney Student Travel,PUTNEY STUDENT TRAVEL INC,≤100
125119157535614,Fannie Mae,Fannie Mae,1070
800165726699286,Wisconsin State Representative Travis Tranel,Office of State Representative Travis Tranel,≤100
205103520353561,"Chris Cockrell, 2020 Supervisor District 2",Marion Everett Cockrell,≤100
950350791662347,American Center for Transforming Education,Robert Leonard Ii Crowther,≤100
103267587865775,Citizens For Herculaneum Public Safety,Mark Leroy Tulgetske,≤100
515156762174672,The Claude Pepper Center,These ads ran without a disclaimer,≤100
171697336181460,Dow,The Dow Chemical Company,780
69757566686,Mid-Ohio Foodbank,Mid-Ohio Foodbank,≤100
157652584384932,David Schweikert,FRIENDS OF DAVID SCHWEIKERT,≤100
102957524548390,YES on L for Santa Ana College and Santiago Canyon College,"Campaign for Our Colleges – Yes on Measure L, FPPC# 1423251, committee major funding from Santa Ana College Foundation, Santiago Canyon College Foundation",≤100
332905134021585,Joe Harding for State Representative,Joe Harding for State Representative,≤100
1374134752633656,New Health Plans,Kevin George Cerula,1402
9785626650,Public Citizen,PUBLIC CITIZEN INC,≤100
228025664576921,Boss Betty News,Boss Betty Publishing LLC,≤100
111414109512852,Carissa Casbon Community,Friends of Carissa Casbon,169
121974269207042,"Guy Spears for Wilbarger County Commissioner, Precinct 1",Guy Keith Spears,≤100
1800788176886636,Linda Deos for Yolo County Supervisor 2020,Linda Deos for Davis City Council 2018 (ID# 1399312),≤100
122569711116144,Prison Yoga Project,Prison Yoga Project,≤100
103056191180420,Crystal Uhe for State’s Attorney,Crystal Uhe for State's Attorney,1736
101018071405012,Benefits USA,Brooklyn Kathleen Foster,7695
110618170405674,Best Money Tips,Best Money Tips,236
415991855205496,Observatoire Citoyen sur l'Accès aux Services de Santé - OCASS,These ads ran without a disclaimer,≤100
336142233246524,Rice Love,Rice Love,148
101751618009629,Dystopian Political Book on Amazon,These ads ran without a disclaimer,≤100
2154804598181848,Defend against "Resist" Conservative Cause,Charles None Ostertag,≤100
105165497630005,Elect David Capps for Sheriff,David Otis Capps,≤100
100425131541220,Becky Edwards for Christian County Board,Becky T Edwards,≤100
255623207824623,tentree,These ads ran without a disclaimer,≤100
387028015007642,Colorado Citizens Coalition,Colorado Citizens Coalition,≤100
1107973016071967,Wesley Hunt,Hunt for Congress,≤100
118389879571665,Palomo Colon,Luis Daniel Camacho Ortiz,≤100
103733440984818,ReNew Mexico,ReNew Mexico,≤100
851717058508365,Courtney Cox for Judge,Courtney Cox for Judge Committee,1027
617323772010662,Tre Productions,Floyd Allen Holland,124
170309409666124,Bellefontaine Cemetery and Arboretum,Linda Christine Gaal,≤100
115280186553725,Friends of Joe Duplechin,James P Harney,≤100
184197442480974,Conservation Frontlines,Conservation Frontlines Foundation,≤100
363263610497489,Jeanette for Senate 25,Jeanette for Senate 25,327
6072343558,Center for American Progress,CENTER FOR AMERICAN PROGRESS,≤100
134498556891640,Val Demings,VAL DEMINGS FOR CONGRESS,160
101692507883720,Lena Taylor for Mayor,Lena Taylor For Mayor,≤100
1425435377743310,Conversations with Bill Kristol,The Foundation for Constitutional Government,195
104359714259043,"Kathleen Beckman for Clearwater City Council, Seat 3",Kathleen Beckman for Clearwater City Council,≤100
1428283027462702,Restoration PAC,RESTORATION PAC,163
2032730743638862,Chukundi Salisbury,These ads ran without a disclaimer,≤100
108737769118,Muller Honda,These ads ran without a disclaimer,≤100
218957134646,Katherine Paterson,These ads ran without a disclaimer,≤100
119231578091351,"Dubuque County Right to Life, Inc.",DUBUQUE COUNTY RIGHT TO LIFE,≤100
2177005695867568,Minnesota Ag-Energy Alliance,Minnesota AG Energy Alliance,226
221650551273967,LiUNA Midwest Region,LIUNA Midwest Region,≤100
87186661244,Johns Hopkins Bloomberg School of Public Health,Johns Hopkins Bloomberg School of Public Health,≤100
261336384152,Libertarian Party of Illinois,Libertarian Party of Illinois,361
329804953732571,It's A Spade,These ads ran without a disclaimer,≤100
108250814041519,Idaho Patient Act,"MELALEUCA, INC.",≤100
103083371246527,Ziggy MD Designs,These ads ran without a disclaimer,≤100
1059639207431974,Yes for Castro Valley Students,"Yes for Castro Valley Students, FPPC #1423085.",≤100
174057765941,Republican Party of Virginia,REPUBLICAN PARTY OF VIRGINIA INC,≤100
113028392080045,Family Nurturing Center,Family Nurturing Center,≤100
102540964451489,My4eva Straws,These ads ran without a disclaimer,≤100
1437565483144916,중앙선거관리위원회,These ads ran without a disclaimer,≤100
204626306331350,Up to Us,These ads ran without a disclaimer,≤100
665751070556235,Captain Holland Jones for Fort Bend County Sheriff,Holland Jones Democratic-Campaign,≤100
170582513587720,Liberty Through Wealth,The Oxford Club,4602
104364947602066,Librarian Community,These ads ran without a disclaimer,≤100
2363172387338331,Safe Space 1776,SAFE SPACE 1776 LLC,≤100
118552309534879,VoteMaura,Friends of Maura HIrschauer,≤100
8325302025,Friends of the Earth U.S.,Friends of the Earth,7399
488126221334500,West Whiteland Democrats,Emmanuel Fourakis,≤100
113016870079975,Liberty & Justice,Andrew Nicholas Doris,≤100
111831805841449,BoldTV,These ads ran without a disclaimer,≤100
399998947121351,Elect Tandy Dunn Beaufort County Commissioner,Tandy Oliver Dunn,≤100
118271677096,CLIF Bar,CLIF BAR & COMPANY,≤100
337557199502,Nebraska Conservation Voters,Nebraska Conservation Voters,≤100
104456304504348,Online Carry Course USA,These ads ran without a disclaimer,≤100
238052089570737,Marion Medical Mission,MARION MEDICAL MISSION,≤100
101218254792459,ብልፅግና ፓርቲን እንምረጥ,These ads ran without a disclaimer,≤100
157491804281590,Basilica of the National Shrine of the Immaculate Conception,Basilica of the National Shrine of the Immaculate Conception,178
100513661393190,PPP FANS,These ads ran without a disclaimer,≤100
790530820975690,Delegate Patrick Martin,Patrick Stephan Martin,≤100
329243564466366,Run Wild Ranch Sanctuary,These ads ran without a disclaimer,≤100
1861898863932293,Chicken Dolphin,These ads ran without a disclaimer,≤100
184373328845372,Gigi Raffe,Gigi Raffe,950
114060076705060,bennymuttz,These ads ran without a disclaimer,≤100
106049680876987,GreenEcho,Dawud Amir Ibn Abdullah,≤100
107155764151589,Approved Debt Relief,Alexis Travieso,102
116407303075511,Jason Church,CHURCH FOR WISCONSIN,1057
109497713896369,kp.thepatriot,These ads ran without a disclaimer,≤100
183002305543,Tearfund USA,Tearfund USA,≤100
242077219243971,The Presidential Coalition,The Presidential Coalition,≤100
106508614174511,God Bless the USA,These ads ran without a disclaimer,≤100
122037065517,American Immigration Council,American Immigration Council,≤100
252642368084919,"Life Dynamics, Inc.",These ads ran without a disclaimer,≤100
227105500330,Chicago NOW,Chicago Chapter of the National Organization for Women,≤100
103979337736591,Mrvan for Congress,MRVAN FOR CONGRESS,≤100
2284339008500698,E Street Group,E Street Group LLC,≤100
102592959026,Ocean Conservancy,"OCEAN CONSERVANCY, INC.",4533
104271701106503,My Name Is Conservative,DANIEL FERNANDEZ-LEDON,≤100
142914269087072,Cornell Lab of Ornithology,Cornell Lab of Ornithology,≤100
914575115385687,Closet Collectibles,These ads ran without a disclaimer,≤100
139599847972,National Nurses United,VOTE NURSES VALUES POLITICAL ACTION COMMITTEE: CALIFORNIA NURSES ASSOCIATION,1158
211575795534483,Ohio Nature Conservancy,Nature Conservancy,≤100
12690173701,V-Day,Carl Chai Cheng,451
569115029963958,MJGwrites Political Comedy,MJ Gardner,≤100
110284687224242,Merica JunkBoss LLC,These ads ran without a disclaimer,≤100
