Page ID,Page Name,Disclaimer,Amount Spent (USD)﻿
2158201087792418,Texas Southern eMPA Program,These ads ran without a disclaimer,≤100
110093630574721,Modern American Outfitters,Car L Wi Lliam Es Ch En Bu Eschenburg,≤100
452224901842872,The People's Resistance,"The People's Resistance, LLC",≤100
44667476574,In These Times,INSTITUTE FOR PUBLIC AFFAIRS,123
69118604016,Carnegie Institution for Science,Carnegie Institution for Science,≤100
943569969049086,Javier Maza/ Consultor Politico,These ads ran without a disclaimer,≤100
242679302418244,Denison Forum,These ads ran without a disclaimer,≤100
397130463730560,MOVE Texas,MOVE Texas Action Fund,319
642095866249364,Mikey,Michael George Saoma,≤100
2443787272311567,Citizens for Florida Prosperity,Citizens for Florida Prosperity PC,337
106431740799515,Susan Moran for State Senate  - Plymouth & Barnstable District,Joseph J Manning,≤100
17895249095,Wild & Scenic Film Festival,SOUTH YUBA RIVER CITIZENS LEAGUE,≤100
113697513378680,Clean Energy Matters,Clean Energy Matters,≤100
128167457221813,Public Transportation,Voices for Public Transit,2191
2382869555319923,Mondaire Jones,MONDAIRE FOR CONGRESS,≤100
1613728645515456,Thrive Union,Thrive Union Life Inc,≤100
280632008752608,Peter Schweyer,Friends of Peter Schweyer,≤100
113226473402247,For The Win,Brenda Vanesa Arredondo,≤100
30199023987,New Victory,The New Victory Theater,≤100
48423211136,Ronald McDonald House Charities (RMHC),These ads ran without a disclaimer,≤100
211970809275110,Carson Jorgensen,Todd Carson Jorgensen,≤100
120559304621142,Wyoming Outdoor Council,"WYOMING OUTDOOR COUNCIL, INC.",≤100
255535757792588,Rick Veenstra for Circuit Court Judge,Veenstra for Judge,≤100
116380409767448,Shop Trump 2020,"Wireless Media, Inc.",≤100
694445473903619,Magamama,These ads ran without a disclaimer,≤100
784658445076447,JohnCheckforhouse,John Check for House,≤100
518413051517496,Friends of Berryessa Schools - Yes on Measure U,"Outstanding Berryessa Schools - YES on U, FPPC# 1424091.",≤100
2322760638043788,Silver State Foundry,Thunderbird Media Group,321
100358658175217,Fun2Speculate,These ads ran without a disclaimer,≤100
1937171279661046,Margaret Good,MARGARET GOOD FOR CONGRESS,4857
992427717580796,Bunnies Hot Tips,Sharolyn Denise Forbes,≤100
1651938015128584,Georgians for Lawsuit Reform,Georgians for Lawsuit Reform,≤100
143173285763,Tenth Amendment Center,Tenth Amendment Center,211
107143267351443,Rancho La Paz HOA,Shaun Anthony Walton,≤100
1396240550499155,St. Teresa of Calcutta Catholic community.,These ads ran without a disclaimer,≤100
401228694019184,Alicia Huey NAHB 2020,Alicia Huey for NAHB 2020,≤100
154159187932754,"Magellan Financial & Insurance Services, Inc",Magellan Financial & Insurance Services,111
103271317801479,Trumpedupcharges,Keith David Ruenheck,≤100
202533393627879,Screw the Republicans,Larry Knight,≤100
46093654473,National Republican Congressional Committee,These ads ran without a disclaimer,158
102409437998294,Maureen Bauer for State Representative,Maureen Anne Bauer,≤100
133228237406678,Ryan Fenwick for Metro Council District 10,Ryan Fenwick for Metro Council,≤100
101601504679558,Nancy Pelosi  - The Adult in the Room,Steven Dean Mcquown,≤100
111793936840910,Cook Property Management LLC,These ads ran without a disclaimer,≤100
118431598998096,The Equity Council Corp. / ECC,These ads ran without a disclaimer,≤100
108152933883451,TrumpTrendz,Troy Lorenzo Davis,3583
101702411343674,Market Junkie,Stock Market Junkie,458
166386027494725,Connell A. Crooms,Connell Aubrey Crooms,≤100
84898104708,Waitt Institute,Waitt Institute,≤100
489560147748670,BHAVA,These ads ran without a disclaimer,≤100
73528878871,Center for Reproductive Rights,Center for Reproductive Rights,1710
616507365386105,Top Conservative,Eric Brian Rosenberg,331
1716204875305584,Union for Reform Judaism,These ads ran without a disclaimer,≤100
1142514669266128,Sum of Us Festival,These ads ran without a disclaimer,≤100
109032647274670,AnyShaker,These ads ran without a disclaimer,≤100
80562389320,NARAL Pro-Choice America,NARAL Pro-Choice America,17576
102324961319603,Primo Castro for Assembly 2020,Primo Castro for Assembly,≤100
498045357666517,Responseabilityowp,These ads ran without a disclaimer,≤100
101663248703,GFWC,These ads ran without a disclaimer,≤100
322697311079870,David Criner,David Criner for Sheriff,≤100
289341778962,Louisiana Bucket Brigade,Louisiana Bucket Brigade,≤100
51379424899,Mercy Ships,Elliott Benjamin Wilkerson,≤100
151033324940505,The Cruise & Vacation Authority,Mathew Steele Barnard,≤100
1220603974768458,Fresh535,These ads ran without a disclaimer,≤100
277550205502,National Religious Campaign Against Torture,NATIONAL RELIGIOUS CAMPAIGN AGAINST TORTURE,≤100
216705888361546,Elbert Lee Guillory,These ads ran without a disclaimer,≤100
206993366710986,The Volusia Mom,Darlynn Nangano Tacinelli,≤100
419794381380683,Savory Institute,These ads ran without a disclaimer,≤100
464292670410321,Claudia Tenney for Congress,TENNEY FOR CONGRESS,≤100
215834112589234,Cxffeeblack,These ads ran without a disclaimer,≤100
116775603034603,The Environmental Royalty Project,Sharro N Renee Rh O D Rhodes,≤100
108649867230011,Margaret Chen Kercher for Judge,Margaret Chen Kercher Campaign,≤100
124562657555174,RENEW Wisconsin,RENEW WISCONSIN INC,≤100
233024806816070,Texas Water Development Board,Texas Water Development Board,≤100
597566604005189,Momentum,Momentum,≤100
1520852664890753,Beau Biden Foundation for the Protection of Children,Beau Biden Foundation for the Protection of Children,≤100
215630630607,Lied Center for Performing Arts,These ads ran without a disclaimer,≤100
121731445898409,I Love Great Deals,Jay David Kamhi,105
654470874584798,Save The Inventor,Innovation Alliance,≤100
483807039087447,OneCup,These ads ran without a disclaimer,≤100
485025198583040,Southern AF,southern af,≤100
108774017315155,Gem Class Podcast,These ads ran without a disclaimer,≤100
450604939085825,Eco Paper Arts,Eco Paper Arts,≤100
385979391541031,Michael Blake,MICHAEL BLAKE FOR CONGRESS,≤100
902832723237738,Melanated_Masks,These ads ran without a disclaimer,≤100
523036308040829,Shift1Designs,These ads ran without a disclaimer,≤100
123192635089,GOP,REPUBLICAN NATIONAL COMMITTEE,7691
2072089876250719,Backpage Investigation,X Social Media LLC,1419
102496194440772,Christopher Hall Murder-DC Cold Case,These ads ran without a disclaimer,≤100
269649419759801,Terminix Complaints,These ads ran without a disclaimer,≤100
98156600838,Shepherd's Gate,SHEPHERD'S GATE,≤100
788632858205691,Zero Waste Face,Zero Waste Face,5625
128801850466780,The Animal Foundation,The Animal Foundation,≤100
767529563587001,Equable,Equable,6087
110879326942311,EST. 1619,These ads ran without a disclaimer,≤100
103255827872311,United Homeowners,Troy None Young,396
1255144004653263,Trump Memes 2020,Robert P Leary,≤100
108035720778375,St Saint Patrick's Day,These ads ran without a disclaimer,≤100
276062032825101,Old School Social Studies Films on Roku,These ads ran without a disclaimer,≤100
1677111425839949,The American Promise,American Promise,≤100
537571419599372,John Catsimatidis,Cats Roundtable,179
927610307291393,Georgette Gómez,Georgette Gomez for Congress,≤100
263707517036470,Accelerate Solar,These ads ran without a disclaimer,≤100
107757647374537,Be Vocal Speak Up,These ads ran without a disclaimer,≤100
418365728999079,Tom Siedenbuehl for Congress,Tom Siedenbuehl for Congress,≤100
102620134577981,المنتفضون,These ads ran without a disclaimer,≤100
112049503645128,Eggocrat Challenge,EGGOCRAT,≤100
179222488773966,What's Next Longevity Business Summit,These ads ran without a disclaimer,≤100
2386704041588414,The Texan,These ads ran without a disclaimer,≤100
100944894762010,Being Trump,Michael Hampton Huth,≤100
106580134086704,Black Thread Trendz,Soul City Enterprises,≤100
365169050796567,Ropeless for Right Whales,These ads ran without a disclaimer,≤100
609450252894597,The Whistleblower Revolution,Heidi Ann Weber,≤100
468423900299272,Enough Is Enough Voter Project,ENOUGH IS ENOUGH VOTER PROJECT,≤100
573367726328714,Amazing Cosmos,Meer Sakhawat Hossain,≤100
19192438096,AAAS - The American Association for the Advancement of Science,American Association for the Advancement of Science,17223
100209508247755,Mitch Headline For President 2020,Mitchell Lee Headline,≤100
25852730092,Care2,Care2 Inc,45609
100824151399121,Cregg Dalton for Property Appraiser,Cregg Dalton Campaign Account,≤100
113392110069799,Lina Teixeira 2020,Vote Lina,1155
1425435377743310,Conversations with Bill Kristol,The Foundation for Constitutional Government,402
2046280975668889,LeftvsRightIQ.com,LvR Intelligence LLC,≤100
437054476325946,Evan Power,Evan Power for National Committeeman,329
154288660614,Oregon Republican Party,Oregon Republican Party,≤100
929319713838966,Moonshot AudioVisual,These ads ran without a disclaimer,≤100
2346217618936823,Kendra Horn for Congress,KENDRA HORN FOR CONGRESS,≤100
185652704861747,Bosch Global,These ads ran without a disclaimer,≤100
173543836740,"Democracy Means You stickers, buttons, and tees",Democracy Means You,≤100
212410859328984,MsMedicine,These ads ran without a disclaimer,≤100
112611746799030,0-out,These ads ran without a disclaimer,≤100
105405850844814,Mark Whitney for President,Ellerton Pratt Whitney,604
105579464161164,Depor-teez,These ads ran without a disclaimer,≤100
142456572894631,Donald Trump Cardboard Cutouts,Garrett Earl Kirschbaum,≤100
428197401302854,Boatman for Congress,BOATMAN FOR CONGRESS,≤100
101721517968636,Immigration Waivers,Richard Loiseau,≤100
128716440866482,Adam Milstein,These ads ran without a disclaimer,≤100
22898109808,Grist.org,Grist Magazine,≤100
792668760881092,High Ball Time with your Uncle Otis,Patrick Joseph Fant,≤100
108375560747545,Goswami for County Commissioner,Robert M Mierendorf,≤100
102643054495549,CreativeDem,Laura Auman Roose,≤100
1874405376119622,The Chronicle App,One Chronicle Inc.,≤100
263891677826490,Earthsider,These ads ran without a disclaimer,≤100
106916074935,Lance Wallnau,"Ninja Sheep Marketing, Inc.",≤100
54885616308,SodaStream USA,These ads ran without a disclaimer,124
104246294392997,Culture Fanatic,Sean William Osterberg,≤100
1067735749908158,The Nayshun,The Nayshun,≤100
519590768083165,Abby Finkenauer for Congress,FINKENAUER FOR CONGRESS,206
404164463091452,Chas Castell,Charles William Peter Castell,≤100
937269089651960,Victoria Neave for Texas State Representative,Victoria Neave Campaign,≤100
109005923968299,Term Limits for Congress,These ads ran without a disclaimer,≤100
599037717094428,Lil Guillotine,These ads ran without a disclaimer,≤100
101321914794113,Health Freedom Alliance,Health Freedom Alliance LLC,≤100
83040292558,Mid-Michigan NOW,These ads ran without a disclaimer,≤100
101344601427566,Smile Aisle,These ads ran without a disclaimer,≤100
114679788574872,Diamond Approach,These ads ran without a disclaimer,≤100
224928441359860,Ajna Wellbeing - Holistic Health,These ads ran without a disclaimer,≤100
129181937109516,CFT - California Federation of Teachers,CALIFORNIA FEDERATION OF TEACHERS,≤100
1320840104644018,InfoMullet.com,Timothy Burke Clancy,≤100
619891858182645,Black Yankee Apparel,These ads ran without a disclaimer,≤100
222575382925,Dogwood Alliance,Dogwood Alliance Inc,≤100
101105071349404,"CarolynDye Flm, HQ introducing Sonya Magazine",These ads ran without a disclaimer,≤100
152315634778510,UsAgainstAlzheimer’s,UsAgainstAlzheimer's,≤100
115724785181841,Save the Soldiers Home,Milwaukee Preservation Alliance Inc,≤100
138434734461,CIIS Public Programs,These ads ran without a disclaimer,≤100
115195631833717,NAHREP The National Association of Hispanic Real Estate Professionals,NATIONAL ASSOCIATION OF HISPANIC REAL ESTATE PROFESSIONALS,≤100
428293074682466,MATFA- Make America Trump Free Again,"Matfa, LLC",≤100
885797821467046,Joyous Organics,Ronald Lee Yates,≤100
16477459734,League of Conservation Voters,"LEAGUE OF CONSERVATION VOTERS, INC",7461
376638603087168,Save The Earth,8 Billion Trees LLC,1582
1616728165212478,Environmental Voter Project,These ads ran without a disclaimer,≤100
1003050109876165,Tafilu Store,These ads ran without a disclaimer,≤100
194711150459,"Flores Professional Services, Inc",Flores Professional Services,≤100
1498238047141542,Gus Heyerdahl,These ads ran without a disclaimer,≤100
392100314619441,Bruno Osif,These ads ran without a disclaimer,≤100
107275550810113,TJ Hamblin For Whitley County Clerk,Terry Wayne Hamblin,≤100
119554486101416,WISH BOX GIFTS,These ads ran without a disclaimer,≤100
1702331166691873,Clean Recovery Centers,These ads ran without a disclaimer,≤100
51052893175,Kevin McCarthy,Leader Kevin McCarthy,536
17475614410,Hispanic Federation,HISPANIC FEDERATION INC,≤100
131360095328,Center for EcoTechnology,Emily Susan Gaylord,≤100
1005921859473046,Legacy Housing,Legacy Housing,≤100
100782771327982,Crissyy Slayss,These ads ran without a disclaimer,≤100
7609325759,Jim McGovern,RE-ELECT MCGOVERN COMMITTEE,460
49059279814,Institute for Justice,INSTITUTE FOR JUSTICE,207
296527950373,Felix W. Ortiz,Friends of Felix W. Ortiz,≤100
109529807064290,gali clothing,gali clothing,≤100
1784991421516214,Seek Refuge,Seek Refuge,≤100
105983884281097,Patrick McCarthy,These ads ran without a disclaimer,≤100
192609620649,The University of Chicago,These ads ran without a disclaimer,≤100
103311371170887,One Up Life,These ads ran without a disclaimer,≤100
186891114706643,Help Animals India,HelpAnimalsIndia,≤100
125006968897721,Somos Votantes Education,EQUISLABS,≤100
255746508271078,Lift and Shift Foundation,LIFT AND SHIFT FOUNDATION,≤100
109482240532825,VASCO Global Inc,These ads ran without a disclaimer,≤100
132282710795874,Steves Property Group,These ads ran without a disclaimer,≤100
108619027334814,ABC More,Brittney Diane Prieto,≤100
243510442756370,Justice Democrats,JUSTICE DEMOCRATS PAC,641
354253951601784,LiberalResistance,USA Unify Media Inc,≤100
122604011147079,Brad Schneider,SCHNEIDER FOR CONGRESS,≤100
102512047977282,Conservagator,Founder Media,≤100
552793908120534,A Trayvon Martin Call To Action Committee,These ads ran without a disclaimer,≤100
356482637745012,Stansberry Research,Stansberry Research,2413
100229244869674,Laurie Myers for Massachusetts Republican State Committeewoman,Red Massachusetts Grassroots Action,≤100
42551620536,Equal Justice Works,EQUAL JUSTICE WORKS,≤100
235568106497517,Cordy Lavery Music,Cordelia Lavery Deichmann,≤100
51944927864,San Diego County Taxpayers Association,San Diego County Taxpayers Association PAC,≤100
110319873744405,Re-elect Mayor Linda Hudson,Linda W Hudson,≤100
217888328548263,Visiting Angels,These ads ran without a disclaimer,≤100
2259714234092484,Clover Press,These ads ran without a disclaimer,≤100
1526795577587659,Live Skull,These ads ran without a disclaimer,≤100﻿
112235732143274,Glacier National Park Conservancy,Michael Robert Cantafio,≤100
144850842237429,Independentvoting.org,Independent Voting (IndependentVoting.org),≤100
143986912311328,University of Vermont Continuing and Distance Education,University of Vermont,2005
101148624643231,Mathias Aseh,These ads ran without a disclaimer,≤100
335776924769,"City of Tallahassee, FL - Government","TALLAHASSEE, CITY OF (INC)",≤100
113953261998824,All American Clothing Co.,These ads ran without a disclaimer,≤100
111401736911444,The Renegade Investor,These ads ran without a disclaimer,119
306926196324875,State Representative Anthony Sabatini,Anthony Sabatini,≤100
104931451029183,Shark Imaging,These ads ran without a disclaimer,≤100
151177188227216,Feeding Children Everywhere,Feeding Children Everywhere,1038
575574529481182,Karen Rose for School Board,Karen Rose,360
109330015765713,American Friends of the Episcopal Diocese of Jerusalem,AMERICAN FRIENDS OF THE EPISCOPAL DIOCESE OF JERUSALEM. INC.,≤100
2267934243444139,Justin Stapley,Justin Stapley,≤100
854748721570632,A Second Opinion,These ads ran without a disclaimer,≤100
313531279470103,Demand More 2024,These ads ran without a disclaimer,≤100
183094755077388,Doug McAuliffe Strategic Creative,These ads ran without a disclaimer,≤100
373956815963214,"Waymen Eddings for U.S. Congress, KY-3",Waymen Dewan Eddings,≤100
126297030950,Johnson & Johnson,These ads ran without a disclaimer,677
241247646424302,Jahana Hayes,FRIENDS OF JAHANA HAYES,271
1664240320529470,KLW Graphics Decals,Stacy Ann Arvin,≤100
916420908385196,ALAIN LOBOGNON,These ads ran without a disclaimer,≤100
247216778748319,Chas Rio,These ads ran without a disclaimer,≤100
107114960859009,Daily Conservative,These ads ran without a disclaimer,≤100
124853147616512,Send2Press Newswire,Neotrope dba Send2Press,≤100
1463780097016144,Mark Lago for Mayor of South Miami,Mark Lago Campaign,1156
122235251133808,Republican Party of Clay County,Republican Party of Clay County,≤100
330900136936780,American Heart Association - Florida,"American Heart Association, Inc.",≤100
486612014742426,"Sam Post, pianist/composer",Samuel James Post,≤100
192796262261,Go Solar Power,Thomas Richard Lanzarotta,≤100
210583278987037,St. Augustine Humane Society,St. Augustine Humane Society,≤100
1641621786089991,Trump Shaming,Jan Alyson Knauer,≤100
655273004649847,Authentically American,These ads ran without a disclaimer,≤100
465483726908192,iVote,IVote Civic Education Fund,7098
1421042378165019,Anti Tea Party MEMEs3,These ads ran without a disclaimer,≤100
262458560433359,Old Republic Title,These ads ran without a disclaimer,≤100
107057304124208,2nd and Freedom,2nd and Freedom,≤100
709046012792616,National Audubon Society Action Fund,National Audubon Society Action Fund,4129
638492243022474,"Patriots for Trump Club, Inc.",Gaetano Thomas Ravana,≤100
2240258106195469,Kennon Wooten for Judge,Kennon Wooten for Judge,≤100
101908181399248,Illinois Realtors for Lipinski,National Association of REALTORS,≤100
195561910471475,CATALYST.cm,Catalyst.cm,≤100
16352157727,Alfred A. Knopf,Penguin Random House LLC,250
1543830612580575,Beesponsible,Beesponsible,≤100
163653136980951,National Osteoporosis Foundation,National Osteoporosis Foundation,≤100
729627343834501,Kialo,Kialo,2089
1093516047328910,Methow Valley Citizens Council,Methow Valley Citizens Council,≤100
626681524134752,Williamson County Sheriff  Robert Chody,Robert Chody for Sheriff,≤100
339079987355,The Johnson Foundation at Wingspread,"JOHNSON FOUNDATION, INC., THE",≤100
129921337078906,YallPolitics,"Jackson New Media, Inc.",≤100
8895898655,Rainforest Alliance,"RAINFOREST ALLIANCE, INC.",605
111933176947295,t_honey,These ads ran without a disclaimer,≤100
388475271497575,The Trump Revolution,Dora Louise Collier,≤100
598830780279445,Say Yes to MCC,Say Yes to MCC,≤100
1327981587341200,Trump This President,Richard Edwin Bennett,≤100
217001931975825,Elevation,Elevation,601
167071422566,izzit.org,These ads ran without a disclaimer,≤100
1088557621173422,Water4Life Mozambique,Arnold Eugene Eastburn,≤100
111470060340066,Troy Slaten for Judge,Troy Slaten for Judge,≤100
109240430426227,Monika Johnson-Hostler For Congress,MONIKA FOR CONGRESS,≤100
446979785493179,SoFlo SAT Tutoring,SoFlo SAT Tutoring LLC,149
917308711786607,Farmers for Free Trade,Farmers for Free Trade,1119
109421690594551,Maxim Trub,These ads ran without a disclaimer,545
424215024387622,City of Port St. Lucie - City Hall,These ads ran without a disclaimer,≤100
107469190600265,Freshy Factory,These ads ran without a disclaimer,≤100
104962471013362,Trump Fake Rap,Jeffrey Stewart Newton,≤100
105202730827149,Michael Moore for Commissioner,Michael Moore for Commissioner,≤100
312087222175938,Southeast Texas Record,The Record,≤100
112000150202259,Jeff Hendry for Leon County Commission,Hendry for Leon County,809
190062194353228,Wycliffe Associates,"WYCLIFFE ASSOCIATES, INC.",175
466296173491037,OFS Tax Pros,These ads ran without a disclaimer,375
317157555861204,Kirkendall Dwyer Law Firm,Lymphoma Law,978
105882174183801,PACRONYM,PACRONYM,669
1722014968116461,Zachary Wefel for Minnesota House 60A,Phelan Boru Oneill,≤100
530604487365010,Old Glory Flagpole Kits,Service First Flag Poles,21494
107079100874961,EcoRecycli,These ads ran without a disclaimer,≤100
386910774700817,Treble Hook's Florida Folk and Medicine Show,Scott Lee Rexroat,≤100
742790559090054,Alex Rowan Foundation,David Rowan,≤100
104152941364,Janet Nguyen,Janet Nguyen for Assembly 2020,≤100
2445793259037453,Blattman for Arizona,Blattman for Arizona,≤100
247015772407183,Women's March Florida Jacksonville Chapter,These ads ran without a disclaimer,≤100
948471375219061,American Conservative Union Foundation - Nolan Center for Justice,American Conservative Union Foundation Center for Justice,≤100
146578545810910,Sterling Etail,Andrew C Sterling,≤100
108097323905243,SwagRight,Swag Right,≤100
406456986070332,Matt Gaetz,Friends of Matt Gaetz,1074
137133369207,Israeli American Council - IAC,Israeli American Council,≤100
61062184221,ChildFund International,These ads ran without a disclaimer,≤100
115761269812805,Jeff Hinkle,Jeff Hinkle Campaign,309
101082594721098,Funnyshh,These ads ran without a disclaimer,≤100
320487991392267,Yellow River Calls,Justin Matthew Rosso,≤100
106760600665063,Judge Sam Terry for Circuit Court,"Paris Marketing & Public Relations, LLC",≤100
116123825073727,Davis Auto Sales,These ads ran without a disclaimer,≤100
103083877894082,Catherine Roman for State Committee Woman,Red Massachusetts Grassroots Action,≤100
385219425615934,Insider Envy - Shows,These ads ran without a disclaimer,≤100
107456970701014,Mary Fitzgerald for District 31 House,Aary Fitzgerald,≤100
1415941991981876,Texas Central,Texas Central,≤100
100863078007868,Yvynaturals,These ads ran without a disclaimer,≤100
1362611860520997,Hill Firm,Hill Firm,≤100
423670114403144,Trending in China,These ads ran without a disclaimer,≤100
850071828474130,Safe Homes: Anti Child Trafficking,These ads ran without a disclaimer,≤100
792433454190785,No Fear Tees,David Cullum Miller,≤100
975849335817140,Northern California Record,The Record,≤100
105992254226489,វីឌីអូចំរុះ,These ads ran without a disclaimer,≤100
103088991077880,"Maga Houston, Clear Lake & LC",These ads ran without a disclaimer,≤100
118363268823600,Andrew F. Kotyuk Republican for Assembly,Kotyuk for State Assembly 2020,≤100
1601377096812003,PATHWATER,These ads ran without a disclaimer,≤100
112041183486666,Project Sunshine,ACRONYM,493
582675068550931,"The AWARE Foundation, Inc.","The AWARE Foundation, Inc.",≤100
299588323424419,Legal Newsline,The Record,≤100
804568342964376,2nd Amendment Rights,One Nation Design,≤100
366987760836531,Raul Reyes For Congress,RAUL FOR CONGRESS,≤100
587492097959347,Orange County Registrar of Voters,These ads ran without a disclaimer,≤100
1764680377156652,Trumpy Bear,EXCEPTIONAL PRODUCTS INC,304
104226461023007,Anti-Semitism Accountability Project,Anti-Semitism Accountability Project,8507
1805093803043686,Five Minutes with Barry and Ed,These ads ran without a disclaimer,≤100
100568064752583,Hannah for Council,Campaign Fund of Hannah LeGris,≤100
586147734741827,Post Hill Press,Post Hill Press,≤100
283251328948319,Lil Keed,These ads ran without a disclaimer,≤100
46884117504,John Matthew Walker,John Matthew Walker,≤100
172871454678,Y. Dan Rubinstein,Yigal Dan Rubinstein,≤100
1653251174924652,Fuzzu,These ads ran without a disclaimer,≤100
100417871311109,RidePlate,Marcos None Miranda Morales,≤100
107578644013555,Parker Sloan for County Commission,Elect Parker Sloan,≤100
1092340954202973,Maya Rockeymoore-Cummings for Congress,Maya Rockeymoore-Cummings for Congress,241
107478604080028,Way To A Happy Heart,Iesha Marriah Nixon,696
170704366969922,Panay Agenda,These ads ran without a disclaimer,≤100
2490222877677181,TAPS / True American Patriots Society,These ads ran without a disclaimer,≤100
716869668367099,Kennett Democrats,Wayne A Braffman,≤100
232216444296187,Race2Dinner,Genevieve L Graham Swift,≤100
112527790309387,Homicide Hunter,These ads ran without a disclaimer,≤100
101213707964033,Oseguera2020,OSEGUERA 2020,≤100
106601974029123,Rob Hardwick for Sheriff,Rob Hardwick for Sheriff,≤100
102026767904506,Matern 2020,Matern 2020,1544
1905306419750517,TMCT,Charleston G Malkemus,≤100
348973409274904,Velvet Hamster,Velvet Hamster,525
109021767293838,Making Retirement Last,Making Retirement Last,20232
751679868274074,Hope for Students,THE EXPECTATIONS PROJECT INC,≤100
125067947537833,Stuart Air Show,These ads ran without a disclaimer,≤100
252233011849206,Kendall Democrats,Lucia Huete Suarez,≤100
105176984235237,2020hatsnstuff,Ada L Posey,≤100
112420993589373,Young and Old for America,Andrew Joseph Young,331
127206910671768,Physicians for Social Responsibility,PHYSICIANS FOR SOCIAL RESPONSIBILITY INC,2000
940038889402416,JUST Capital,These ads ran without a disclaimer,≤100
316955281351,APWU - The American Postal Workers Union,AMERICAN POSTAL WORKERS UNION,≤100
278874859477802,Dujuan Thomas,Dujuan Lamar Thomas,≤100
279351549238696,Dr. Marty Pets,These ads ran without a disclaimer,≤100
336470580233523,Pins and Aces Golf Co.,US Craft Brands LLC,1230
112910896761648,Tanya Ortiz Franklin for LAUSD Board District 7,"Tanya Ortiz Franklin for School Board 2020, Additional information is available at LA City Ethics",≤100
108380923919757,Health Insurance Hero,Health Insurance Hero,416
662188620489322,Viviana Janer for Osceola,Viviana Margarita Janer,≤100
167418116629106,Austin Street Center,SHELTER MINISTRIES OF DALLAS,≤100
