Page ID,Page Name,Disclaimer,Amount Spent (USD)﻿
1674679465879284,Dean Cavaretta for Republican State Committeeman,Cody M Parsons,≤100
789696478072946,The Liberty Loft,The Liberty Loft,≤100
103013484413211,Sheriff Heldman,Heldman for Sheriff,≤100
706414369427081,Nick Freitas,Friends of Nick Freitas Inc.,≤100
836024883258680,Funny HaHa,Brian Kelly Courtright,≤100
425794227980011,Jeffrey A. Sites for Congress,JEFFREY A. SITES FOR CONGRESS,≤100
246193508902973,cut50,Dream Corps,≤100
164302750336862,Wish,These ads ran without a disclaimer,≤100
352527958302,Israel on Campus Coalition,Israel on Campus Coalition,1624
251542931536626,Children's Wisconsin,"CHILDREN'S HOSPITAL AND HEALTH SYSTEM, INC.",≤100
644655489007210,The Solar Institute,The Solar Institute,9372
87186661244,Johns Hopkins Bloomberg School of Public Health,These ads ran without a disclaimer,≤100
896759427103774,Modern Medicaid Alliance,Modern Medicaid Alliance,187
114990649960270,Matt Moore 2020,Elect Matt Moore,≤100
178099638985523,Dr. Kordonowy MD,These ads ran without a disclaimer,≤100
157530597777787,Richmond 4 State Rep District 21,Richmond for State Representative,≤100
348839551906904,Democracy in Color,POWERPAC DOT ORG,150
96771266759,AMSA - American Medical Student Association,AMERICAN MEDICAL STUDENT ASSOCIATION,≤100
433446973789052,Let Us Vote For A Balanced Budget Amendment Citizen's Campaign,Let Us Vote For A Balanced Budget Amendment Citizen's Campaign,≤100
23489729942,Mike Gallagher,Salem Media,1137
183623155655860,Driver Matters,These ads ran without a disclaimer,≤100
460765874656654,Sammy Ravelo for Congress,SAMUEL RAVELO FOR CONGRESS,≤100
1675630946095534,Franciscan Missions,Franciscan Missions,≤100
119283008140727,Pela Case,These ads ran without a disclaimer,≤100
466164103423147,Thorn,Thorn with Facebook Ad Credits,712
102950803268,Food Bank of the Southern Tier,Food Bank of the Southern Tier,≤100﻿
110723300440100,Financial Crisis in America,Christopher Michael Richichi,≤100
328126871442240,Luis Marin for Citrus County Commission,Robert Winsler,101
106272007486127,Karen DeSanto Kellogg,Committee to Elect Karen DeSanto Kellogg Judge,≤100
111508560325108,Lhstore_,These ads ran without a disclaimer,≤100
105363444295363,Health Is The New Wealth,PETER-GAY NIKORA LINDO,≤100
148494598849,Milken Educator Awards,MILKEN FAMILY FOUNDATION,186
108033614124277,Bizzo Swifty,These ads ran without a disclaimer,≤100
109762473856239,Marcus Sykes for president 2020,Marcus E Sykes,≤100
101836161264070,Frank Hibbard for Mayor,"Frank Hibbard, nonpartisan, for Clearwater Mayor",11002
1119772434869253,Comedy Comedy,Avery William Sommerfeld,≤100
1556932204325823,ProgressPop,ProgressPop,≤100
100580918059008,Gary Bradford for Pasco County Commissioner,"Gary Bradford, Republican, for Pasco County Commissioner",433
116173266451580,Adrienne Bennett for Congress,ADRIENNE FOR CONGRESS,≤100
140614202619821,iCivics,iCivics,≤100
101679918096946,Re-elect Marqueece Harris-Dawson,Harris-Dawson for City Council 2020,≤100
21559454473,FAIR,FEDERATION FOR AMERICAN IMMIGRATION REFORM,17026
121626482110,Operation Smile,"OPERATION SMILE, INC.",21629
97672210768,University of Miami Hillel,These ads ran without a disclaimer,≤100
111429273758353,Cityfun family therapy,These ads ran without a disclaimer,≤100
2086703394708672,TwentyTwenty,These ads ran without a disclaimer,≤100
1118416021674713,משפחת ביטוח ישראלית - ביטוח לישראלים בארה"ב,These ads ran without a disclaimer,189
100852586711047,League of Women Voters Central Kane County,League of Women Voters Central Kane County,≤100
123352342100,Zipnosis,Courtney Lauren Byrd,≤100
102365541253384,Ford O'Connell,Ford for Florida,6770
106158887448553,Janessa Goldbeck for Congress,JANESSA GOLDBECK FOR CONGRESS,≤100
475359972474269,Graphicacy,These ads ran without a disclaimer,≤100
106987864140710,Blue Jupiter,Billie Jo Farvour,≤100
156919911022572,Steven Horsford,NEVADANS FOR STEVEN HORSFORD,≤100
372799605421,DeSmog,DeSmog,≤100
766619180022147,Senator John Cooper,Cooper for Senate,≤100
108514693875761,Lauren Young for 1st Ward Committeeperson,Friends for Lauren Young,≤100
110251373805984,Hilario4America,These ads ran without a disclaimer,≤100
183002305543,Tearfund USA,Tearfund USA,≤100
542530592949093,Dave Lindstrom,Lindstrom for Senate,≤100
110104717052109,Save Florida Man,The Windward Fund,23040
2266168376974784,Marc Flores For Congress,MARC FLORES FOR CONGRESS,≤100
111629800369875,Troy Lawson For Guilford County Commissioner District 5,Friends of Troy Lawson,≤100
1312206442203955,Moneyline Tees,These ads ran without a disclaimer,≤100
110637223760375,Lemondad shop,These ads ran without a disclaimer,≤100
227813534020769,Monica Garcia,Monica Garcia for City Council 2020,≤100
125182621527545,Sarah McBride,Friends of Sarah McBride,≤100
110211287060311,Fanon Rucker for Prosecutor,Committee to Elect Fanon Rucker,≤100
176548369099092,Barbara Lee,BARBARA LEE FOR CONGRESS,185
104762991057171,uActivist,Corey Kubber,≤100
1285066134961557,Frank E. Polo 4 Congress,Frank Enrique Polo,≤100
341715643214947,The Last House Standing,Joseph George Siegal,≤100
44164653347,Safer States,These ads ran without a disclaimer,≤100
105026891006847,YES on D,These ads ran without a disclaimer,≤100
102202757894048,Keep America High-tm,Brandon Michael Donofrio,≤100
103403207881196,America's Freedom Wear,These ads ran without a disclaimer,≤100
57401739949,Better Angels,These ads ran without a disclaimer,≤100
248257968527195,ARTs East New York,These ads ran without a disclaimer,≤100
385923358459984,Almost Heaven,These ads ran without a disclaimer,≤100
100416560012896,Friends of the Everglades,William Marshall Cutchin,≤100
329272720965256,GALvanize USA,GALvanize USA,201
988524987884863,Maria Espinoza for Congress,Maria For Congress,≤100
165858562140,Western Resource Advocates,These ads ran without a disclaimer,≤100
112537203502267,Ruben Reyes Diputado 2020,These ads ran without a disclaimer,≤100
108583533855999,NBC LX,These ads ran without a disclaimer,≤100
1557717027809584,AARP Programs,These ads ran without a disclaimer,340
101420418036481,Catherine Parker for Congress,Catherine for Congress,≤100
101666834660987,Bill Dunklin for State Senate,Bill Dunklin for State Senate,≤100
1554365984818934,R.I. General Treasurer Seth Magaziner,CollegeBound Saver - R.I.'s 529 Education Savings Plan,≤100
635047320197758,Au Natural Skinfood,These ads ran without a disclaimer,≤100
103368648567,Greater Boca Raton Chamber of Commerce,Boca Raton/Boynton Beach Chamber of Commerce,114
821614381344417,Democracy Tea Party,Democracy Tea Party,≤100
1608037099452838,Brianna Wu,BRIANNA WU FOR CONGRESS,≤100
440026609670800,LEAP Forward,Charles Edward Jr Yeganian,≤100
525242127682576,Jan Schneider,FRIENDS OF JAN SCHNEIDER,190
103893510971054,The Truth Podcast: Question Everything,Richard Ucheabuchi Ojeh,≤100
525396584321086,Girls' Voices,These ads ran without a disclaimer,≤100
42590232694,CAIR,"CAIR-FOUNDATION, INC.",≤100
616079045236845,tallyED,tallyED.com,640
183812595365200,Greater Austin Crime Commission,Greater Austin Crime Commission,≤100
918416854938345,Call to Freedom,Cal To Freedom,≤100
106661834135526,WhistleblowersforTrump2020,Jay H Schroeder,≤100
105985737434848,Gerard Moorer,Citizens for Moorer,≤100
106517014246373,jamesmichael89,These ads ran without a disclaimer,≤100
300992409852,Hoover Institution,Hoover Institution,2199
102764011165938,Interesting Home Programs,Local Home Programs,1646
316622191804157,UTK,Wendell Nelson,≤100
461530314600399,Common Sense American Politics,Common Sense American Politics,110
69151686023,Ruth's List Florida,Laurie Boone Wack,174
398632340472091,Journiest,These ads ran without a disclaimer,≤100
548407915183371,Liz Cheney,Liz Cheney for Wyoming,342
115883606515801,Bob Good for Congress,Good for Congress,≤100
104103700998973,ForbiddenWears,ForbiddenWears,≤100
108997650657922,Fueled By Hate and Caffeine,These ads ran without a disclaimer,≤100
979714288869025,Anne Marie Gennusa for Public Defender,Anne Marie Gennusa for Public Defender,≤100
309993142375589,Joe Kennedy III,KENNEDY FOR MASSACHUSETTS,7010
6691963292,Jeanne Shaheen,SHAHEEN FOR SENATE,596
112009533636225,ดูแลสุขภาพในราคาถูก,These ads ran without a disclaimer,≤100
1068036746719942,Uncommon Sense: conservative opinion,These ads ran without a disclaimer,≤100
258848839880,Horizon Blue Cross Blue Shield of New Jersey,Horizon Blue Cross Blue Shield of New Jersey,≤100
1425252601026373,New England Kenworth,Marybeth Alosa,≤100
103477517898339,Lilian Rodríguez,These ads ran without a disclaimer,≤100
466705430534862,Benjamin Yu for Assembly 2020,Scott Charles Winn,≤100
352517808109574,Daniel Zolnikov,"Montanans for Daniel Zolnikov. PO Box 50403, Billings MT 59105. (R)",≤100
309785439956456,コスタリカから日本へ、魔女の便り,These ads ran without a disclaimer,≤100
130560814140554,TheLatinaPro,These ads ran without a disclaimer,≤100
215554669209085,The Dan Smolen Experience,"The Dan Smolen Experience, LLC",≤100
106591377554563,Rick Carper For Mayor of Atlantic Beach,Rick Carper Campaign Account,≤100
466272080089790,Denton County Commissioner Hugh Coleman,Hugh Coleman Campaign,≤100
103264694421617,Vox Populi Res Novae,These ads ran without a disclaimer,≤100
77590795932,John Kasich,Kasich For America,≤100
354586505391697,Derrick Evans - The Activist,Derrick Evans,≤100
45393753416,Alliance Defending Freedom,These ads ran without a disclaimer,≤100
182383268803,Loranne Ausley,Loranne Ausley for Florida Senate,590
929749410454517,Berners for Bernie,Jonathan Todd Allen,≤100
173062966431046,Power California,Power CA Business Account,≤100
140269966553891,The Constitution Study,Paul Edward Engel,≤100
220413424654618,Nevada Right to Life,Nevada Right to Life,≤100
1546952572205770,UAEUSAUnited,These ads ran without a disclaimer,≤100
290122961075378,Republican Liberty Caucus of Massachusetts,Republican Liberty Caucus of Massachusetts,≤100
993668450793555,Alliance for Housing Justice,These ads ran without a disclaimer,≤100
100562019990818,U.S. Term Limits,U.S. Term Limits Inc.,≤100
19010003406,Elisabeth Haub School of Law at Pace University,Pace University Law School,≤100
100232231521671,Patriots of US,DEVYN MICHAEL LOWE-GREEN,≤100
288772408533411,Florida Conservation Group,These ads ran without a disclaimer,≤100
435918826739064,T-Shirts and more,These ads ran without a disclaimer,≤100
2037938779622595,Tina Arias Miller for Democratic Party OC Central Committee - AD 68th Dist.,"Tina Arias Miller Central Committee, AD68 Democratic Party, FPPC#1424994",≤100
1845587768818403,Councilman RJ Hawk for State Rep-District 31,Hawk for State Representative,≤100
274290832609763,Protect Our Defenders,These ads ran without a disclaimer,≤100
130196227157534,American Forum For Israel,Eugene Lekakh,≤100
340823876032476,Duval County Democratic Party,Duval County Democratic Executive Committee,≤100
458796621183564,Calen Studler for Kentucky State Senate,"Studler For Kentucky, Jennifer Lucas Treasurer",≤100
148306605193993,Blue Shield of California,Lawrence Joseph Sepe,≤100
123300885084304,Mothers Against School Shootings,These ads ran without a disclaimer,≤100
104909024267273,Forthehoodonly,These ads ran without a disclaimer,≤100
118077188818622,Newz Today,Newz Today,≤100
36468835352,New England Aquarium,NEW ENGLAND AQUARIUM CORPORATION,≤100
473191156175163,EDF Action,Environmental Defense Action Fund,2090
104320074406295,David Cook for State Representative,David Cook Campaign,≤100
172696189433474,The Great Courses,These ads ran without a disclaimer,≤100
1906880569322429,League of Women Voters of North Pinellas County,These ads ran without a disclaimer,≤100
2057316290987577,Medigap Life,These ads ran without a disclaimer,199
102928771314805,Trump Trading Cards,These ads ran without a disclaimer,≤100
111018393814396,Quiddity company,Jordan Paul Thomason,≤100
110181477071627,The World Helping Network,Local Home Programs,4053
107488974083876,The Case for Democratic Socialism,Peter Shaw,≤100
1171050289674423,FreeWill,FreeWill Co.,≤100
1407059812845946,Martin Luther King III,These ads ran without a disclaimer,≤100
103867707678998,MAGA Energy,MAGA Energy,≤100
56129410661,Justice Policy Institute,SARAH RACHEL ROSE-STERN,≤100
102330281223041,Tradewater,"Tradewater, LLC",1254
24126948070,PrintPlace,"Digital Room, Inc.",296
498614766816477,Political Window,omyk.co,≤100
107413274082353,Annie "Mamá" Garcia for U.S. Senate,Run Annie Run,197
110301837091776,Pabitra Adhikary,These ads ran without a disclaimer,≤100
101446051467697,People's Revolution,People's Revolution,≤100
141815795868516,Graffic Traffic,These ads ran without a disclaimer,≤100
1764680377156652,Trumpy Bear,These ads ran without a disclaimer,≤100
109420497227030,Rooooms,These ads ran without a disclaimer,≤100
1434747820157997,Mark O'Loughlin for Pembroke Pines Commission,Mark O'Loughlin Campaign,589
110031723895365,Living As One Now,Lynn Nguyen,5592
177168212329270,Tana Rose,These ads ran without a disclaimer,≤100
1818123491821040,Tone Mott "Versatile" TV,These ads ran without a disclaimer,≤100
115268821893794,Environmental Action,"Environmental Action, Inc.",≤100
146678415405673,FindLaw for Legal Professionals,FindLaw Legal Professionals,≤100
109151130456813,The News According To Me,Richard Siegel,≤100
7268844551,Rotary International,ONE ROTARY CENTER,162
16223832249,RAINN,"RAPE, ABUSE AND INCEST NATIONAL NETWORK (RAINN)",921
359933137438156,Nine Line Apparel,These ads ran without a disclaimer,≤100
597117373778973,Addicted to Golf,The Dude's Designs,≤100
290954545137683,Janus,Korey Ann Moser Wilson,≤100
1524411157786675,2moda,"A.M.D.A. DISTRIBUTORS, INC.",≤100
152222811464994,One Arizona,One Arizona,≤100
154258524769560,Jovani Giron The Bronx & Westchester trusted Realtor,These ads ran without a disclaimer,≤100
110773130329664,Lulu Seikaly for Congress,LULU FOR TEXAS,≤100
1001412010049604,Peace 24-7,John D Linnehan,≤100
14226615647,People For the American Way,People For the American Way,1292
133608809985411,One Colorado,ONE COLORADO,≤100
1401118946812098,Daniel Herrera,Daniel Alberto Herrera,≤100
232894957245453,Nori,Nori LLC,≤100
116263461735315,New Hope Church of God By Faith Inc.,These ads ran without a disclaimer,≤100
490878544338912,Kirkland4District1,Kirkland for Gwinnett LLC,≤100
46428009499,The Jewish Agency for Israel,These ads ran without a disclaimer,≤100
110336730392382,I Love My People,These ads ran without a disclaimer,≤100
105829890888882,Dalton for House,James Samuel Dalton,≤100
1752689034960996,The Babylon Bee,These ads ran without a disclaimer,≤100
245815932119105,Wilton Simpson,Jobs for Florida,1173
2459483887446034,Kristine Schanbacher,KRISTINE SCHANBACHER FOR CONGRESS,≤100
185538520004,End Poverty,ENDPOVERTY.ORG,≤100
1346494722165099,Father Groppi Film,These ads ran without a disclaimer,≤100
110964570317521,Jakey’s mobile rescue unit,These ads ran without a disclaimer,≤100
111664170338664,Eco Roots,Quinton Van Williams,≤100
170582513587720,Liberty Through Wealth,The Oxford Club,15103
1451021311778974,St. Luke's Edmond,St. Luke's Edmond,≤100
114589483331967,Build Affordable Faster,"Housing Forward SF, Yes on E",≤100
445363556233439,UnHide,These ads ran without a disclaimer,≤100
108792067368085,Meme Force Supreme,These ads ran without a disclaimer,≤100
6072343558,Center for American Progress,CENTER FOR AMERICAN PROGRESS,109
177814032238168,Revenge Is,Engage Tees,≤100
104654951096964,Environmental Watch,8 Billion Trees LLC,369
117046548337381,WILDCOAST,WILDCOAST,≤100
556919331070107,ITEM m6,These ads ran without a disclaimer,≤100
116030521840,Maccabi USA,Limor Gurevich,≤100
105960260888294,Physically Healthy,Sarah Ngozi Nwagwu,1578
1271485922992258,Southern Rhea’s Boutique,These ads ran without a disclaimer,≤100
60449667441,Family Research Council,FAMILY RESEARCH COUNCIL,412
841825669186798,Kevin Ruane,Kevin Ruane Campaign,937
192324171344465,Short Rigger Tackle,These ads ran without a disclaimer,≤100
101254951286368,Highway Hounds Rescue,Bobette Ackerman,≤100
73016054191,Regional Food Bank of Oklahoma,"REGIONAL FOOD BANK OF OKLAHOMA, INC.",≤100
1680018292279937,Sam Parker,Samuel Parker,705
107242154028893,Rhapsody,These ads ran without a disclaimer,≤100
1690390361215211,Rommel For State Representative,Bob Rommel for State Representative,1117
103760691205357,Selica,These ads ran without a disclaimer,≤100
454318278305978,"Apalachee Center, Inc.","APALACHEE CENTER, INC.",≤100
55549065733,Voto Latino,VOTO LATINO INC.,58826
779249145512907,Great America Tees,Devin Michael Hedge,≤100
100862298037952,Trump is Garbage,Trump is Garbage,≤100
182079698493370,Portside,Portside,238
329124997798417,Tom Norton for Congress,Tom Norton for Congress,≤100
12629041467,George Street Playhouse,These ads ran without a disclaimer,≤100
110433123813265,Alex Wan for Atlanta,Friends & Neighbors of Alex Wan,≤100
129255907131113,NumbersUSA,NUMBERSUSA EDUCATION AND RESEARCH FOUNDATION,5562
109668833970851,theartofdougie,ALEXZANDER JEROME DOUGLAS-MASON,≤100
203330919857759,All On The Line,National Redistricting Action Fund,15319
132753914062,"Planned Parenthood of South, East and North Florida","Planned Parenthood of South, East and North Florida",27344
102499901286348,Bold Vision P.C.,BOLD VISION PC,6081
169830155029,m/Oppenheim Associates,m/Oppenheim,≤100
81225128705,Beyond Celiac,These ads ran without a disclaimer,≤100
131994543867785,New Nationalism.com,Robert Woodward Claude,≤100
107619547387618,Dump Trump,Jeffrey Robert Harding,≤100
204845412960834,Kevin Brady for Congress,Brady for Congress,≤100
119947132733743,Frank Reddick,Frank Reddick Campaign,364
296438217073791,11th Hour Racing,11th Hour Racing,≤100
100461498036438,steinhart.frank,These ads ran without a disclaimer,≤100
113024203576744,Bright Ideas,Edlan Kuo,≤100
28510612138,Uncommon Knowledge,Hoover Institution,351
427740904660756,Tom Barron for Judge,Committee to Elect Tom Barron,≤100
22627435207,Presbyterian Church (U.S.A.),These ads ran without a disclaimer,≤100
1527354457493277,Place of Hope in Haiti,Place of Hope in Haiti,113
1883300028563889,Heninger Garrison Davis LLC,These ads ran without a disclaimer,≤100
296356694135040,Goods Unite Us,Goods Unite Us,≤100
269719197271294,Accountable.US,Accountable.US,1112
113401826751064,Jim DeBello,DEBELLO FOR CONGRESS,≤100
2181403648815959,America United,America United Daily,304
338855069522459,Im Tirtzu,Im Tirtzu,≤100
105332121071355,Eminen,These ads ran without a disclaimer,≤100
108552410720809,Taageerayaasha Madaxweyne Abdikarim Guled,These ads ran without a disclaimer,≤100
336124860558275,Christine Hill for Assembly,Christine Hill for Assembly,≤100
30079936984,CWS,These ads ran without a disclaimer,≤100
353119708766020,Govenor Williams 2,GOVENOR WILLIAMS OF SANDY SANSING DEALERSHIPS,708
35142679763,Alzheimer's Disease Research,"BRIGHTFOCUS FOUNDATION, INC. A/K/A BRIGHTFOCUS FOUNDATION",1132
586153888207980,To Kill a Mockingbird on Broadway,To Kill a Mockingbird on Broadway,685
121824462539903,"Jeri Rodriguez for Denton County Constable, Pct 3",Jeri Ann Rodriguez,≤100
150461148299523,UCSF,"University of California, San Francisco",≤100
101248604720303,Land Betterment,These ads ran without a disclaimer,≤100
355099264516393,The Times Of Earth,These ads ran without a disclaimer,≤100
190532957805960,Bill Post,Friends of Bill Post,≤100
194079794553700,Invested Interests,Invested Interests,≤100
100481081424285,"Kashi Adhikari for Ohio State Representative, District 22",Mahindra Adhikari,≤100
383677738397139,Association for Accessible Medicines,Association for Accessible Medicines,129
271964256289451,Mohamud Noor for House 60B,Noor for House,≤100
426021277760348,Lee Mangold for Florida House 28,Lee Mangold for Florida House 28,≤100
79125112926,Students for Life of America,These ads ran without a disclaimer,≤100
103244034449821,hermesflowgod,These ads ran without a disclaimer,≤100
91346559231,Democratic Legislative Campaign Committee - DLCC,Democratic Legislative Campaign Committee,≤100
109978847192920,devy_music,These ads ran without a disclaimer,≤100
452268584980351,Sami Al-AbdRabbuh,Sami For Oregon PAC,≤100
109168517144555,Mike Denton,Mike Denton Campaign,≤100
684016825122195,Andy Thorburn for OC Board of Education,Andy Thorburn for Orange County Board of Education 2020,≤100
112637190235113,Cassie Chambers Armstrong for Metro Council 8,Armstrong for Kentucky,≤100
1007034969334989,Robert L. Deming III for United States Congress,ROBERT DEMING FOR CONGRESS,≤100
299220150991766,Shannon Hutcheson for Congress,SHANNON HUTCHESON FOR CONGRESS,≤100
102896207798847,John Castorani,Castorani for Congress,≤100
253230924799812,The Church of God International,These ads ran without a disclaimer,≤100
750067388680360,Albany County for Proper Policing - ACOPP,Albany County for Proper Policing,≤100
337796227997,Prosperity Candle,PROSPERITY CANDLE L3C,≤100
316906419223192,Pray America Great Again,Tina B Whitfield,≤100
42224809904,Pacific Oaks College,TCS Education System,≤100
104567291054733,Committee to Elect Steve Hale,Steve Oakley Hale,≤100
114907186726511,Sustainable Vibes,These ads ran without a disclaimer,≤100
104291191113669,The Scourge - IRMAA Medicare Premium Penalties,These ads ran without a disclaimer,≤100
111970763678740,KT Nine Uni,These ads ran without a disclaimer,≤100
100799001427811,Ladera Del Mar,These ads ran without a disclaimer,2788
2076465639310998,Jessica Taylor,Jessica Taylor for Congress,≤100
111903213699319,Mygunsmyrights,These ads ran without a disclaimer,≤100
6239388420,Arbor Day Foundation,NATIONAL ARBOR DAY FOUNDATION,≤100
151525932186806,When Democrats Turn Out,WHEN DEMOCRATS TURN OUT PAC,7327
195155184265445,Choosing Clean Energy: A Campaign of The Nature Conservancy,Nature Conservancy,118
109886877204998,Koala Sock Co.,Michael Katz,≤100
1135371009958405,Melissa Morris for Texas Senate,Morris For Texas Senate District 13,≤100
109040050600129,"Kiwanis Club of Cloudcroft, New Mexico",Kiwanis International,≤100
104908474440144,Patrick Crowley GOP State Committee,Red Massachusetts Grassroots Action,≤100
223211401348063,Alarmingly Bad,These ads ran without a disclaimer,≤100
103790454312392,J.Ross Lacy for Congress,J.ROSS LACY FOR CONGRESS,≤100
101784008065542,Commit to Seniors,American Commitment,≤100
7483836629,Ancestry,Ancestry.com Operations Inc.,1443
104006944272732,Honest Arizona,Advancing AZ,388
107700113971854,Pa la Calle,These ads ran without a disclaimer,≤100
7100914121,American Experience | PBS,These ads ran without a disclaimer,≤100
114282963288352,Rex Larson,Friends of Rex Larson,≤100
68771922854,Essence,Shaelyne Antonia Moodie,173
282390275567346,32805 OrlNews,32805OrlNews.com,≤100
157011338475461,Luminary,These ads ran without a disclaimer,≤100
105882857639306,Secure Life Benefits,Alexis Travieso,≤100
126775672663,Faithful Adoption Consultants,These ads ran without a disclaimer,≤100
1266954743320069,Alpha Elite Performance,These ads ran without a disclaimer,≤100
114053923470138,Yes and,These ads ran without a disclaimer,≤100
339261946960273,I do NOT support Trump,Bryan A Raffetto,≤100
8340223883,Avaaz,Avaaz Foundation,102
105670424238508,Mejai's,These ads ran without a disclaimer,≤100
10234472029,Council on Foreign Relations,Council on Foreign Relations,2148
486356671384997,Hindustanisakhisaheli,Aparna Nayak,≤100
1955471264486935,The Colorado Sun,The Colorado Sun,148
629844947113308,Dustin Burrows for Texas,Dustin Burrows Campaign,≤100
316740262239537,Free Trip To Egypt - The Film,These ads ran without a disclaimer,≤100
48330349120,DJ Mel,These ads ran without a disclaimer,≤100
107291610782111,Injustice For Brawl Apparel,These ads ran without a disclaimer,≤100
103577384480563,Ridiculous Rebels,Nathaniel James Duvall,≤100
111042343636242,Digital Auto Benefits & Program,Senior Savings Programs,599
484112108637869,Celeste Williams for Arkansas,CAMPAIGN TO ELECT CELESTE WILLIAMS,≤100
104696810991605,Laura Loomer for Congress,LAURA LOOMER FOR CONGRESS INC,1100
103445664479228,Let's Go Trump 2020,Daniel Clay Parker,≤100
29056789480,Project Syndicate,Project Syndicate,≤100
1457613447869457,Visiting Angels,These ads ran without a disclaimer,≤100
670159703147062,13 Fifty Apparel,These ads ran without a disclaimer,≤100
1669057780074364,Make America Sane Again 2018-Close the Circus 2020,Michael Warren Anderson,≤100
7292655492,MoveOn,MOVEON.ORG POLITICAL ACTION,5508
706915236389897,Alphaomaga,Timothy Andrew Kenefic,≤100
1793349057355115,MN350 Action: Climate Justice in Minnesota,MN350 & MN350 Action,≤100
122671561263552,Committee for Better Banks,"COMMUNICATIONS WORKERS OF AMERICA, AFL-CIO, CLC",103
171636242883642,P.A.N.D.A.S. Network,These ads ran without a disclaimer,≤100
208786722992768,Dr. John Biggan for Congress,John Robert Biggan,≤100
362432094308130,Weediatrics,Matthew Evan Berman,≤100
119042069492466,Branding and Marketing for Hire,These ads ran without a disclaimer,≤100
112450780222863,Brian DiGrazio for Lee County School Board District 3,Brian Nicholas Digrazio,≤100
628658994243155,Chris Olsen for City Council,Chris Olsen for City Council 2020,≤100
187582501289833,Anthony Rendon,Rendon for Assembly 2020,≤100
929024360458108,Rob's Corner Poems and commentary.,These ads ran without a disclaimer,≤100
100745004762624,Scott Bonavita for Judge,Scott Bonavita Committee to Elect for Judge,≤100
