Page ID,Page Name,Disclaimer,Amount Spent (USD)﻿
115147112341,Citizens to Elect Dan Patlak,Citizens for Dan Patlak,1017
107977080537709,Alex Hubbard for Congress,Alex Hubbard for Congress,≤100
1711465445765878,Nancy Pelosi,NANCY PELOSI FOR CONGRESS,11240
1568648046682139,Brian Kolfage,Brian Kolfage Fans,752
43426724597,Paper Culture,Paper Culture LLC,≤100
108041243963457,latinamericanist,These ads ran without a disclaimer,≤100
1627121704251107,Her First $100K,These ads ran without a disclaimer,≤100
104684964442086,Constitutional Collection,Constitutional Collection,≤100
1737556389685016,Good Money,Good Money,274
245643442766,AFIRE Chicago,These ads ran without a disclaimer,≤100
131071596981970,EdVoice,EdVoice,≤100
100126761491537,Jac Ross,These ads ran without a disclaimer,≤100
1581656185428295,Liz Matory for Congress,Liz Matory for Congress,≤100
422790878058684,Timothy Baldermann,Timothy A Baldermann,≤100
1562290543991677,Alliance for a Healthy Kansas,These ads ran without a disclaimer,≤100
101628394654500,Internet & Cable Pros,These ads ran without a disclaimer,≤100
111576496924261,Natalia Cornelio for Criminal District Judge- 351st Court,Natalia Cornelio 351st District Court Candidate,≤100
1108059749395323,betr,These ads ran without a disclaimer,≤100
113953261998824,All American Clothing Co.,These ads ran without a disclaimer,≤100
351302299042472,Zer0 Memes,These ads ran without a disclaimer,≤100
118255521596677,Superior Business Solutions,"SUPERIOR BUSINESS FORMS, INC.",≤100
107437303970810,Painted Presidents,"WOW Printing, LLC dba Painted Presidents",≤100
283251328948319,Lil Keed,These ads ran without a disclaimer,≤100
1602157129810502,Renee Powell 4 President 2020,These ads ran without a disclaimer,≤100
11024050756,Bioneers,Bioneers,≤100
123659743079,Miriam Hellman Prophetic Ministries,These ads ran without a disclaimer,≤100
654735404950305,CurtCo Media,These ads ran without a disclaimer,≤100
1237345436312851,Blame Bobby Deans,These ads ran without a disclaimer,≤100
132406997198508,FlashPolitics,Le Mark A Russell,≤100
104397124392053,Bernie Sanders 2020 Calendar,Darren Nicholas Martin,≤100
788632858205691,Zero Waste Face,Zero Waste Face,4020
96953371815,UJA-Federation of New York,UJA-Federation of New York,≤100
458785541547019,Manish Seth for Texas House District 27,Manish Seth Campaign,≤100
221834965136991,Steve Roberts for State Senate,Roberts for St. Louis,≤100
249533078419895,GovernmentCIO Media,These ads ran without a disclaimer,≤100
107891200675675,Bright Filter,These ads ran without a disclaimer,≤100
19463427992,Darrell Issa,DARRELL ISSA FOR CONGRESS,394
453927978719973,WeTheTrillions,These ads ran without a disclaimer,≤100
1318439511565011,Financial Study Network,These ads ran without a disclaimer,580
111702860231554,Matt Lieberman,Matt Lieberman for Senate,910
109616377239456,Elect Jason Dominguez,Dominguez for State Assembly 2020,≤100
475359972474269,Graphicacy,These ads ran without a disclaimer,≤100
350899171648148,ScriptSave WellRx,These ads ran without a disclaimer,≤100
136121223083299,Sea Turtle Conservancy,"SEA TURTLE CONSERVANCY, INC.",≤100
253829471475527,Dr. Jen Trachtenberg,These ads ran without a disclaimer,≤100
872842866161157,One Nation Design,One Nation Design,300
111470060340066,Troy Slaten for Judge,Troy Slaten for Judge,≤100
1979565535655842,Jimmy Cooper For Congress,JIMMY COOPER FOR CONGRESS,≤100
232894957245453,Nori,Nori LLC,≤100
594313484371634,Wun Wuv Apparel,These ads ran without a disclaimer,≤100
109743160557907,Freedom Media Network,These ads ran without a disclaimer,≤100
355852771752851,Mel for Progress,COMMITTEE TO ELECT MEL GAGARIN,≤100
10150124349775072,"Riddle & Brantley, LLP","RIDDLE & BRANTLEY, LLP",≤100
2250100341942550,Dad is taking charge,These ads ran without a disclaimer,≤100
106652674244188,Partido Político,These ads ran without a disclaimer,≤100
19420215926,CNSNews.com,MEDIA RESEARCH CENTER,207
349468919080643,Dr. Suleman Lalani for TX State House 26,Dr. Lalani for Texas,≤100
105798656188643,Mark Welch for State Representative 52nd District,Friends Of Mark Welch,≤100
1696537410609658,Graham Hill - Member of NRA Board of Directors,Graham Hill for NRA Board,≤100
106216497600011,Trojans of Tomorrow for Maroa-Forsyth School District,These ads ran without a disclaimer,≤100
494983940663155,Candice Keller,Conservatives for Candice Keller,≤100
1318134684947847,Aura Vasquez,Aura Vasquez for the People of L.A Council District 10 in 2020,≤100
348218345409,Waukegan Firefighters IAFF Local 473,These ads ran without a disclaimer,≤100
673439922695359,Sarah Adele for The Top Drawer,These ads ran without a disclaimer,≤100
168367339845613,The Humane League,The Humane League,268
445063912714249,Palestine Writes,Rima Najjar Merriman,≤100
105848157608682,Yes on Measure M,"Committee for Pleasanton Unified School District 2020 Bond Measure - Yes on M for Students, FPPC# 1423382",≤100
281835005264380,Eric Swalwell,SWALWELL FOR CONGRESS,249
1016759971750670,Runyowa Law,These ads ran without a disclaimer,≤100
105844410767627,The Mini Activist,The Mini Activist,≤100
104388121040698,Tom Shirt,These ads ran without a disclaimer,≤100
176386243508,North Dakota Democratic-NPL,North Dakota Democratic-NPL Party,≤100
630606260388991,Carbon Recall,Carbon Recall,≤100
102542207770711,Tad Brenner for Judge,James R Gough,592
2110554565703964,Eric Morrison for State Representative,Friends of Eric Morrison,≤100
1869877073240287,Víctor Marín Martínez,These ads ran without a disclaimer,≤100
2039662799488488,Golden Door Coffee,These ads ran without a disclaimer,≤100
87375121041,International Women's Health Coalition,"INTERNATIONAL WOMEN'S HEALTH COALITION, INC.",194
111791537020217,Re-Elect Thaddeus Jones for State Rep,Jones for State Representative,≤100
231056563609284,Fresno Metropolitan Flood Control District,Fresno Metropolitan Flood Control District,≤100
104845836238949,World Animal Protection US,World Animal Protection,≤100
102875587947942,Keep Trump In Office,Keep Trump In Office,≤100
450138481786484,The Sovereignty Network,These ads ran without a disclaimer,≤100
626657917504969,Nazeera LLC,Nazeera LLC,≤100
1722014968116461,Zachary Wefel for Minnesota House 60A,Phelan Boru Oneill,≤100
277284509503566,Toole for NC,TOOLE FOR NC,≤100
108779410607125,Impeachment Acquittal General Strike,Craig Christopher Logan,≤100
983997691692598,Política Ya,Entravision Comunications,≤100
141198258647,Amorphia Apparel,Jeremy P Kalgreen,≤100
266344180585578,Jim Jordan for Congress,JIM JORDAN FOR CONGRESS,433
141395226689,New York State Nurses Association,"NEW YORK STATE NURSES ASSOCIATION, THE",≤100
107790505964957,BizParentz Foundation,These ads ran without a disclaimer,≤100
51722069733,Icebreaker,Blue Moon Digital,≤100
431305933899331,First Amendment Free Press inc.,First Amendment Free Press inc,≤100
1651938015128584,Georgians for Lawsuit Reform,Georgians for Lawsuit Reform,≤100
329155814320463,Josh Travis,Joshua J Travis,230
209268466362415,The Middle-Respectful and Productive Politics Discussion,These ads ran without a disclaimer,≤100
10150100007820094,Wendy Davis,WENDY DAVIS FOR CONGRESS,556
1461944560735432,Hamptons Designs,These ads ran without a disclaimer,≤100
1945237355733646,Giving Brush,Giving Brush LLC,310
108935370485725,Angela Byrnes for Coroner,Angela M Byrnes,327
271964256289451,Mohamud Noor for House 60B,Noor for House,≤100
888123531223968,EdChoice Kentucky,EdChoice Kentucky,≤100
91383850446,Lisa Bevere,These ads ran without a disclaimer,≤100
2077528499191868,Oh Hey Heather,Heather Wirtz,≤100
211972722156574,DraftKings,DraftKings Inc.,≤100
161718535966,Chapman University,Chapman University,≤100
7369627665,Kansans for Life,Kansans for Life,≤100
107057304124208,2nd and Freedom,2nd and Freedom,≤100
100445624824114,The Left VS The Right,These ads ran without a disclaimer,≤100
102047517918,The Commonwealth Fund,"COMMONWEALTH FUND, THE",222
119875179042,Josh Stein,Josh Stein for Attorney General,≤100
248389845874178,1833 Group,1833 Group,≤100
192732630795577,"City of Aurora, IL, Government","City of Aurora, Illinois",1629
107144804077596,David Saucedo For Congress TX  CD17,David M Saucedo,≤100
127675453978638,Unlikely Heroes,These ads ran without a disclaimer,≤100
1384851255093737,Truly Catholics,These ads ran without a disclaimer,≤100
188383074570800,Aquapparel,These ads ran without a disclaimer,≤100
181813995726,Avalara,"AVALARA, INC.",1005
142914269087072,Cornell Lab of Ornithology,The Cornell Lab of Ornithology,331
1794865500788771,Bakersfield Chamber of Commerce Political Action Committee,Bakersfield Chamber of Commerce Political Action Committee,≤100
104878310869759,Georgetown-Ridge Farm Education Association,These ads ran without a disclaimer,≤100
1340560252687219,MISSIO Hair,MISSIO HAIR,≤100
268311603350722,The American Independent,The American Independent,≤100
264121717116656,Friends of Anthony Napolitano - 41st Ward Alderman,Friends of Anthony Napolitano,≤100
396667891104422,Chene For School Board,Stephen Chene,≤100
571016669670726,Mireille for class senator,These ads ran without a disclaimer,≤100
239197826316,Gorton Center,Amy Elizabeth Craig Wagliardo,≤100
117123596350097,Vote For Lucie,Ian Michael Stikeleather,≤100
102859684461462,Cheri Thomas for Justice,Cheri Thomas for Justice Campaign Committee,≤100
1052404804800138,CHBM Services,Catherine H Mcneil,209
1854233858162748,Lilbabylani,These ads ran without a disclaimer,≤100
105847110931534,Concerned Residents of Bannockburn,These ads ran without a disclaimer,≤100
107033296017764,Isps-Us,The International Society for the Psychological Treatments,≤100
159259194088714,Wabash Avenue Presbyterian Church,These ads ran without a disclaimer,≤100
18603356887,Children Incorporated,These ads ran without a disclaimer,≤100
2901343536757757,The Political Reaction,Steven Arthur Goethner,≤100
355591555247068,IllumiNative,IllumiNative,≤100
9324910069,NRSC,NRSC,13262
193908654127851,Bee's Wax,These ads ran without a disclaimer,≤100
6851405967,CREDO Mobile,"CREDO MOBILE, INC.",153
2301300770093138,Amanda Edwards For Texas,AMANDA EDWARDS FOR TEXAS,157
109208710567853,"El Regidor del Pueblo,  JUAN MARTE, 20-20",These ads ran without a disclaimer,≤100
2123425971065747,Sora Schools,Indra Putra Sofian,≤100
258186881053838,Dave Yarnes,These ads ran without a disclaimer,≤100
709491732434343,שורת הדין - Shurat HaDin,Israel Law Center,472
279599502172409,Patriot Mobile,Patriot Mobile,≤100
100272374850052,Erica Kasraie,These ads ran without a disclaimer,≤100
105665726128833,Phantom Billstickers,These ads ran without a disclaimer,≤100
336734426476390,A.Lever Studio,Antoine Jamal Lever,≤100
340754919866502,Tom Foolery Podcast,Tom Foolery Podcast,≤100
140079393143869,Joshhmadeit,These ads ran without a disclaimer,≤100
1827957754110764,Granny Rocks: The Music & Message of Beth Green,The Stream dba Granny Rocks: The Music & Message of Beth Green,≤100
358321582738,Broward Teachers Union,Broward School Watch,≤100
105344310973061,Hart for County Prosecutor,Committee to Elect Robert Hart,≤100
101464921262312,Alaina 2020,Alaina Shearer for Congress,≤100
146325688716898,School Choice Week,These ads ran without a disclaimer,≤100
102460623138290,Democratic Party of Rock County,Democratic Party of Rock County,≤100
399967603390922,OTP Radio,These ads ran without a disclaimer,≤100
414000956119586,Daniel O. Tiernan for Judge,Committee to Elect Daniel O. Tiernan,2835
241247646424302,Jahana Hayes,FRIENDS OF JAHANA HAYES,182
106303597451657,Angel Garcia for Judge,Friends of Angel Garcia,≤100
110312563826283,SadEarth,SADEARTHBRAND,≤100
100928564715182,Shout Your Truth,Jeffrey Warren Wright,≤100
376256666294500,MAC Fitness,Matthew A Cybulski,≤100
123778085411,American Society of Radiologic Technologists,These ads ran without a disclaimer,≤100
635047320197758,Au Natural Skinfood,These ads ran without a disclaimer,≤100
218529248766969,601 Waiver Lawyers,"Apsan Law Offices, LLC",≤100
575168982688479,Deedra Abboud,Deedra4BoS,≤100
108637660597586,victoria_zirkiev,These ads ran without a disclaimer,≤100
57615046615,Rainforest Trust,RAINFOREST TRUST INC,≤100
757796280970472,Supervisor John Leopold,Friends of John Leopold,≤100
502273079960942,SVO PAC,The Silicon Valley Organization PAC,≤100
434132686670828,Nick Ficarello for Will County Executive,Citizens for Ficarello,201
112513470189608,American Hot Gear,DEVYN MICHAEL LOWE-GREEN,144
1044134125671352,Prescription Justice,Prescription Justice Action Group,≤100
632207616822637,Michael O'Malley for Cook County Judge,Committee to Elect Michael O'Malley,790
1015703231972097,Blessing Health Careers,These ads ran without a disclaimer,≤100
111148777016553,Go & Do,Ajalon Joi Stapley,≤100
93199894980,Alachua Habitat for Humanity,ALACHUA HABITAT FOR HUMANITY INC,≤100
1632411740337320,cuddle + kind,These ads ran without a disclaimer,251
315324541967534,Blaine Luetkemeyer,BLAINE FOR CONGRESS,≤100
167889936602685,Bosak Honda-Highland,Theodore Joshua Muta,≤100
19575923823,Farm Sanctuary,"Farm Sanctuary, Inc.",≤100
425799820790374,Long Beach Immigrant Rights Coalition,Long Beach Immigrant Rights Coalition,≤100
340583536575643,Shawn Terry,Shawn for Texas,≤100
110822356977334,The Legal Boutique,Ryan P Duffy,≤100
30618466815,Pacific Legal Foundation,Phillip Lawson Bader,≤100
143231745727722,Libertarianism.org,"CATO INSTITUTE, INC.",≤100
103851564652,Waterkeeper Alliance,These ads ran without a disclaimer,≤100
681016675362080,u4See,Aviad Sar Shalom Giath,≤100
117270568319993,NYSUT - A Union of Professionals,New York State United Teachers,≤100
434224137354568,Dr. Rich McCormick for Congress,Friends of McCormick,≤100
240541500603,Lone Star Project,Lone Star Project Nonfederal,≤100
187598654633670,von Holzhausen,These ads ran without a disclaimer,≤100
146252006016759,The Woman Cards,Zacharia Wahls,1372
177517412390543,Darkk Horse Designs by Our Shield Maiden,These ads ran without a disclaimer,≤100
376149612997244,Primary Pals,Primary Pals,≤100
109259090549237,Yes on National Popular Vote,YES ON NATIONAL POPULAR VOTE,285
1815498928677260,Jerrell Bratcher,Jerrell Dominic Bratcher,≤100
91223411833,Medical Teams International,Medical Teams International,360
636440989754325,Netamaker,Careventuresindia Inc,≤100
19746387261,Humane Society International,Humane Society International,2422
107313507477081,Daily Homeowner Savings,Idemudia Edwards Okoruwa Uwagbale,≤100
2155040508095232,MonopolyWars,MonopolyWars.com,≤100
466215340133535,Utah Clean Air Partnership - UCAIR,UCAIR,≤100
316622191804157,UTK,Wendell Nelson,≤100
101865561191961,Ron Falconi for State Senate,Friends of Ron Falconi,≤100
965451360264888,Brian Burley for Congress,BRIAN BURLEY FOR CONGRESS,≤100
1815012292132259,Vinodh Subramanian,These ads ran without a disclaimer,≤100
307077029385744,Celebrating America,Dylan Chase Clifton,≤100
105985737434848,Gerard Moorer,Justina L Winfrey,≤100
43287633515,Alliance for Climate Education,Alliance for Climate Education,4433
219842411373576,Faith Mission,Lutheran Social Services of Central Ohio,≤100
1712647528997900,RALIANCE,RALIANCE,≤100
242960515598,Military Spouse,Victory Media DBA Military Spouse,≤100
2290034467878160,Axcentuate Accessories,These ads ran without a disclaimer,≤100
127225910653607,PragerU,PragerU,28258
153549641890,Discovery Inc,These ads ran without a disclaimer,≤100
203583423017526,National Immigration Law Center,National Immigration Law Center,≤100
112468116961105,Verdantry,These ads ran without a disclaimer,≤100
100469471462701,Feminists' Wardrobe,These ads ran without a disclaimer,≤100
350914689303,AARP Iowa,AARP,≤100
151196904914893,Victor Pinchuk Foundation,These ads ran without a disclaimer,≤100
112735922758892,Charlie Kirk,These ads ran without a disclaimer,≤100
791543660926838,"I'll go ahead and keep my guns, Thanks",2A4LIFE LLC,23945
1605073449727547,Gossip ERA,Gossip Era News,≤100
785936231584382,Paula Jean Swearengin,These ads ran without a disclaimer,≤100
109459080542079,2020 Trump Campaign Package,2020 Trump Package,≤100
408252582872693,Daniella Levine Cava,"Daniella Levine Cava, Non-Partisan, for Miami-Dade County Mayor",≤100
114907186726511,Sustainable Vibes,These ads ran without a disclaimer,≤100
854065861604298,Central Valley Energy Coalition,Central Valley Energy Coaltion,≤100
233247763926518,Ivory Parke,These ads ran without a disclaimer,≤100
106574667591550,State Relief Programs,Alexis Travieso,≤100
124798207600948,Rattle,These ads ran without a disclaimer,≤100
104204951102719,জাঙ্গিয়া পক্ষ,These ads ran without a disclaimer,≤100
383821768741044,Woodsmall for Congress,Woodsmall for Congress,≤100
379630042141834,Ricky Junquera,Vote for Ricky,≤100
214299312740318,The Mindful T-Shirt Co.,These ads ran without a disclaimer,≤100
108380597318949,Fashions Clothing and Apparel at Fablixx Store,Gina Promlap,≤100
457701071664430,Red Wave IN 2020,Blind Vote Media,≤100
119954938436763,Virguez Law,Virguez Law,≤100
11918108948,African Wildlife Foundation,AFRICAN WILDLIFE FOUNDATION,587
461412130644790,Momentitiousness,Jason Peter Leclerc,≤100
104833087681530,Yo voto Verde con Polencho Escalera,These ads ran without a disclaimer,≤100
662962894077729,The Well News,The Well News,≤100
315158159330308,Romeo the Pit Bull,These ads ran without a disclaimer,≤100
729780910750609,Bernie Shirts,Andrew T. Smith,≤100
116546288359245,Heritage Action for America,HERITAGE ACTION FOR AMERICA,953
7035457015,Brave New Films,BRAVE NEW FOUNDATION 501(C)(3),≤100
243498882520314,FoodFinder,"FOODFINDER, INC.",≤100
10334839178,Spectrum Health Care - Missouri,Spectrum Health Care,≤100
364715208424,Guest House of Milwaukee,Guest House of Milwaukee,≤100
105373891053136,You Can't Spell - Without the GOP,David Edward Loftis,≤100
106038137419473,smnpce INC,Catherine H Mcneil,204
100568064752583,Hannah for Council,Campaign Fund of Hannah LeGris,≤100
152766071443309,The City University of New York,The City University of New York,≤100
34521916336,Brent Bozell,MEDIA RESEARCH CENTER,146
31578213228,Reasonable Faith,These ads ran without a disclaimer,≤100
18079407397,CPAC 2020,Conservative Political Action Conference,303
1414253651946249,Harvest Baptist Church of Ottawa,These ads ran without a disclaimer,≤100
29883711738,Independent Women's Voice,Independent Women's Voice,141
269819176888460,Digital Democrat,Grayson Alexander Pangilinan,≤100
577296739109442,Ends & Stems,These ads ran without a disclaimer,≤100
419794381380683,Savory Institute,Savory Institute,≤100
134956813238021,My Stupid Page,Ronald John Gembic,≤100
1070977923068960,Promise Study,These ads ran without a disclaimer,≤100
296058914296458,Sarcasm Speaks,These ads ran without a disclaimer,≤100
1718673558417728,Hear Me,These ads ran without a disclaimer,≤100
68806961718,Girls Education International,Rachel E Farrelly,≤100
104474270946247,Zero-Point Democracy,These ads ran without a disclaimer,≤100
340373399593,Topps,These ads ran without a disclaimer,284
102161937979492,Founders & Framers,These ads ran without a disclaimer,≤100
77903485992,Concerned Women For America LAC,CONCERNED WOMAN FOR AMERICA LEGISLATIVE ACTION COMMITTEE,≤100
126053105675,Save the Redwoods League,Save The Redwoods League,≤100
75353945070,Boxed Water Is Better,Boxed Water Is Better,221
138434734461,CIIS Public Programs,These ads ran without a disclaimer,≤100
102527201344722,Naperville For Legal Cannabis,NAPERVILLE FOR LEGAL CANNABIS PAC,3679
109118207333357,Vote for Angie Ponce,These ads ran without a disclaimer,≤100
171298642933785,Partners for Progressive Israel,PARTNERS FOR PROGRESSIVE ISRAEL,≤100
93151506051,ERA Real Estate,These ads ran without a disclaimer,≤100
1528741944038372,Boyd For Mayor,Candidate for mayor of Wilton Manors,≤100
105892644256272,Citizens for Great Cupertino District Schools - YES on O,"Citizens for Great Cupertino District Schools – YES on O, FPPC# 1419210",≤100
103493757892773,ISupport45,These ads ran without a disclaimer,≤100
17801244148,Jill Schupp,SCHUPP FOR CONGRESS,111
109630610370276,5G Awareness Now,Noah Davidson,≤100
454178338351957,Lockheed Martin Careers,These ads ran without a disclaimer,≤100
278355662356517,BallotReady,"BallotReady, Inc",≤100
102484198032867,Stellable,These ads ran without a disclaimer,≤100
100244794753436,The Liegnitz Plot,Howard Mark Mauskopf,≤100
103252811047521,No on Measure A,"Planning Today for San Diego's Future, a Coalition of Housing Advocates, Save Our Rural Economy, Building Industry Association of San Diego County, Farmers, Taxpayers, Firefighters & Law Enforcement. Committee major funding from California Association of Realtors Issues Mobilization Political Action Committee and Building Industry Association of San Diego County.",≤100
105044144410490,Hot Gear Trends,SI Technews,744
140155342671005,Sempervirens Fund,SEMPERVIRENS FUND,≤100
29056789480,Project Syndicate,Project Syndicate,≤100
88444849127,The Hunger Project,"GLOBAL HUNGER PROJECT INCORPORATED, THE",≤100
102730547869331,Tantrump,Alexander Gerard Yunker,243
1949064322040283,Principles,These ads ran without a disclaimer,≤100
165992563983932,DCP Entertainment,These ads ran without a disclaimer,≤100
105923944236170,Help Save The Waves,These ads ran without a disclaimer,≤100
103173037857186,Kenny Martinez Director municipal de Buena Vista PNVC,These ads ran without a disclaimer,≤100
6726182861,Mike Pence,"DONALD J. TRUMP FOR PRESIDENT, INC.",1909
245371732167183,InsideClimate News,InsideClimate News,377
1112861825547252,Memeship,These ads ran without a disclaimer,≤100
473558703216022,Gabfest,Paul W Queen,≤100
153278754738777,Climate Reality,The Climate Reality Project,965
103271797847867,Kenneth Jenks for U S Congress,COMMITTEE TO ELECT KENNETH JENKS TO CONGRESS,≤100
111182343682003,Certified CCW,CertifiedCCW.com,10175
137662367278,League of Women Voters of the U.S.,LEAGUE OF WOMEN VOTERS OF THE UNITED STATES,537
127814007074,LIUNA,LABORERS INTERNATIONAL UNION OF NORTH AMERICA,≤100
1629521843983619,Re-elect Jake Lee as Kankakee County Auditor,Jacob M Lee,114
212870829378137,Paving My PPPath,Marcos M Sanchez,≤100
112767930190251,Kay Granger Campaign,KAY GRANGER CAMPAIGN FUND,≤100
115567079054562,Gaither Campaign for Illinois,These ads ran without a disclaimer,≤100
103718944486848,StatesAutomobile,These ads ran without a disclaimer,≤100
417003782372467,Foundation Blue Media,Foundation Blue LLC,≤100
108552410720809,Taageerayaasha Madaxweyne Abdikarim Guled,These ads ran without a disclaimer,≤100
106029154202945,Trump Champion,Trump Champiom,≤100
103193811265114,Conservitee,Curtis M Hundley,≤100
89757739264,Farm Credit,Farm Credit Council,298
106122044095967,Steve Leary for District 5,Steve Leary for Orange County Commissioner,≤100
104960584229139,Button Clickers Poker Club,These ads ran without a disclaimer,≤100
98894532233,Partnership for Safe Medicines,PARTNERSHIP FOR SAFE MEDICINES INC,845
108683323959169,Watercooler Politics,Organize for Justice,≤100
1643757559196160,Rail Customer Coalition,"AMERICAN CHEMISTRY COUNCIL, INC.",≤100
2126347230725979,Not Putting on a Shirt,Not Putting on a Shirt,≤100
140393436031260,Carolina Aramburo Coaching,These ads ran without a disclaimer,≤100
311896169406139,Trump 2020 Wear,Trump 2020 Wear,242
102656387965504,Deplorable Dave’s Designs,David Harris Simbol,≤100
105398330985977,The Right Taste,These ads ran without a disclaimer,≤100
178835922297833,American Clinical Laboratory Association,American Clinical Laboratory Association,≤100
1928517804031749,Just Another Angry Black Jewish Soccer Mom,These ads ran without a disclaimer,≤100
100238576688468,James Maness,James Maness,≤100
1745418332339003,Aspire Gear,Aspire Gear,≤100
631570717331198,Working to Fight AMR,BIOTECHNOLOGY INNOVATION ORGANIZATION,≤100
143040362799890,HoboRadio,These ads ran without a disclaimer,≤100
25998443394,MedPage Today,"EVERYDAY HEALTH, INC.",3502
354419094739310,Eres la razón de mi vida,Jose R Martinez,≤100
105933777496784,Marquita Bradshaw,MARQUITA BRADSHAW FOR U S SENATE,≤100
100249774660259,ScriptSquare,These ads ran without a disclaimer,≤100
112085213652026,Believe In Our Schools - YES on V,"Believe In Our Schools Soquel School District Yes on V, FPPC# 1412348",≤100
468950896976352,Polly Arctic,Polly Arctic,≤100
67822755168,Taina Asili,Gaetano Jonathan Vaccaro,≤100
1243736895658275,GodlyCulture.Com,These ads ran without a disclaimer,≤100
95181800661,Levi's,These ads ran without a disclaimer,231
243947752771440,TJ Cox for Congress,TJ COX FOR CONGRESS,≤100
94595460445,Personal PAC,PERSONAL PAC INC,1748
613939699097647,Vicente Peña promotor,These ads ran without a disclaimer,≤100
109958900610551,AmericanPatrioticHome,AmericanPatrioticHome,≤100
9800035481,IndieWire,These ads ran without a disclaimer,≤100
306591716448427,Cindy Axne,CINDY AXNE FOR CONGRESS,≤100
100847831440144,Trump 2020 Tees,Robert William Zagby,≤100
751823818285038,Badgers United,Johnson Scott Yoder,≤100
101908424664094,Best Home Savers 2020,J D Grace Gorospe,≤100
153408513065,Democratic Party of Jefferson County (Wisconsin),Democratic Party of Jefferson County (Wisconsin),≤100
210319855711346,Surrey County Council Liberal Democrats,These ads ran without a disclaimer,≤100
363562444472853,Craig Hall,These ads ran without a disclaimer,≤100
404929222888251,Conservation Colorado,Conservation Colorado,≤100
101255921350728,Yukong Zhao for Congress,YUKONG ZHAO FOR CONGRESS,≤100
