Page ID,Page Name,Disclaimer,Amount Spent (USD)﻿
5985827589,Fnatic,These ads ran without a disclaimer,≤100
342006339184405,National Children's Alliance,NATIONAL CHILDRENS ALLIANCE INC,≤100
1552070021731538,Be Conscious. Be Kind.,Be Conscious. Be Kind.™️,122
2104647596297490,SBAC Empower,These ads ran without a disclaimer,≤100
193523604934731,Vote Donna US Congress TX31,VOTE DONNA US CONGRESS,≤100
194115677277113,A21,The A21 Campaign,179
156496968533805,Explore Beyond,NCTA - The Internet & Television Association,≤100
475939895857282,Sold Art,These ads ran without a disclaimer,≤100
108834753957086,Conservatively Awesome,conservativelyawesome.com,≤100
107725370798378,"Texas Federation for Children PAC, Inc.","Texas Federation for Children PAC, Inc.",≤100
29423827874,Proclaiming Justice to the Nations,Laurie Ann Cardoza Moore,≤100
108045000667444,US Healthcare Options,Rachid Eloudiyi,≤100
1769264743325558,Fierce by mitú,"Mitu, Inc.",≤100
109975743834970,ZIP Range,These ads ran without a disclaimer,≤100
546497545399440,ASEC - African Sisters Education Collaborative,African Sisters Education Collaborative,≤100
102789161114613,Dollar Informer,Brooklyn Kathleen Foster,2693
151525932186806,When Democrats Turn Out,WHEN DEMOCRATS TURN OUT PAC,3727
1791097094486498,Musings,Musings Magazine,≤100
1824158931134039,Increase Respect,These ads ran without a disclaimer,≤100
181924628560212,SumOfUs,SumOfUs,≤100
261343034731,Concern Worldwide US,"CONCERN WORLDWIDE (U.S.), INC.",369
1726850337591747,The Mexican Next Door,These ads ran without a disclaimer,≤100
255587152180,Shavitz Law Group,Paul James Herrmann,≤100
440677226778016,Ira Bershad for DCDP Chair,Ira Bershad for DCDP Chair,≤100
1374033225956525,SCLC National Magazine,These ads ran without a disclaimer,≤100
2591540654206986,Dio's Emporium,These ads ran without a disclaimer,≤100
380536432535011,Representative Barbara Hernandez,State Representative Barbara Hernandez,≤100
519590768083165,Abby Finkenauer for Congress,FINKENAUER FOR CONGRESS,273
128809784526834,Gihon Ethiopia,These ads ran without a disclaimer,≤100
837860879671595,Bari Applebaum,These ads ran without a disclaimer,≤100
44164653347,Safer States,These ads ran without a disclaimer,≤100
1317408675052559,Cole Peck for State Representative,Peck for State Representative,≤100
156392276602,Strong Towns,These ads ran without a disclaimer,≤100
456051981200997,Focus for Health Foundation,Focus Autism Inc.,≤100
129260101060,Committee on House Administration - Democrats,Committee on House Administration - Democrats,≤100
1580995778781994,Hunterdon GOP,Hunterdon County Republican Committee,≤100
183218649266714,Ever for Commissioner,Everardo Villarreal,≤100
1306330389478264,Enbridge Line 3,Enbridge Inc.,154
874662062886596,Sea Trees,Sustainable Surf,≤100
104567291054733,Committee to Elect Steve Hale,Steve Oakley Hale,≤100
1408111109425058,Village of Niles - Municipality,These ads ran without a disclaimer,≤100
1406474192722052,David Guy Stevens for Judge,CItizens to Elect David Stevens,515
106267277555538,2020ElectionSwag,Daniel Albert Hallback,≤100
27408730232,UConn Alumni,These ads ran without a disclaimer,≤100
1786285504993680,Precision Metal Art USA,Precision Metal Art,≤100
197679767726077,The Really Online Lefty League,THE REALLY ONLINE LEFTY LEAGUE,≤100
101129949957669,Joey Schusler Photography,These ads ran without a disclaimer,≤100
112466750140866,Texas True Blue Coffee,These ads ran without a disclaimer,≤100
173477086790228,Don Mayhew,Donald B Mayhew FSR,≤100
102617961152741,Barbara Bollier,Bollier for Kansas,1785
188022031804028,What's on the star?,These ads ran without a disclaimer,≤100
115257853240629,"Life, Love, and the Grind",These ads ran without a disclaimer,≤100
284472231667570,Lincoln and Obama,Benjamin E Griessman,≤100
281937548504046,Mike Schofield,Mike Schofield Campaign,≤100
108524420538011,Hoosiers for Renewables,Hoosiers for Renewables LLC,≤100
271972297060025,Primal King,These ads ran without a disclaimer,≤100
104673551044684,Republicans 2020,Rep Republican,1109
30139072158,CARE,These ads ran without a disclaimer,≤100
107007137401164,Patrick Henry for HD 25,Patrick Henry for HD 25,≤100
355218158543206,Dan Wood,These ads ran without a disclaimer,≤100
466352813568654,Tim Westley for U.S. Congress,COMMITTEE TO ELECT TIMMY WESTLEY,≤100
154714174937798,Feraz Comedy,These ads ran without a disclaimer,≤100
307914975970824,Slavica Bogdanov Best Selling Author and Business Strategist,These ads ran without a disclaimer,≤100
102041194535114,Dump Trump Drip,Dump Trump Drip,≤100
106136187544368,Diabetes Support,These ads ran without a disclaimer,≤100
112569193560195,Shayan Saeed,These ads ran without a disclaimer,≤100
1221555014581573,Christopher Noland Realtor Windermere,Christopher Robert Noland,≤100
354586505391697,Derrick Evans - The Activist,Derrick Evans,≤100
105101487638636,Korea 2020: A workplace in transition,Donald George Southerton,≤100
326226677932587,Timothy Kercheville,These ads ran without a disclaimer,≤100
349203558988030,"Live WE, Not ME",Brian Russell Dixon,≤100
159408614216735,International Cartilage Regeneration & Joint Preservation Society,These ads ran without a disclaimer,≤100
54885616308,SodaStream USA,These ads ran without a disclaimer,109
380063459385915,Quad Cities Clean Energy Alliance,These ads ran without a disclaimer,107
104616490980324,John Westercamp for Attorney General,Friends of John Westercamp,≤100
945443118979935,Safe Surgery Coalition,Safe Surgery Coalition,≤100
103102827802607,Mike Chen 陳懋華,Michael Chen for Democratic County Central Committee,≤100
330617944306531,Jerica Richardson,Jerica Marie Richardson,≤100
87981774690,Tablet Magazine,These ads ran without a disclaimer,≤100
413624532105681,Collin County Republican Party,Collin County Republican Party,≤100
233833890695,San Francisco AIDS Foundation,San Francisco AIDS Foundation,≤100
168220163668105,Newfield Democratic Party,These ads ran without a disclaimer,≤100
151578225365662,Bushra Amiwala,Bushra  Amiwala,≤100
101987144592086,Stollings for West Virginia,Stollings for West Virginia,≤100
123923381240,The Public Theater,These ads ran without a disclaimer,≤100
310925405807,Citizens Climate Lobby,Citizens' Climate Lobby,≤100
354070135073596,David B. Bohl,David Bryan Bohl,≤100
1374552925958504,Fierce Little Bird Productions,These ads ran without a disclaimer,≤100
419750238120336,Paul Marinaro,These ads ran without a disclaimer,≤100
471339726552022,Pastor Lobe Foundation,These ads ran without a disclaimer,≤100
522923054735947,Troy Balderson for Congress,BALDERSON FOR CONGRESS,≤100
107199049318619,Friends of Derek Kilmer,PEOPLE FOR DEREK KILMER,142
106349080940083,Jim Quinn For GA State Senate,Campaign to Elect Jim Quinn to Senate,≤100
133764907211570,Concerned Citizen,Steven Niems,≤100
1632866270065962,Jewish Democratic Council of America,Jewish Democratic Council of America,360
101895607980616,Newsday Headlines,PETER-GAY NIKORA LINDO,≤100
143021112391265,Jacobin magazine,Jacobin Foundation,≤100
212090022784120,Moments Engraved,Jeet None Banerjee,≤100
100809994773420,Trump 2020 Swag,Trump Swag USA,357
8047221596,Save the Children US,"SAVE THE CHILDREN FEDERATION, INC.",6821
105698674239617,Embed News,Embed News,≤100
140357056032320,NEA Today,National Education Association,286
440551812676698,Open The Books,American Transparency,312
1929168480440485,First Responder Voice,These ads ran without a disclaimer,≤100
106462417514726,"Naomi Showers Doyle for Justice of the Peace, Pct.1, Pl. 1",Naomi Eugenia Doyle,≤100
111488713681927,America First,Trung Vu,≤100
2291522820927744,J Hanley For State's Attorney,Friends of J. Hanley,1143
1444558675791434,I Love My Job,BadBananas,≤100
565092390311856,Magnetek Rotation,These ads ran without a disclaimer,≤100
379004022287993,Mansfield Democrats,Mansfield Democratic Town Committee,≤100
247432468622391,Washington State Democratic Party,WASHINGTON STATE DEMOCRATIC CENTRAL COMMITTEE,≤100
2097306623861785,Reach Higher Riverside,These ads ran without a disclaimer,≤100
2362252427391226,Cora,These ads ran without a disclaimer,≤100
338265753486530,Gone Viral,These ads ran without a disclaimer,≤100
149576021182,Indiana Right to Life,Indiana Right to Life,≤100
73970658023,International Rescue Committee,International Rescue Committee,93910
1057172744485099,Epic Confrontation,These ads ran without a disclaimer,≤100
541807025833154,Malala Fund,Malala Fund,174
321275377976909,The People's Lobby,VOTE LIBERATION,2018
206590736197463,Moving Forward Network,Bianca Iris Verduzco,≤100
169710960125365,Curzio Research,These ads ran without a disclaimer,≤100
702128736476375,The Need to GROW,These ads ran without a disclaimer,≤100
288110884600563,Lean In,"Sheryl Sandberg & Dave Goldberg Family Foundation d/b/a LeanIn.Org, LLC",1757
107937387235873,Friends of Patti Vasquez,Friends of Patti Vasquez,201
124214867638902,HumanN,These ads ran without a disclaimer,118
304252657027476,George Buck,"COMMITTEE TO ELECT GEORGE BUCK, PHD",≤100
2277354378985825,Efrem Neely for District Court Judge,Efrem Baines Neely,≤100
633620713480984,Michael Richardson-Borne,Paul Michael Richardson,≤100
905023632893973,Reproaction,Reproaction,106
26668999076,The Cato Institute,"CATO INSTITUTE, INC.",≤100
86574174383,House Speaker Nancy Pelosi,Office of the Speaker,380
68693168571,Jewish Federations of North America,Jewish Federations of North America,≤100
170550712997115,Illinois Farm Families,Katelyn Elizabeth Kaminski,2100
111594460294372,Oldie But Goldie,Daliannis  Allen,≤100
122975499095847,Gillig For Texas,Taylor Gillig Campaign,≤100
354608557896785,Pardon Howard Morgan Campaign,These ads ran without a disclaimer,≤100
251471951958913,Habitat Botanicals,These ads ran without a disclaimer,≤100
104183524335594,Peter Gallotta,Peter Gallotta for San Francisco Democratic County Central Committee 2020,≤100
394985931121948,Maura McMahon Zeller for Cook County Judge,Friends of Maura McMahon Zeller,5351
160110170784183,Irving Austin Business District,These ads ran without a disclaimer,≤100
376634246331286,Diane Pezanoski for Judge,Friends of Diane Marie Pezanoski,≤100
202995713578336,Operation WEBS: Women Empowered Build Strong,These ads ran without a disclaimer,≤100
100184714677097,Election Year Knockout,Exceptionull Games,≤100
101907604721693,Charles Ewell for Jackson County State's Attorney,Committee to Elect Charles Ewell,649
1052021421648045,Repatriate Our Patriots,Brandee Ann Dudzic,≤100
785936231584382,Paula Jean Swearengin,William Cain,≤100
395797250498380,Sons of Liberty Tees,Sons of Liberty Tees,≤100
552793908120534,A Trayvon Martin Call To Action Committee,These ads ran without a disclaimer,≤100
111193703661233,"Mallworld, Incorporated",These ads ran without a disclaimer,≤100
489738548428687,Chris Kasperski for IL State Senate District 31,Citizens to Elect Chris Kasperski,563
883241875118535,RAB For Congress,RAB FOR CONGRESS COMMITTEE,≤100
100454114890902,Wise Choice 2020,Wise Choice 2020,≤100
1743684392516860,Asia Maritime Transparency Initiative,"CENTER FOR STRATEGIC AND INTERNATIONAL STUDIES, INC.",≤100
143509339045414,Americans for Peace and Tolerance,"AMERICANS FOR PEACE AND TOLERANCE, INC.",≤100
443908256041631,Free the States,Free the States Action Fund,≤100
152382555521076,Polina Zee,These ads ran without a disclaimer,≤100
258357444672095,American Vitality Network,These ads ran without a disclaimer,≤100
988524987884863,Maria Espinoza for Congress,MARIA FOR CONGRESS 2020,≤100
255002268242724,"Caryn Ann Harlos, Libertarian Party LNC Secretary",Caryn Ann Harlos,≤100
33860907121,FunTimes Magazine,"FUNTIMES MAGAZINE, LLC",≤100
101025911346235,The New P-Bus: A Campaign for Change,These ads ran without a disclaimer,≤100
104320074406295,David Cook for State Representative,David Cook Campaign,≤100
1987154604879721,Hydrate Water Bottles,These ads ran without a disclaimer,≤100
107948174027918,Jeff Haines for Hunt County Constable Precinct 1,Jeffery Wayne Haines,≤100
110084740444015,The Artist Out,The Artist Out,≤100
61661304927,"City Government of Chandler, Arizona",City of Chandler,≤100
113575490062092,Ramon Iglesias for Hendry County Commission,Ramon Iglesias for Hendry County Commission,≤100
100323901388707,SuperHero,These ads ran without a disclaimer,≤100
104679177804089,45 Changes Lives,PKA Karate Academy Inc,≤100
802105766808582,Ralph Rodighiero for WV Senate,Ralph Rodighiero 2020,≤100
420424547981908,In Search of Liberty,Scott Dennis Welch,383
234338567090693,Come To Life,These ads ran without a disclaimer,≤100
665345483483486,NRA - National Rifle Association of America,NATIONAL RIFLE ASSN OF AMERICA,14907
104839574335532,Stonebrook Digital Wealth,These ads ran without a disclaimer,≤100
148553178567450,Geoffrey Stein,Geoffrey E Stein,≤100
1698620600355303,Alaskan Bud Man,These ads ran without a disclaimer,≤100
19219803864,Tax Foundation,TAX FOUNDATION,≤100
226138564067443,Sourcing Journal,These ads ran without a disclaimer,≤100
104763577712814,Jeffrey Blydenburgh for Winter Park,Jeffrey Blydenburgh for Winter Park City Commission,≤100
1606690029630683,Bahrain EDB,These ads ran without a disclaimer,≤100
109136650636111,Harold Hayes for State Representative,Friends of Harold M. Hayes,≤100
274597959396166,Docs 4 Patient Care Foundation,Docs 4 Patient Care Foundation,≤100
345649856136263,Matt Mahan,Neighbors for Matt Mahan for San Jose City Council District 10 in 2020,≤100
156742534349797,Israel Action Network,These ads ran without a disclaimer,≤100
1340492616025292,FinTank,Alan L Savage  Jr,≤100
141815795868516,Graffic Traffic,These ads ran without a disclaimer,≤100
577471812628425,Honest Rags,Honest Rags,≤100
674745832614465,Illinois State AFL-CIO,ILLINOIS STATE AFL CIO,2162
472811836234923,Fred Akshar,Fred Akshar For Our Future,≤100
596556607135301,The Earthling Co.,Educated Earthling,≤100
436865753096340,MRC Latino,MEDIA RESEARCH CENTER,≤100
348948148522246,MHB - Men Having Babies,"MEN HAVING BABIES, INC.",660
539684449477160,Bulk Backpacks,"A.M.D.A. DISTRIBUTORS, INC.",≤100
2072638396208222,Adam's Nest,These ads ran without a disclaimer,≤100
134283193310894,Republican Party of San Joaquin County,Republican Party of San Joaquin County,≤100
172783160290727,New Civil Liberties Alliance,NEW CIVIL LIBERTIES ALLIANCE,≤100
145913185948648,"TREE GOAT MEDIA, LLC","Tree Goat Media, LLC",311
1561601487210055,Marla Sousa Livengood for Congress,Marla Livengood for Congress,≤100
83290028957,Care Net,CARE NET,1093
21999960184,Operation Blessing,Operation Blessing,≤100
252745415616347,Republicans for Bernie,John Derrick Bowen,≤100
309962672389562,AmeriCorps,Corporation for National and Community Service,≤100
182079698493370,Portside,Portside,≤100
103740157799821,Trump Cereals,Trump Cereals,≤100
106136417435051,Iwantmyoceanback,Iwantmyoceanback,≤100
100119952246,Johnnie Walker,DIAGEO NORTH AMERICA INC.,2086
296720971169238,Memetrosity,Rayshawn Montei Lawrence,≤100
142283849237882,The Versed,These ads ran without a disclaimer,≤100
129921337078906,YallPolitics,"Jackson New Media, Inc.",≤100
222502777841808,The Art Lab,These ads ran without a disclaimer,≤100
778622935822987,2 for Seder,Marnie Fienberg,≤100
110885350426305,Tonight's News Headlines,Jared Douglas Jones,342
718597098303273,Rrdragon,These ads ran without a disclaimer,≤100
104933662932387,CreativeFuture,CreativeFuture,772
385473284886474,Hillsdale College,HILLSDALE COLLEGE,4271
1637823176332591,Ecocred,Branislav Seslija,113
104537674410462,Bring Melissa Bodden home.,These ads ran without a disclaimer,≤100
110019037232941,Our Earth Straws,Ahmed Abdel Rahim Abdel Gadir,≤100
100905191254122,Resimplex.com,These ads ran without a disclaimer,≤100
67553971312,The Century Foundation,"CENTURY FOUNDATION INC, THE",≤100
21559454473,FAIR,FEDERATION FOR AMERICAN IMMIGRATION REFORM,5828
112721400205015,Casey Gray for Congress,CASEY GRAY FOR CONGRESS,≤100
102023314605670,Unholy Bible Study,Unholy Bible Study,≤100
116840736388574,Howell Lee for School Board,Friends of Howell Lee,≤100
169603906434976,Unfriend Fossil Fuels,Unfriend Fossil Fuels,≤100
717115395103069,PrintedKicks,Printed Kicks,17425
27544763621,Prison Fellowship,Prison Fellowship,5169
1530883997194411,United States Constitution,Flag and Cross,180
116301515238863,Dr. Bob Onder,Onder for Missouri,175
469023076535518,Oliver the Ornament,Todd M Zimmermann,≤100
104640291008398,Cut Illinois Taxes Now,Cut Illinois Taxes Now,15621
350523542184,Trust Women,Trust Women,≤100
242679302418244,Denison Forum,Denison Ministries,≤100
104865324298982,The Advantages of Having A Car,Grenda Joseph,997
156968474833352,Stop Republicans,Stop Republicans,85280
1529468987331408,BulbHead,These ads ran without a disclaimer,≤100
106276334186706,"EnergyGirl, LLC - Reiki & Energy Healing",These ads ran without a disclaimer,≤100
482100658584410,We Stand For Energy,We Stand For Energy,≤100
110629627166104,unitedcreationz.uc,These ads ran without a disclaimer,≤100
109083680600436,Referendum 2020,These ads ran without a disclaimer,≤100
219247332354785,Phil Arballo for Congress,ARBALLO FOR CONGRESS,949
109012653901268,Citizens for Tiesha Smith,Citizens For Tiesha Smith,1276
106254587431136,BS Straws,Blue Steel,≤100
112013786841862,Fuad Perfume,These ads ran without a disclaimer,≤100
356989588324382,The Derringer,These ads ran without a disclaimer,≤100
112469550225125,Barbara Strang for County Commissioner,Barbara Camille Strang,≤100
134312830086,Jimmy Gomez,Jimmy Gomez for Congress,≤100
1708467695859543,Veteran Transition Mission,Sonia Ivelisse Barriera Ayala,147
2109637279297531,The Bad Seed,Adam Kidron,133
101982698069083,lavieillefashionista,These ads ran without a disclaimer,≤100
2035318650060187,Crypton Labs Inc.,Crypton Labs Inc.,≤100
149877652716,Visit Detroit,METROPOLITAN DETROIT CONVENTION & VISITORS BUREAU,≤100
591038604304661,Cohen Milstein,These ads ran without a disclaimer,≤100
1451520385099902,Equal Voice Action,Equal Voice Action,461
429812024048177,Doug Jones for Senate,DOUG JONES FOR SENATE COMMITTEE,1759
100444871325357,Young Ethel’s,These ads ran without a disclaimer,≤100
24470472733,The Trevor Project,These ads ran without a disclaimer,162
108649867230011,Margaret Chen Kercher for Judge,Margaret Chen Kercher Campaign,≤100
138290759549138,"Hope Clinic for Women in Granite City, Illinois",HOPE CLINIC FOR WOMEN LTD,178
1519963628224634,Scriptures in Use,Scriptures In Use (SIU),≤100
118737467661,New York State Department of Labor,New York State Department of Labor,≤100
109986503864843,Mark Diebolt,Mark Thomas Diebolt,≤100
185561295623272,Move To Help Foundation,These ads ran without a disclaimer,≤100
110796947163993,TorRed Limited,Steven Otis Shaw,≤100
1646591635619445,Tasha Boerner Horvath for Assembly,Tasha Boerner Horvath for Assembly 2020 #1414240,≤100
108814673920525,Make America Grey Again,These ads ran without a disclaimer,≤100
1598029437136194,"Damascus Road Project, Incorporated",These ads ran without a disclaimer,≤100
101506817989221,Stealth Rebel,stealthrebel.com,≤100
308687325931408,"Bob Grogan, CPA",Robert T Grogan,≤100
504603796269988,"City of Quincy, Illinois, Government",These ads ran without a disclaimer,≤100
102866451139959,Jimmy Van Bramer for Queens Borough President,Van Bramer 2020,≤100
105140794388124,Apolitical Threads,These ads ran without a disclaimer,≤100
183623155655860,Driver Matters,These ads ran without a disclaimer,≤100
103213131188768,John Hourihane for Cook County Circuit Court Judge,Hourihane 2020,388
123778085411,American Society of Radiologic Technologists,ASRT,≤100
105838790923025,Winbyfaith.com,These ads ran without a disclaimer,≤100
31116589096,Andre Carson,ANDRE CARSON FOR CONGRESS,≤100
819607471729183,Dr. Al Gross for US Senate,DR. AL GROSS FOR U.S. SENATE,181
102745701316283,Tek Yol Kemalizm,These ads ran without a disclaimer,≤100
100235820068512,Iowa Soybean Association,Iowa Soybean Association,≤100
284946111858895,Debbie Mucarsel-Powell,DEBBIE FOR CONGRESS,153
102095904731121,America First,These ads ran without a disclaimer,≤100
98912141410,American Forests,AMERICAN FORESTS,165
144281776241443,Climate Scorecard,Climate Scorecard,≤100
107545633933686,Delia Haak,Delia Haak for State Representative,≤100
157522514269835,Stand for Children - Indiana,STAND FOR CHILDREN INC,≤100
874662062886596,Sea Trees,These ads ran without a disclaimer,≤100
29008276590,The Salvation Army Greater New York Division,The Salvation Army,≤100
324850063717,Win Without War,Win Without War Education Fund,≤100
1600300510259910,For Our Future Pennsylvania,FOR OUR FUTURE,≤100
2079184822304023,Nabilah for Congress,NABILAH FOR GEORGIA,≤100
1232212606817196,Proven,These ads ran without a disclaimer,≤100
110334787050051,Stan Gunter,Stan Gunter for Georgia,≤100
197660640725,The Ohio Society of CPAs,Abigail Irene Draper,≤100
108519723832934,RAFT,These ads ran without a disclaimer,≤100
847452125347616,UChicago for Bernie Sanders,Christopher Wilson,≤100
410950505604622,Omega Center for Sustainable Living (OCSL),"OMEGA INSTITUTE FOR HOLISTIC STUDIES, INC.",≤100
103062951257700,Etsy Selling School,These ads ran without a disclaimer,≤100
1127581437405717,Bumbler - The Boba Tea Tumbler,These ads ran without a disclaimer,≤100
8501031021,VoteVets.org,VOTEVETS,1871
422926228038526,Bijaya Khadka,Bijaya Khadka,≤100
45537846838,Piedmont Land Conservancy,PIEDMONT LAND CONSERVANCY,≤100
106032490920955,Comfort In Flavors,These ads ran without a disclaimer,≤100
317667194946264,Ro Khanna,RO FOR CONGRESS INC,728
72931140459,Center for Biological Diversity,"CENTER FOR BIOLOGICAL DIVERSITY, INC.",4349
463776733660003,Patriot Health Alliance,4Patriots LLC,146
100232231521671,Patriots of US,DEVYN MICHAEL LOWE-GREEN,≤100
20665390582,Medical Aid for Palestinians,These ads ran without a disclaimer,≤100
1233341320084881,Dolton School District 149,"David Ormsby, Inc.",≤100
106640017440240,Bangar Reddy For Congress 2020,BANGAR REDDY FOR CONGRESS,≤100
514537161972039,Extraordinary Hearts: The Gay Science Papers,Nicholas F Benton,≤100
107665777421699,Always Check Your Car,Tamara Kerona Lindo,≤100
341715643214947,The Last House Standing,These ads ran without a disclaimer,≤100
1934259593461621,Alternative Facts,Into The Garbage Chute,≤100
322311444154,Ounce of Prevention Fund,OUNCE OF PREVENTION FUND,3205
299811020041285,JWilMusic,These ads ran without a disclaimer,≤100
157622235096160,Jim Davis,JIM DAVIS FOR CONGRESS,≤100
114294110130045,Beloveth,These ads ran without a disclaimer,≤100
102999361267720,Political Science Resarch in U.S. Politics,Kisoo Kim,≤100
146325688716898,School Choice Week,National School Choice Week,880
176190622430564,Chris McCall for Peoria County State's Attorney,Christopher S Mccall,135
176940959017718,Mayor Frank C. Ortis,Mayor Frank Ortis,≤100
249220035141307,Planned Parenthood of Indiana and Kentucky,Planned Parenthood of Indiana and Kentucky,311
100354821528293,Ramire Valerio 2020,These ads ran without a disclaimer,≤100
18356619353,The Academy of Natural Sciences,The Academy of Natural Sciences,≤100
1628718874009155,Underwood for President 2020,These ads ran without a disclaimer,≤100
296402130475484,Iowa Student Loan,IOWA STUDENT LOAN LIQUIDITY CORPORATION,1324
523687081355042,FPG,These ads ran without a disclaimer,≤100
45436877937,University of California Television (UCTV),UCTV - University of California Television,≤100
124155874263916,Participant Media,These ads ran without a disclaimer,≤100
459890014763287,Rocky Mountain Values,Rocky Mountain Values,≤100
679809018806272,O‘ahu County Democratic Party,O'ahu County Democratic Party,≤100
114994916573293,CareForAllChildren,These ads ran without a disclaimer,≤100
310797295847,Indiana House Democrats,Indiana House Democratic Caucus,≤100
97466887664,Innocence Project,"INNOCENCE PROJECT, INC., THE",814
67262126186,McPherson College,MCPHERSON COLLEGE,≤100
110316380149,Family Policy Alliance,Family Policy Alliance,136
306861209425563,Bob Fioretti,Friends of Bob Fioretti,336
1005263149506969,Kimberly Ellis,Kimberly Ellis,≤100
12543834394,Glenside Public Library District,GLENSIDE PUBLIC LIBRARY DISTRICT,375
469572736766472,La Pointe Foundation,These ads ran without a disclaimer,≤100
84258068778,FIRM Action,Center for Community Change Action,2254
130848666099,Business Forward,Business Forward Inc.,1498
497926117292150,Baby Trump Tour,James T Girvan,≤100
448010925604009,Cranky Uncles,Autonomy,≤100
103280727809641,Iowa Field Report,"Field Report Media, llc",≤100
108893800525289,ConMigo,These ads ran without a disclaimer,≤100
502773583457238,CHILLFILTR.com,Krister Bjornson Axel,≤100
849616161903814,929 English,These ads ran without a disclaimer,≤100
1333129930100627,Eric Brakey for Congress,BRAKEY FOR CONGRESS,≤100
84362873172,Upbring,These ads ran without a disclaimer,≤100
2162438527407077,Sallie for the City,Sallie Alcorn Campaign,≤100
163653136980951,National Osteoporosis Foundation,National Osteoporosis Foundation,≤100
105603194323592,Media Trades,Bowdoin College,≤100
104059677748945,Teach Coalition,UNION OF ORTHODOX JEWISH CONGREGATIONS OF AMERICA,≤100
203330919857759,All On The Line,National Redistricting Action Fund,2559
132732160104163,Ford Foundation,"FORD FOUNDATION, THE",≤100
149087565118691,Corbella Clinic,Corbella Clinic,121
65102420955,NYS  Department of Environmental Conservation,These ads ran without a disclaimer,≤100
111395137046521,Viaty Stain Removal Toothpaste,These ads ran without a disclaimer,≤100
